"lahiy pasiyasing uziy.","No photographing either.","拍照也不要。","https://web.klokah.tw/text/sound/36101/563586.mp3"
"mahaway su amalu su su pana’ut.","Thank you for accepting the interview.","謝謝你讓我訪問。","https://web.klokah.tw/text/sound/36101/563587.mp3"
"ungat ya’ih niya, nanu ku sapa’ut su ga pa’ut.","You are welcome. What would you like to know?","沒問題，你想問什麼。","https://web.klokah.tw/text/sound/36101/563588.mp3"
"ma’ut kung su nanu ku yayauwa su saku la’i su?","What do you do when you are young?","請問您年輕時是做什麼的?","https://web.klokah.tw/text/sound/36101/563589.mp3"
"salali ga minkung kinsat, hani la ga malax kung la.","I was a police officer but I am retired now.","我以前是警察，但我現在退休了。","https://web.klokah.tw/text/sound/36101/563590.mp3"
"nanu u misu hani ga kiyan ki su pamahun aw?","Then, are you working at the moment?","那你現在有工作嗎?","https://web.klokah.tw/text/sound/36101/563591.mp3"
"niya kung i ma’umah yuwaw pakaba’an biru.","I am working at school.","我在學校上班。","https://web.klokah.tw/text/sound/36101/563592.mp3"
"niya kung ma’ut maha u niya maki alang ku lala’i su aw?","Do your kids live in the tribe too?","請問您的孩子也住在部落嗎?","https://web.klokah.tw/text/sound/36101/563593.mp3"
"ini, niya maki i uwis kwara lala’i mu.","No, my kids are all living in the city.","不，我的孩子在都市居住。","https://web.klokah.tw/text/sound/36101/563594.mp3"
"aw su i utux nanak hi maki sali la?","Then, do you live by yourself?","那你自己一個人住嗎?","https://web.klokah.tw/text/sound/36101/563595.mp3"
"kiyan utux huzin ru utux kabahani mu. utux mu sali laha uziy.","I also keep a dog and a bird. They are my family.","我還有養一隻狗和一隻鳥，他們也是我的家人。","https://web.klokah.tw/text/sound/36101/563596.mp3"
"kiyan utux ngiyaw mu uziy, kiya ku yanux psabays ga ini ka’ilang.","I have a cat too. I won’t get bored with the company of my pet.","我也有養一隻貓，有動物陪伴不會無聊。","https://web.klokah.tw/text/sound/36101/563597.mp3"
"muwa na ma’ut kung tikay kusa na gaga pasani na maliyap.","I would like to ask you about the taboos of hunting.","我想請問你關於打獵的禁忌。","https://web.klokah.tw/text/sound/36101/563598.mp3"
"ini kapayux ku ba’un mu, siki la kiya la ba’un mu ga nanu syukaw misu.","I don’t know much about that, but I will tell you everything I know.","我知道的不多，但我能回答的都會回答你。","https://web.klokah.tw/text/sound/36101/563599.mp3"
"kiya la sawun pasani ku babing mamu su ya’aya na aliyap aw?","Do you have any taboos about hunting weapons?","你們打獵的武器有什麼禁忌嗎?","https://web.klokah.tw/text/sound/36101/563600.mp3"
"mutu ini babingiy na kanayrin ku ya’aya aliyap miyan hani ki.","Our hunting weapons are untouchable to women.","我們打獵的武器不可以讓女生碰到。","https://web.klokah.tw/text/sound/36101/563601.mp3"
"nanu u mutu balay sarasun maliyap ku kanayrin aw?","Then, can women go hunting together?","那女人可以一起去打獵嗎?","https://web.klokah.tw/text/sound/36101/563602.mp3"
"ya’ih, mutu ini usa maliyap ku kanayrin hiya.","No, women cannot go hunting either.","不行，女人也不可以打獵。","https://web.klokah.tw/text/sound/36101/563603.mp3"
"Yupas, ungat uwaw micyu sali la, usa mabaziy uwaw micyu.","Yupas, our home is out of rice wine, please go and buy some.","Yupas，家裡沒有米酒了，你去買米酒。","https://web.klokah.tw/text/sound/36103/563634.mp3"
"kiya utux yuyut ki i pahapuyan, ka baziy la.","There is still one bottle left in the kitchen, so there is no need to buy one!","廚房裡還有一瓶，不用買吧!","https://web.klokah.tw/text/sound/36103/724730.mp3"
"ini katana utux yuyut, usa mabaziy lawziy su sazing yuyut han.","One bottle is not enough for me, go and buy two more back.","一瓶不夠，再去買兩瓶回來。","https://web.klokah.tw/text/sound/36103/563636.mp3"
"pabaziy kung su uwaw miyu, niya simu tabaziy aw?","I am looking for rice wine. Do you have any rice wine?","我要買米酒，你們有賣嗎?","https://web.klokah.tw/text/sound/36103/563637.mp3"
"kiyan ay! musa pisa ku banasun su?","Yes! How many bottles do you need?","有啊!你要買多少?","https://web.klokah.tw/text/sound/36103/563638.mp3"
"pabaziy kung su sazing yuyut, ru pabaziy kung lawziy su utux yubing buwax.","I want two bottles and a pack of rice.","我要買兩瓶，還要買一包米。","https://web.klokah.tw/text/sound/36103/563639.mp3"
"niya haniy ku bawax, kiyan ku banasun su na aw?","Here is the rice, what else do you need?","米在這裡，你還需要什麼嗎?","https://web.klokah.tw/text/sound/36103/563640.mp3"
"pabaziy kung su batu na, kiyan simu aw?","I want some eggs too, do you have some?","我還要買蛋，你們有嗎?","https://web.klokah.tw/text/sound/36103/563641.mp3"
"wayan miyan masu’un tabaziy laku batu la.","We are out of eggs.","我們的蛋賣完了。","https://web.klokah.tw/text/sound/36103/563642.mp3"
"pabaziy kung su latan.","I want to buy some clothes.","我要買衣服。","https://web.klokah.tw/text/sound/36103/563643.mp3"
"musa maha nanu ku kakusa niya pi?","What kind of clothes do you like?","你想要什麼樣子的呢?","https://web.klokah.tw/text/sound/36103/563644.mp3"
"pabaziy kung su ra’atung uzit na latan.","I want to buy the clothes with short sleeves.","我要買短袖的衣服。","https://web.klokah.tw/text/sound/36103/563645.mp3"
"maha nanu ku matanah haniy hiya ?","How about this red one?","這件紅色的如何?","https://web.klokah.tw/text/sound/36103/563646.mp3"
"kiyan ku natas binah iru na aw?","Do you have another color?","有別的顏色嗎?","https://web.klokah.tw/text/sound/36103/563647.mp3"
"kiyan ku iru pala’uw ru masingaw iru miyan na.","We have white and blue ones too.","我們還有白色和藍色。","https://web.klokah.tw/text/sound/36103/563648.mp3"
"bi’iy kung su utux na masingaw iru latan.","Please give me the clothes in blue.","請給我一件藍色的衣服。","https://web.klokah.tw/text/sound/36103/563649.mp3"
"Yumin manuwah su inu sawni? nuwah su mayuy ?","Yumin, where have you been just now? Did you go exercising?","Yumin你剛剛去哪裡了?你去運動嗎?","https://web.klokah.tw/text/sound/36103/563650.mp3"
"ayat, manuwah kung ramaw tabaziy tabihiy ni yaki mu .","No, I went grocery shopping for my grandma.","不是，我去幫奶奶賣菜。","https://web.klokah.tw/text/sound/36103/563651.mp3"
"han , kiyan hari su malahangan aw ? muwah su gamalu kuzing masu’un kagabiy aw!","No wonder! Are you available at night? Would you like to have a meal with me?","這樣啊，你晚上有沒有空?要不要和我一起吃飯！","https://web.klokah.tw/text/sound/36103/563652.mp3"
"ayat yu , musa kuzing mabaziy su latan.","No, I want to buy some clothes.","不行，我要去買衣服。","https://web.klokah.tw/text/sound/36103/563653.mp3"
"nanu u, hala kung gamaluw isu.","Then, I will go with you.","那我跟你一起去。","https://web.klokah.tw/text/sound/36103/563654.mp3"
"lawkah su ga, pa’usay misu pisa pila ku utux bahun tabihi hani?","Hello, how much is this bunch of vegetables?","你好，請問這把菜多少錢?","https://web.klokah.tw/text/sound/36103/563655.mp3"
"utux bahun tabihi hani ga mapusan pila.","The vegetables are $20 for a bunch.","菜一把20元。","https://web.klokah.tw/text/sound/36103/563656.mp3"
"pisa pila ku ngahi hani?","How much are these sweet potatoes?","這個地瓜多少錢?","https://web.klokah.tw/text/sound/36103/563657.mp3"
"utux tanatin ngahi hani ga matayun pila.","Sweet potatoes are thirty dollars for a pound.","地瓜一斤30元。","https://web.klokah.tw/text/sound/36103/563658.mp3"
"bi’iy kung su sazing bahun tabihi ru utux tanatin ngahi.","Please give me two bunches of vegetables and a pound of sweet potatoes.","請給我兩把菜和一斤地瓜。","https://web.klokah.tw/text/sound/36103/563659.mp3"
"Pitu, yangan mu maras inpit, musa su pakasiyuk kuzing aw?","Pitu, I forgot to bring my pen. Can you lend me one?","Pitu，我忘了帶筆，你可以借我嗎?","https://web.klokah.tw/text/sound/36105/563690.mp3"
"ungat kung uziy, hani ga mara ni Payan.","I don’t have one either. This is Payan’s.","我也沒有，這支是Payan的。","https://web.klokah.tw/text/sound/36105/563691.mp3"
"nanu kasyukay ta tikay han aw? yanga misu bi’an.","Can you lend me the pen for a second? I will return to you immediately.","那可以借我一下子嗎?我很快就還你。","https://web.klokah.tw/text/sound/36105/563692.mp3"
"aw, agan.","Sure, take it.","好，拿去。","https://web.klokah.tw/text/sound/36105/563693.mp3"
"mahuway su, mahuway su kusa Payan uziy ki.","Thank you and thank Payan for me.","謝謝，也幫我謝謝Payan。","https://web.klokah.tw/text/sound/36105/563694.mp3"
"nanu ku sawun su?","May I help you?","需要什麼嗎?","https://web.klokah.tw/text/sound/36105/563695.mp3"
"muwah kung pabaziy sazing biru haniy.","I want to return these two books.","我要還這兩本書。","https://web.klokah.tw/text/sound/36105/563696.mp3"
"aw ki, nanu lawziy ku galun su?","No problem and what else do you need?","好的，還需要什麼嗎?","https://web.klokah.tw/text/sound/36105/563697.mp3"
"pakasiyuk kung lawziy tugan biru .","I would like to borrow these three books.","我還要借這三本書。","https://web.klokah.tw/text/sound/36105/563698.mp3"
"asa la. lungi su tugan riyax laga wahiy may la ki.","Sure and remember to return them after three days.","好了。記得三天後要拿來還。","https://web.klokah.tw/text/sound/36105/563699.mp3"
"ini su bi’iy kung ku i’ing mu na.","You haven’t returned me the eraser.","你還沒還我橡皮擦。","https://web.klokah.tw/text/sound/36105/563700.mp3"
"wayan misu bi’an saku sahaysa la","I returned it yesterday.","我昨天就還了。","https://web.klokah.tw/text/sound/36105/563701.mp3"
"nanu huwa ka ini luy ku i’ing mu la.","Then, why is my eraser missing?","那我的橡皮擦怎麼不見了。","https://web.klokah.tw/text/sound/36105/563702.mp3"
"ini su wayan pakasyuki ni Yayut pi.","Did you lend it to Yayut?","你是不是借給Yayut了。","https://web.klokah.tw/text/sound/36105/563703.mp3"
"ini mu ba’iy, halay mu ma’ut hiya.","I don’t know. I will go and ask her.","我不知道，我去問問她。","https://web.klokah.tw/text/sound/36105/563704.mp3"
"namaw misu kasiyuk ku i’ing mu han.","I will lend you my eraser first.","我的橡皮擦先借你。","https://web.klokah.tw/text/sound/36105/563705.mp3"
"Siwat, kinsyukan su ki Baysu ku latan haniy?","Siwat, did Siwat lend you this coat?","Siwat，這個外套是Baysu借你的嗎?","https://web.klokah.tw/text/sound/36105/563706.mp3"
"ayat, hani ga banaziy kung ni yaya mu ki.","No, my mom bought it for me.","不是，這是我媽媽買給我的。","https://web.klokah.tw/text/sound/36105/563707.mp3"
"matana ki isu ku latan uba ni Watan.","Watan’s coat is the same as yours.","Watan的外套跟你的一樣。","https://web.klokah.tw/text/sound/36105/563708.mp3"
"uba niya ga makalux iruw hiya, ini patana ki sami ku iruw niya.","His coat is black, so our colors are different.","他的外套是黑色的，我們的顏色不一樣。","https://web.klokah.tw/text/sound/36105/563709.mp3"
"Simuy, kinsiyuk su pila ni Tahus aw?","Simuy, did you borrow money from Tahus?","Simuy，你有跟Tahus借錢嗎?","https://web.klokah.tw/text/sound/36105/563710.mp3"
"hu, naki sawni ku awsa mu may hiya, yangan mu maras su pila la.","Yes, I was supposed to return to him today, but I forgot to bring the money.","有，我本來今天要還他，我忘記帶錢了。","https://web.klokah.tw/text/sound/36105/563711.mp3"
"nanu u kanuwaw ku usa su pabazih hiya ?","Then, when will you return the money?","那你什麼時候要還?","https://web.klokah.tw/text/sound/36105/563712.mp3"
"halan mu may sasan la.","I will return to him tomorrow.","我明天就還給他。","https://web.klokah.tw/text/sound/36105/563713.mp3"
"aw, ragay misa kamayan Tahus.","Okay, I will tell Okay, I will tell  for you. for you.","好，我幫你跟Tahus說。","https://web.klokah.tw/text/sound/36105/563714.mp3"
"awlit ga isi ki ta’uya su marahan ta’atum, pakuhiy ga isi ki talangan su tiri awlu, ya’ani ku ini patakari.","It is correct to catch mice through rangay and catch bamboo partridges through qjiulang.","老鼠應該要⽤⽯壓式陷阱抓，⽵雞應該要⽤套頸式陷阱抓，這樣才對。","https://web.klokah.tw/text/sound/36107/563745.mp3"
"aw sawun kaniy, niya mu takariyun la, misa su mutu kung ini tiri.","","原來是這樣，我都搞錯了，難怪我都抓不到。","https://web.klokah.tw/text/sound/36107/563746.mp3"
"nanu u pasaba’ay misu sazing taya’an ru sawun nanu pawsa su ta’uya.","Then I will teach you how to set up these two traps.","那我再教你怎麼製作這兩種陷阱。","https://web.klokah.tw/text/sound/36107/563747.mp3"
"aw ru! ya’asa balay! ya’ani la ga suru niya musa kung tiri su sinuw uziy la.","Great! I will be able to catch the prey in the future.","好啊！太棒了！這樣我以後就會抓到獵物了。","https://web.klokah.tw/text/sound/36107/563748.mp3"
"ruyux ku ka’aman sala la, haliy magan ki kahu na sawki, hala ta i sala.","The grass in the fields is too tall. Go to the warehouse to take the sickle and let’s go to the fields.","田裡的草太長了，你去倉庫拿鐮刀，我們去田裡。","https://web.klokah.tw/text/sound/36107/563749.mp3"
"ki siyun inu ku sawki?","Where are the sickles?","鐮刀放在哪裡?","https://web.klokah.tw/text/sound/36107/593982.mp3"
"ki siyaw na kahu ku luku  , mayup su kahu laga taxan su la.","It is next to the round basket. You will see it when you enter the warehouse.","在圓簍的旁邊，你進去倉庫就會看到了。","https://web.klokah.tw/text/sound/36107/563750.mp3"
"pinbaga magan, laxiy agan pangih, hingu ku sawki.","Be careful and don’t get hurt. The sickle is very sharp.","小心拿，不要受傷，鐮刀很利。","https://web.klokah.tw/text/sound/36107/563751.mp3"
"laxiy i pa’aliy ku ta’uya mu ki!","Don’t step on my trap!","不要踩到我的陷阱!","https://web.klokah.tw/text/sound/36107/563752.mp3"
"ki inu ku ta’uya su?","Where is your trap?","你的陷阱在哪裡?","https://web.klokah.tw/text/sound/36107/593983.mp3"
"ki i yahu na kahawni hasa ku ta’uya mu.","My trap is under that tree.","我的陷阱在那棵樹的下面。","https://web.klokah.tw/text/sound/36107/563753.mp3"
"huwa su ba’un lmngalung?","How do you remember?","你怎麼會記得?","https://web.klokah.tw/text/sound/36107/593984.mp3"
"niyan mu siyun su turing, ku runi , ba’un mu kiy inu ku ta’uya mu.","I make a mark here, so I know where my trap is.","我在這邊有做記號，我知道我的陷阱在哪裡。","https://web.klokah.tw/text/sound/36107/563754.mp3"
"hani ga saguyu, saguyu miyan siyux i siyaw na gawng.","This is a fish trap which we put beside the river for fishing.","這是魚筌，我們放在溪邊捕魚。","https://web.klokah.tw/text/sound/36107/563755.mp3"
"ungat ku saguyu miyan hasa hiya, mutu sami isi panayp magan siyux.","We don’t have any fish traps there, so we catch fish with a fishing rod.","我們那邊沒有魚筌，我們都用釣竿抓魚。","https://web.klokah.tw/text/sound/36107/563756.mp3"
"ayat kung nabing su bawli nayp na, pasaba’iy kung sautux aw?","I have never used a fishing rod before, would you mind teaching me next time?","我沒有用過釣竿，你下次教我好嗎?","https://web.klokah.tw/text/sound/36107/563757.mp3"
"aw yu ! pagaluw ta sa’utux musa panayp","Sure! Let’s go fishing together next time.","好啊!我們下次一起去釣魚。","https://web.klokah.tw/text/sound/36107/563758.mp3"
"nanu u pasaba’ay misu tamuni su saguyu sa’utux.","I will teach you how to make a fish trap next time.","那我下次教你做魚筌。","https://web.klokah.tw/text/sound/36107/563759.mp3"
"niya maha tari tari ku nayp su la, ini ka niya tiri su siyux, haziy i haliy pasakalu.","Your fishing rod is moving. Isn’t the fish on the hook? Pull it up!","你的釣竿動了，是不是有魚上鉤了，你快拉起來。","https://web.klokah.tw/text/sound/36107/563760.mp3"
"na tikay, maylay sa’ayung ku asu, niya kung ti hani pasakaluw nayp, haliy kung ramaw magan su tahung aras runi . aw","Wait, the ship is rolling heavily. I am here to pull the fishing rod and you should go there to grab me the net.","等等，船太晃了，我在這邊拉釣竿，你去那邊幫我拿網子來。","https://web.klokah.tw/text/sound/36107/563761.mp3"
"sakalagiy isu ku siyux pakura ki kuzing, ragay misu pasakalu.","Pull the fish to my side and I will help you pull it up.","你把魚拉到我這邊，我幫妳拉起來。","https://web.klokah.tw/text/sound/36107/563762.mp3"
"tiya kinbalay! payux ku anagan ta  , sapun siyax kwara ku yawa la.","Great! It is a bumper crop today with full fish baskets.","太好了!今天大豐收，魚簍都裝滿了。","https://web.klokah.tw/text/sound/36107/563763.mp3"
"tila la, halay ta amasu kwara galuw ta.","Let’s go back immediately and share it with everyone.","我們快回去和大家分享。","https://web.klokah.tw/text/sound/36107/563764.mp3"
"niyan psba  biru la.","The teacher is here.","老師來了。","https://web.klokah.tw/text/sound/63238/884706.mp3"
"laxiy gnaw la, ihiy tl’ung tlngan.","Stop playing and quickly sit in your seat.","不要再玩了，快坐在座位上。","https://web.klokah.tw/text/sound/63238/884707.mp3"
"swali, kung ksu’iy kung la.","Sorry, I’m late!","抱歉，我遲到了。","https://web.klokah.tw/text/sound/63238/884708.mp3"
"ihiy uwah sahuy.","Come in quickly.","快進來。","https://web.klokah.tw/text/sound/63238/884709.mp3"
"soni ga te pisa ryax?","What day is it today?","今天星期幾?","https://web.klokah.tw/text/sound/63238/884710.mp3"
"soni ga te magan ryax, sasan ga phngi, hata mgluw musa mgnaw.","It’s Friday today, we have a day off tomorrow. Let’s go out and play together!","今天星期五，明天放假，一起出去玩吧。","https://web.klokah.tw/text/sound/63238/884711.mp3"
"aw! hata syaw llyung.","Great! Let’s go to the riverside.","好啊!我們去河邊。","https://web.klokah.tw/text/sound/63238/884712.mp3"
"te pisa ryax sasan la?","What day will it be tomorrow?","明天星期幾?","https://web.klokah.tw/text/sound/63238/884713.mp3"
"sasan ga te tugan ryax, hata tmpak mari ’lyan sasan ki!","Tomorrow will be Wednesday. Let’s go play ball tomorrow afternoon!","明天星期三，我們明天下午去玩球吧!","https://web.klokah.tw/text/sound/63238/884714.mp3"
"nanu yaw su mgyebu sasan?","What will you be doing tomorrow morning?","你明天早上要做什麼?","https://web.klokah.tw/text/sound/63238/884715.mp3"
"sasan ga ryax rehay, pgluw kung yaya musa kyokay.","Tomorrow will be Sunday, I will be going to church with my mom.","明天是星期日，我要和媽媽去教會。","https://web.klokah.tw/text/sound/63238/884716.mp3"
"su nanu la?","What’s wrong?","你怎麼了?","https://web.klokah.tw/text/sound/63238/884717.mp3"
"kputa kung, mmosa kung pstiyan.","I feel like vomiting. I need to go to the restroom.","我想吐，我要去廁所。","https://web.klokah.tw/text/sound/63238/884718.mp3"
"cyaki mtkgin tunux mu.","I feel dizzy.","我頭好暈。","https://web.klokah.tw/text/sound/63238/884719.mp3"
"isu ga psromun mhngi han.","Lie down and rest.","你趴著休息。","https://web.klokah.tw/text/sound/63238/884720.mp3"
"psba biru, mxayan nbuwas mu, musa kung pstiyan.","Teacher, I have a stomachache. I need to go to the restroom.","老師，我肚子痛，要去廁所。","https://web.klokah.tw/text/sound/63238/884721.mp3"
"aw, ihiy usa.","Okay, go quickly.","好，快一點去。","https://web.klokah.tw/text/sound/63238/884722.mp3"
"lay kung musa mema ’ba?","May I go wash my hands?","我可以去洗手嗎?","https://web.klokah.tw/text/sound/63238/884723.mp3"
"sobih ta phngi la, naga cikay ru usa la.","It’s almost time for class to end. Wait a little longer.","快下課了，等一下再去。","https://web.klokah.tw/text/sound/63238/884724.mp3"
"psba biru, mxayan balay tunux mu, phngi kung ’lyan.","It’s almost time for class to end. Wait a little longer.","老師，我頭好痛，下午要請假。","https://web.klokah.tw/text/sound/63238/884725.mp3"
"aw, pinbaga nanak musa sali.","Okay, take care and go home.","好，回家小心。","https://web.klokah.tw/text/sound/63238/884726.mp3"
"psba biru, babaw rehay te utux ryax ga phngi kung, mmosa kung ptayux kuysang.","Teacher, I need to take a sick leave next Monday. I have to see a doctor.","老師我下禮拜一要請假，我要去看醫生。","https://web.klokah.tw/text/sound/63238/884727.mp3"
"aw, nblay mlahang hi.","Alright, take care of yourself.","好，保重身體。","https://web.klokah.tw/text/sound/63238/884728.mp3"
"ki inu Sayun?","Where is Sayun?","Sayun在哪裡?","https://web.klokah.tw/text/sound/63238/884729.mp3"
"mxayan nbuwas nya, ki pstiyan.","She has a stomachache. She’s in the restroom.","她肚子痛，她在廁所。","https://web.klokah.tw/text/sound/63238/884730.mp3"
"ki inu Hayung?","Where is Hayung?","Hayung在哪裡?","https://web.klokah.tw/text/sound/63238/884731.mp3"
"psba biru mxayan olu ni Hayung, phngi hiya kisa.","Teacher, Hayung has a sore throat. She took a sick leave today.","老師，Hayung喉嚨痛，今天請假。","https://web.klokah.tw/text/sound/63238/884732.mp3"
"huwa ka ini uwah Sayun?","Why didn’t Sayun come?","Sayun為甚麼沒來?","https://web.klokah.tw/text/sound/63238/884733.mp3"
"ki mkiluh tunux nya la.","She has a fever.","她發燒了。","https://web.klokah.tw/text/sound/63238/884734.mp3"
"kelaniy cikay isu nanak han.","Please introduce yourself.","請自我介紹。","https://web.klokah.tw/text/sound/63241/884772.mp3"
"lalu mu ga Walis Pihaw, mpuw kayan mu la.","My name is Walis Pihaw, and I’m 10 years old.","我叫Walis Pihaw，我今年10歲。","https://web.klokah.tw/text/sound/63241/884773.mp3"
"ima lalu su?","What’s your name?","你叫甚麼名字?","https://web.klokah.tw/text/sound/63241/884774.mp3"
"lalu mu ga Walis Pihaw.","My name is Walis Pihaw.","我叫Walis Pihaw。","https://web.klokah.tw/text/sound/63241/884775.mp3"
"la’i su na nanu zok?","What ethnic group are you from?","你是哪一族的小孩?","https://web.klokah.tw/text/sound/63241/884776.mp3"
"kuzing ga la’i Tayan.","I’m from the Atayal.","我是泰雅族小孩。","https://web.klokah.tw/text/sound/63241/884777.mp3"
"Gyenzyumin kwara utux sali mamu?","Are all your family members indigenous?","你的家人都是原住民嗎?","https://web.klokah.tw/text/sound/63241/884778.mp3"
"hu, Tayan sami kwara utux sali.","Yes, my whole family is Atayal.","是的，我們全家都是泰雅族人。","https://web.klokah.tw/text/sound/63241/884779.mp3"
"Gyenzyumin kwara utux sali mamu?","Are all your family members indigenous?","你的家人都是原住民嗎?","https://web.klokah.tw/text/sound/63241/884780.mp3"
"’yat, yaba mu ga Tayan, yaya mu ga sehu.","No, my father is Atayal, and my mother is Han Taiwanese.","不是，我的爸爸是泰雅族，我的媽媽是漢人。","https://web.klokah.tw/text/sound/63241/884781.mp3"
"la’i su ni ima?","Whose child are you?","你是誰的小孩?","https://web.klokah.tw/text/sound/63241/884782.mp3"
"la’i kung ni Maray Kumay.","I am Maray Kumay’s child.","我是Maray Kumay的小孩。","https://web.klokah.tw/text/sound/63241/884783.mp3"
"hiya ga yaba su? pisa kayan nya la?","Is that your father? How old is he?","那位是你爸爸嗎? 他幾歲了?","https://web.klokah.tw/text/sound/63241/884784.mp3"
"hu, hiya ga yaba mu, mt’yu pgan kayan nya la.","He is 60 years old.","是的，他是我爸爸，六十歲了。","https://web.klokah.tw/text/sound/63241/884785.mp3"
"hasa ga yaba su? pisa kayan nya la?","Is that your father? How old is he?","那位是你爸爸嗎? 他幾歲了?","https://web.klokah.tw/text/sound/63241/884786.mp3"
"’yat, hiya ga nbkis alang myan, mspat pgan kayan nya la.","No, he is an elder of our tribe. He is 80 years old.","不是，他是我們部落的耆老，他80歲了。","https://web.klokah.tw/text/sound/63241/884787.mp3"
"pisa kayan bsuyan su tmalung la?","How old is your brother?","你哥哥幾歲了?","https://web.klokah.tw/text/sound/63241/884788.mp3"
"mpuw mspat kayan bsuyan mu tmalung la.","My brother is 18 years old.","我哥哥18歲了。","https://web.klokah.tw/text/sound/63241/884789.mp3"
"twahiy hinnari kayan mamu ki bsuyan su tmalung?","Is your brother much older than you?","你哥哥年紀比你大很多嗎?","https://web.klokah.tw/text/sound/63241/884790.mp3"
"magan kayan hinnari myan.","We have a 5-year age difference.","我們差5歲。","https://web.klokah.tw/text/sound/63241/884791.mp3"
"pisa kinwawi su?","How tall are you?","你身高多少?","https://web.klokah.tw/text/sound/63241/884792.mp3"
"kbhun mspatun kungbun kinwawi mu.","I’m 140 centimeters.","我140公分。","https://web.klokah.tw/text/sound/63241/884793.mp3"
"bsya ta ini pktayux la, wayan su tmwang kinwawai lrwa?","I haven’t seen you in a while. Have you grown taller?","好久不見，你是不是長高了?","https://web.klokah.tw/text/sound/63241/884794.mp3"
"hu yu, kbhun mtyun kungbun kinwawi mu la.","Yes, I’m 130 centimeters now.","對阿，我130公分了。","https://web.klokah.tw/text/sound/63241/884795.mp3"
"wayan su kthuy lrwa?","Have you gained weight?","你是不是胖了?","https://web.klokah.tw/text/sound/63241/884796.mp3"
"ini ay, tkari su tayux la.","No, you’re mistaken.","沒有，你看錯了。","https://web.klokah.tw/text/sound/63241/884797.mp3"
