"galun mu utux yubing pinkan hani."," I want this packet of cookies.","我要這包餅乾。","https://web.klokah.tw/text/sound/27009/443137.mp3"
"pinkan hani ga mtayun pila, pa’agan su yuwaw binah na aw?"," $30 for the cookies, anything else you need?","這餅乾30元，還需要別的東西嗎?","https://web.klokah.tw/text/sound/27009/443138.mp3"
"musa balayi i kasiyuk kung pila su aw?"," Can I borrow money from you?","我可以跟你借錢嗎?","https://web.klokah.tw/text/sound/27010/443139.mp3"
"ini kung aras pila uziy ki!","","我也沒帶錢耶!","https://web.klokah.tw/text/sound/27010/443142.mp3"
"yamngiya kung maras su pila la,musa balayi i kasiyuk kung pila su aw?"," I forgot to bring money, can I borrow money from you?","我忘記帶錢了，我可以跟你借錢嗎?","https://web.klokah.tw/text/sound/27010/443143.mp3"
"laxiy ,tiku kinsyuk su su sarali na pilaini mu naga ini su bi’i na."," No, you haven't paid me back the money you borrowed last time.","不要，上次借的錢你都還沒還我。","https://web.klokah.tw/text/sound/27010/478561.mp3"
"musa balayi i kasiyuk kung tikay latan su aw?"," Can I borrow your clothes?","我可以借你的衣服嗎?","https://web.klokah.tw/text/sound/27010/478562.mp3"
"aw, haliy magan nanak."," Well, you take it yourself.","好，你自己拿。","https://web.klokah.tw/text/sound/27010/478563.mp3"
"musa balayi kasiyuk kung biru su aw?"," Can I borrow your book?","我可以借你的書嗎?","https://web.klokah.tw/text/sound/27010/443147.mp3"
"wayan mu pakasiyu ki Lawa la."," I lent it to Lawa.","我借給Lawa了。","https://web.klokah.tw/text/sound/27010/478564.mp3"
"pakasyuki kung na lilinsa’ su wa?"," Can I borrow your bicycle, please?","請借給我你的腳踏車好嗎?","https://web.klokah.tw/text/sound/27010/443149.mp3"
"aw, sikila ga wahiy mayi lawziy sasan ki."," Okay, but you have to give it back to me tomorrow."," 好，但是明天要還給我。","https://web.klokah.tw/text/sound/27010/478565.mp3"
"niyan mawalax la, ini kung aras su tabakuy, kasiyuki kung tikay tabakuy aw?"," It's raining, I don't have an umbrella, can you lend me one?","下雨了，我沒有帶傘，借我傘好嗎?","https://web.klokah.tw/text/sound/27010/478566.mp3"
"utux balay ku tabakuy mu, pagalagaw ta amamuk ki!"," I only have an umbrella, let's stick together!"," 我只有一把傘，我們一起撐吧!","https://web.klokah.tw/text/sound/27010/478567.mp3"
"biru hani ga kinsiyuk misu su wayan ka sa’utux, pabazih misu la."," This is the book you borrowed from me last time, I give it back to you.","這是你上次借我的書，還給你。","https://web.klokah.tw/text/sound/27010/443153.mp3"
"yahani ku pinkasiyuk su kung na biru, ba’anay misu la."," This is the book you borrowed from me last time, I give it back to you.","這是你上次借我的書，還給你。","https://web.klokah.tw/text/sound/27010/478568.mp3"
"atu na samawgan su matauax nanu biru na ga, kayan kung lawziy ki.","You can tell me what else you want to read.","還想看什麼書都可以跟我說。","https://web.klokah.tw/text/sound/27010/443154.mp3"
"kanuwan ku awsa mu pabzih pila su la?"," When do I have to pay you back?","我什麼時候要還你錢?","https://web.klokah.tw/text/sound/27010/443155.mp3"
"nuway iri’, kiyan ku luwan su laga pakyalay ta kiya la."," It's okay, you can talk about it when you have money.","沒關係，你有錢的時候再說。","https://web.klokah.tw/text/sound/27010/443156.mp3"
"kanuwan ku ’uwah su pabazih pila mu la?"," When are you going to pay me back?","你什麼時候要還我錢?","https://web.klokah.tw/text/sound/27010/443157.mp3"
"wahay mu mayi sasan ku pila su."," I will return it to you tomorrow.","我明天還你。","https://web.klokah.tw/text/sound/27010/478569.mp3"
"kanuwan ku ’uwah su pabazih biru mu la?"," When are you going to return my book?","你什麼時候要還我書?","https://web.klokah.tw/text/sound/27010/443159.mp3"
"ayat misu wayan sabay su sahaysa ku biru su la pi?"," Didn't I return it to you yesterday?","我昨天不是已經還你了嗎?","https://web.klokah.tw/text/sound/27010/478570.mp3"
"ti ku babiru’ hani ga pinkasyuk su ni Masaw pi?"," Did Masaw lend you this pen?","這支筆是Masaw借你的嗎?","https://web.klokah.tw/text/sound/27010/443161.mp3"
"hu, kinsiyuk mu ki hiya su sawni."," Yes, I borrowed it from him today.","對，我今天跟他借的。","https://web.klokah.tw/text/sound/27010/478571.mp3"
"kinsuyuk su ki Maray ku inpit hani pi?"," Did you borrow this pen from Maray?","這支筆是你跟Maray借的嗎?","https://web.klokah.tw/text/sound/27010/443163.mp3"
"ayat ,banaziy ni yaya mu."," No, this is what mom bought.","不是，這是媽媽買的。","https://web.klokah.tw/text/sound/27010/478572.mp3"
"ungat ku Tamuyux la,usa kasyuk tamuyux ki Sayun."," We are out of salt, let's borrow some from Sayun.","沒有鹽了，去跟Sayun借點鹽。","https://web.klokah.tw/text/sound/27010/443165.mp3"
"aw, halay mu kasiyuk."," Okay, I'll borrow it.","好，我去借。","https://web.klokah.tw/text/sound/27010/478573.mp3"
"hali kamayan i Puyap maha psugi pila mu la."," Go tell Puyap to give me my money back.","去叫Puyap還我錢。","https://web.klokah.tw/text/sound/27010/443167.mp3"
"haliy kamayan i Puyap maha pasiyugi ku pila mu."," Go tell Puyap to give me my money back.","去叫Puyap還我錢。","https://web.klokah.tw/text/sound/27010/478574.mp3"
"pisa ku kuhay niya pila ki isu pi?"," How much does she owe you?","她欠你多少錢呢?","https://web.klokah.tw/text/sound/27010/478575.mp3"
"musa su inu?"," Where are you going?","你要去哪裡?","https://web.klokah.tw/text/sound/27011/443169.mp3"
"musa kung muhi tabihi’ i ra’iri’."," I’m going to plant vegetables in the garden.","我要去菜園裡種菜。","https://web.klokah.tw/text/sound/27011/443170.mp3"
"nanu niya su i tawawun?"," What are you doing?","你在做什麼?","https://web.klokah.tw/text/sound/27011/443171.mp3"
"payux sa’ayun ka’amam la, niyan kung i samriyat ka’amam, kisa laga pasiyan mu siya’ la.","There's too much grass, I'm cutting it, I'll have to water it later.","草太多了，我在砍草，等一下要澆水。","https://web.klokah.tw/text/sound/27011/443172.mp3"
"ragiy kung tikay magan su sawki ru karuh aw?"," Will you get my scythes and hoes, please?","幫我把鐮刀和鋤頭拿來好嗎?","https://web.klokah.tw/text/sound/27011/478577.mp3"
"niyan su siyun inu pi?"," Where did you put it?","你放在哪裡呢?","https://web.klokah.tw/text/sound/27011/478578.mp3"
"ki mu siyun i bih na Kawin."," Put it next to the plow rake.","放在犁耙旁邊。","https://web.klokah.tw/text/sound/27011/443175.mp3"
"tanabun su ku uraw la?"," Did you turn over the soil?","你翻過土了嗎?","https://web.klokah.tw/text/sound/27011/478579.mp3"
"nisan mu i tanabun, pagahap kung kisa la."," I just turned over the soil, and so on to sow seeds.","我剛翻過土，等等要播種。","https://web.klokah.tw/text/sound/27011/443177.mp3"
"ba’un kamiyut ku panuhiy su na tabihi’ la?"," Are your vegetables ready to be harvested?","你種的菜可以收成了嗎?","https://web.klokah.tw/text/sound/27011/443178.mp3"
"musa ba’un kamiyut ku tamana hani hiya la,sina ti ki hasa hiya ga ayat ba’un kamiyut na."," The cabbage here is ready to be harvested, but the Showa grass there is not yet ready to be harvested.","這裡的高麗菜可以收成了，那裡的昭和草就還不能收成。","https://web.klokah.tw/text/sound/27011/478580.mp3"
"waw! tiya kinpayux kanuwih su na ngahi’."," (sighs) Wow! You dug up so many gourds.","哇!你挖了這麼多的地瓜。","https://web.klokah.tw/text/sound/27011/443180.mp3"
"ragiy kung pinta’ i kahu aw?"," Will you help me with the barn?","幫我放穀倉好嗎?","https://web.klokah.tw/text/sound/27011/443181.mp3"
"nanu ku ki mamu kabalayun?"," What are you doing?","你們在做什麼?","https://web.klokah.tw/text/sound/27011/443182.mp3"
"niya sami pawsa ttara’ su siyux."," We're releasing fishing nets to catch fish.","我們在放漁網抓魚。","https://web.klokah.tw/text/sound/27011/443183.mp3"
"payux ku siyux runi aw?"," Are there many fish here?","這裡的魚多嗎?","https://web.klokah.tw/text/sound/27011/478581.mp3"
"payux siyu laku niyan i pusung hani la."," The fish basket has been full of fish.","魚簍裡已經抓了很多魚。","https://web.klokah.tw/text/sound/27011/478582.mp3"
"mutu su maha nanu kamayap su siyux karariyax?"," How do you usually catch fish?","你平常怎麼抓魚?","https://web.klokah.tw/text/sound/27011/478583.mp3"
"mutu mu sabing su tawnux samabu su siyux."," I shoot fish with a spear.","我都用魚叉射魚。","https://web.klokah.tw/text/sound/27011/478584.mp3"
"mutu su sabing bahawni musa i maliyap aw?"," Do you know how to hunt with a bow and arrow?","你會用弓箭打獵嗎?","https://web.klokah.tw/text/sound/27011/443188.mp3"
"mutu kung pawsa su ta’uya’ tiri’ mu sinu, karuma’ ga mutu kung maras su patus ru huzin musa maliyap."," I usually catch my prey with a trap, but occasionally I hunt with a gun and a dog.","我通常都是用陷阱抓獵物，偶爾也會拿槍帶狗狩獵。","https://web.klokah.tw/text/sound/27011/443189.mp3"
"tu’iy hani ga anwahan na waywak nahi."," This is the road the boar took.","這是山豬所走的路。","https://web.klokah.tw/text/sound/27011/478585.mp3"
"uwa su ka ba’un pi?"," How do you know?","你怎麼知道呢?","https://web.klokah.tw/text/sound/27011/478586.mp3"
"hani ga pilung kuzih na waywak nahi’, misa su tu’i hakayan na waywak nahi’ ku hani."," These are the footprints of the boar, so this is the path the boar took.","這是山豬的腳印，所以這是山豬所走的路。","https://web.klokah.tw/text/sound/27011/443192.mp3"
"tanahaw ta musa matayux ku ta’uya ta ,asi ga niyan tari’un su asinu la."," Go and see our trap, for it seems that we have caught our prey.","快去看我們的陷阱，好像抓到獵物了。","https://web.klokah.tw/text/sound/27011/478587.mp3"
"huwa su ba’un pi?"," How do you know?","你怎麼知道呢?","https://web.klokah.tw/text/sound/27011/443194.mp3"
"asi ga wayan sawkan na huzin ku bawyas niya la .hazi ta musa gamalu kiya."," The dog seems to have smelled it. Let's follow them.","狗好像聞到味道了。我們快跟過去。","https://web.klokah.tw/text/sound/27011/478588.mp3"
"nanu ku niya su sakalayi su yuwaw hani?"," What are you working on?","你正在製作的是什麼東西?","https://web.klokah.tw/text/sound/27011/443196.mp3"
"hani ga ta’uya na marahan, mutu i tm’atum su awlit."," This is a stone trap, used to catch rats.","這是石壓式陷阱，用來抓老鼠的。","https://web.klokah.tw/text/sound/27011/443197.mp3"
"nanu ku niyan su sakuwan sa yuwaw ti hasa hiya?"," What is that thing you put there?","你放在那裡的是什麼東西?","https://web.klokah.tw/text/sound/27011/443198.mp3"
"hasa ga ta’uya na tiri su kuzih, mutu miyan tiri su para."," It was a leg-rigged rope trap, and we used it to catch Shankiang.","那是套腳式繩索陷阱，我們用它來抓山羌。","https://web.klokah.tw/text/sound/27011/443199.mp3"
"mahuway ku liyutux binkis ka mayi su awyat, kiyan ku bani’an ta niya asinu su sawni."," Thanks to the blessing of our ancestors, we had a great harvest today.","感謝祖靈賜福，今天我們有很多獵物收獲。","https://web.klokah.tw/text/sound/27011/478589.mp3"
"hu’ bayay la, rasaw ta inbalayi amalu’ alang ta la ki!"," Yeah! Let's take it back to the tribe and share it!","是啊!我們帶回部落好好分享吧!","https://web.klokah.tw/text/sound/27011/443201.mp3"
"hu balay la, rasaw ta inbalayi amasu i alang ta ki!"," Yeah! Let's take it back to the tribe and share it!","是啊!我們帶回部落好好分享吧!","https://web.klokah.tw/text/sound/27011/478590.mp3"
"pasaba’an sami kwara ni pasaba biru sawni ga, nanu sawun kayi Atayan ku lalahuy hiya.","I will teach everyone all kinds of plants in Tayal language today.","今天老師要教大家植物的泰雅語怎麼說。","https://web.klokah.tw/text/sound/36077/594983.mp3"
"laxiy abi.","","不要睡覺。","https://web.klokah.tw/text/sound/36077/594986.mp3"
"laxiy sanguwa.","Don’t talk","不要講話。","https://web.klokah.tw/text/sound/36077/563022.mp3"
"laxiy kani na ni’un.","Don’t eat.","不要吃東西。","https://web.klokah.tw/text/sound/36077/563023.mp3"
"agan ku biru su.","Take out your textbook.","拿出你的課本。","https://web.klokah.tw/text/sound/36077/563024.mp3"
"agan ku inpit su.","Take out your pen.","拿出你的筆。","https://web.klokah.tw/text/sound/36077/563025.mp3"
"sakuy ku inpit su.","Put your pen away.","把筆收起來。","https://web.klokah.tw/text/sound/36077/563028.mp3"
"sakuy ku nani’un su.","Put your food away.","把你的食物收起來。","https://web.klokah.tw/text/sound/36077/563029.mp3"
"ima inpit haniy hiya?","Whose pen is it?","這是誰的鉛筆?","https://web.klokah.tw/text/sound/36077/563031.mp3"
"mara mu.","It’s mine.","是我的。","https://web.klokah.tw/text/sound/36077/563032.mp3"
"ima biru haniy hiya?","Whose textbook is it?","這是誰的課本?","https://web.klokah.tw/text/sound/36077/563033.mp3"
"mara ni Tali.","It’s Tali’s.","是Tali的。","https://web.klokah.tw/text/sound/36077/563034.mp3"
"ima i’ing hani hiya?","Whose eraser is it?","這是誰的橡皮擦?","https://web.klokah.tw/text/sound/36077/563035.mp3"
"ini mu ba’iy!","I don’t know.","我不知道!","https://web.klokah.tw/text/sound/36077/563036.mp3"
"hasa ga latan ni Watan pi?","Is that Watan’s clothes?","那是Watan的衣服嗎?","https://web.klokah.tw/text/sound/36077/563037.mp3"
"ayat, hani ga uba ni Puyap.","No, this is Puyap’s coat.","不是，這是Puyap的外套。","https://web.klokah.tw/text/sound/36077/563038.mp3"
"pasaba biru, ini kung aras biru.","Teacher, I didn’t bring my textbook.","老師，我沒有帶課本。","https://web.klokah.tw/text/sound/36077/563039.mp3"
"pagalu matayux ki bih su galu miru.","Share the book with your classmate next to you.","跟旁邊同學一起看。","https://web.klokah.tw/text/sound/36077/563040.mp3"
"mapahuw ku inpit mu la.","My pencil is broken.","我的鉛筆斷了。","https://web.klokah.tw/text/sound/36077/563041.mp3"
"bing murun inpit miru.","Write with a ball pen.","用原子筆寫。","https://web.klokah.tw/text/sound/36077/563042.mp3"
"wayan mayuwaw ku i’ing mu la.","My eraser is missing.","我的橡皮擦不見了。","https://web.klokah.tw/text/sound/36077/563043.mp3"
"kasiyukay misu ku i’ing mu.","I will lend you my eraser.","我的橡皮擦借你。","https://web.klokah.tw/text/sound/36077/563044.mp3"
"kamasu ta miru la, pinbaga tu’iy musa su sali ki!","It is the end of the class, be careful on your way home.","我們要下課了，回家路上要小心!","https://web.klokah.tw/text/sound/36077/563045.mp3"
"aw. mahuway su pasaba biru.","Got it, thank you teacher.","好。謝謝老師。","https://web.klokah.tw/text/sound/36077/563046.mp3"
"kamasu ta miru la, masagaya ta kwara la.","The class is over, goodbye everyone.","我們要下課了，大家再見。","https://web.klokah.tw/text/sound/36077/563047.mp3"
"masagaya ta la pasaba biru.","Goodbye teacher.","老師再見。","https://web.klokah.tw/text/sound/36077/563048.mp3"
"lawkah simu kwara, lalu mu ga Baysu.","Hello everyone, my name is Baysu.","大家好，我的名字是Baysu。","https://web.klokah.tw/text/sound/36080/563086.mp3"
"lawkah su Baysu.","","Baysu你好。","https://web.klokah.tw/text/sound/36080/563087.mp3"
"lawkah simu kwara, lalu mu ga Tuyaw.","Hello everyone, my name is Tuyaw.","大家好，我的名字是Tuyaw。","https://web.klokah.tw/text/sound/36080/563088.mp3"
"lawkah su Tuyaw.","Hello, Tuyaw.","Tuyaw你好。","https://web.klokah.tw/text/sound/36080/563089.mp3"
"lawkah su, kuzing ga Laysa.","Hello, I am Laysa.","你好，我是Laysa。","https://web.klokah.tw/text/sound/36080/563090.mp3"
"lawkah su Laysa, kuzing ga Kagi.","Hello, Laysa, I am Kagi.","Laysa你好，我是Kagi。","https://web.klokah.tw/text/sound/36080/563091.mp3"
"lawkah su, kuzing ga Pawan.","Hello, I am Pawan.","你好，我是Pawan。","https://web.klokah.tw/text/sound/36080/563092.mp3"
"Buya lawkah su, kuzing ga Payan.","Hello, Buya, I am Payan.","Buya你好，我是Payan。","https://web.klokah.tw/text/sound/36080/563093.mp3"
"ima su?","Who are you?Who are you?","你是誰?","https://web.klokah.tw/text/sound/36080/563094.mp3"
"kuzing ga yaya ni Pisuy, kuzing ga Sayun.","I am Pisuy’s mom, Sayun.","我是Pisuy的媽媽，我是Sayun。","https://web.klokah.tw/text/sound/36080/563095.mp3"
"ima su?","","你是誰?","https://web.klokah.tw/text/sound/36080/563096.mp3"
"kuzing ga saway kanayrin ni Yupas, lalu mu ga Kagaw.","I am Yupas’s sister. My name is Kagaw.","我是Yupas的妹妹，我的名字是Kagaw。","https://web.klokah.tw/text/sound/36080/563097.mp3"
"ima hiya?","Who is he?","他是誰?","https://web.klokah.tw/text/sound/36080/563098.mp3"
"hiya ga pasaba biru mu, hiya ga Yumin.","He is my teacher, Yumin.","他是我的老師，他叫Yumin。","https://web.klokah.tw/text/sound/36080/563099.mp3"
"ima ku tayan hasa?","Who is that person?","那個人是誰?","https://web.klokah.tw/text/sound/36080/563100.mp3"
"hiya ga basuyan mu tamalung, hiya ga Yuraw.","He is my brother, Yuraw.","他是我的哥哥，他叫Yuraw。","https://web.klokah.tw/text/sound/36080/563101.mp3"
"hiya ga Pihaw pi?","Is he Pihaw?","他是Pihaw嗎?","https://web.klokah.tw/text/sound/36080/563102.mp3"
"huw, hiya ga Pihaw.","Yes, he is Pihaw.","是，他是Pihaw。","https://web.klokah.tw/text/sound/36080/563103.mp3"
"isu ga Piru pi?","Are you Piru?","你是Piru嗎?","https://web.klokah.tw/text/sound/36080/563104.mp3"
"ayat, kuzing ga Bawtu.","No, I am Bawtu.","不是，我是Bawtu。","https://web.klokah.tw/text/sound/36080/563105.mp3"
"ima ku Turay?","Who is Turay?","誰是Turay?","https://web.klokah.tw/text/sound/36080/563106.mp3"
"kuzing ku Turay.","I am Turay.","我就是Turay。","https://web.klokah.tw/text/sound/36080/563107.mp3"
"ima ku Kagi?","Who is Kagi?","誰是Kagi?","https://web.klokah.tw/text/sound/36080/563108.mp3"
"rawin mu ku Kagi.","Kagi is my friend.","Kagi是我的朋友。","https://web.klokah.tw/text/sound/36080/563109.mp3"
"nanu lalu ni basuyan su kanayrin?","What is your elder sister’s name?","你姐姐的名字是什麼?","https://web.klokah.tw/text/sound/36080/563110.mp3"
"Kumu ku lalu ni basuyan mu kanayrin.","My elder sister’s name is Kumu.","我的姐姐的名字是Kumu。","https://web.klokah.tw/text/sound/36080/563111.mp3"
"ima lalu ni saway su kanayrin?","What is your younger sister’s name?","你妹妹的名字是什麼?","https://web.klokah.tw/text/sound/36080/563112.mp3"
"Pisuy lalu ni saway mu kanayrin.","My younger sister’s name is Pisuy.","我的妹妹的名字是Pisuy。","https://web.klokah.tw/text/sound/36080/563113.mp3"
"ba’un su lalu niya?","Do you know his name?","你知道他的名字嗎?","https://web.klokah.tw/text/sound/36080/563114.mp3"
"Pasang ku lalu niya.","He is called Pasang.","他叫做Pasang。","https://web.klokah.tw/text/sound/36080/563115.mp3"
"pisa kayan ni basuyan su tamalung?","How old is your elder brother?","你哥哥今年幾歲?","https://web.klokah.tw/text/sound/36080/563116.mp3"
"mapu magan kayan niya la.","He is fifteen years old.","他今年15歲了。","https://web.klokah.tw/text/sound/36080/563117.mp3"
"pisa kayan ni saway su tamalung?","How old is your younger brother?","你弟弟今年幾歲?","https://web.klokah.tw/text/sound/36080/563118.mp3"
"magan kayan niya la.","He is five years old.","他今年5歲了。","https://web.klokah.tw/text/sound/36080/563119.mp3"
"kiya pakaba’an biru i alang mamu?","Do you have schools in your community?","你們的部落有學校嗎?","https://web.klokah.tw/text/sound/36080/563120.mp3"
"kiyan ga.","Yes.","有。","https://web.klokah.tw/text/sound/36080/563121.mp3"
"niya su miru saku pakaba’an biru i alang su?","Do you study in your tribe’s school?","你在部落的學校讀書嗎?","https://web.klokah.tw/text/sound/36080/563122.mp3"
"huw ga, isi sami ga utux su sali miru i pakaba’an biru.","Yes, we are like family while we are studying at school.","是的，在學校讀書我們像一家人。","https://web.klokah.tw/text/sound/36080/563123.mp3"
"ima ku tamalung hasa?","Who is that man?","那個男生是誰?","https://web.klokah.tw/text/sound/36083/563160.mp3"
"hiya ga mama mu.","","他是我叔叔。","https://web.klokah.tw/text/sound/36083/563161.mp3"
"ima ku kanayrin hasa?","Who is that woman?","那個女生是誰?","https://web.klokah.tw/text/sound/36083/563162.mp3"
"hiya ga basuyan mu kanayrin.","She is my sister.","她是我姐姐。","https://web.klokah.tw/text/sound/36083/563163.mp3"
"ima ku la’i hasa?","Who is that kid?","那個小孩是誰?","https://web.klokah.tw/text/sound/36083/563164.mp3"
"hiya ga saway mu tamalung.","He is my younger brother.","他是我的弟弟。","https://web.klokah.tw/text/sound/36083/563165.mp3"
"nanu ki patawawan ni yaya su?","What does your mother do?","你的媽媽從事什麼工作?","https://web.klokah.tw/text/sound/36083/563166.mp3"
"hiya ga hitay.","She is a soldier.","她是軍人。","https://web.klokah.tw/text/sound/36083/563167.mp3"
"nunu ki patawawan ni yaba su?","What does your father do?","你的爸爸從事什麼工作?","https://web.klokah.tw/text/sound/36083/563168.mp3"
"hiya ga pasaba biru.","He is a teacher.","他是老師。","https://web.klokah.tw/text/sound/36083/563169.mp3"
"hiya ga saway su tamalung?","Is he your younger brother?","他是你弟弟嗎?","https://web.klokah.tw/text/sound/36083/563170.mp3"
"ayat, hiya ga rawin ni saway mu tamalung.","No, he is my younger brother’s friend.","不是，他是我弟弟的朋友。","https://web.klokah.tw/text/sound/36083/563171.mp3"
"hiya ga basuyan su kanayrin?","Is she your elder sister?","她是你姊姊嗎?","https://web.klokah.tw/text/sound/36083/563172.mp3"
"ayat, hiya ga saway mu kanayrin.","No, she is my younger sister.","不是，她是我的妹妹。","https://web.klokah.tw/text/sound/36083/563173.mp3"
"pisa kwara hi ku sali naha?","How many people in their family?","他們全家有幾個人?","https://web.klokah.tw/text/sound/36083/563174.mp3"
"magan hi kwara ku sali naha.","There are five people in their family.","他們全家有五個人。","https://web.klokah.tw/text/sound/36083/563175.mp3"
"pisa kwara la’i sali mamu?","How many children in your family?","你們家有幾個小孩?","https://web.klokah.tw/text/sound/36083/563176.mp3"
"payat kwara ku la’i sali miyan.","There are four children in our family.","我們共有四個小孩。","https://web.klokah.tw/text/sound/36083/563177.mp3"
"pisa kwara ku saway su?","How many younger siblings do you have?","你有幾個弟妹?","https://web.klokah.tw/text/sound/36083/563178.mp3"
"ungat saway mu tamalung, kiyan tugan ku saway mu kanayrin.","I don’t have any younger brothers, but I have three younger sisters.","我沒有弟弟，有三位妹妹。","https://web.klokah.tw/text/sound/36083/563179.mp3"
"pisa kwara ku basuyan su?","How many older siblings do you have?","你有幾個兄姊?","https://web.klokah.tw/text/sound/36083/563180.mp3"
"ungat ku basuyan mu.","I don’t have any older siblings.","我沒有兄姊。","https://web.klokah.tw/text/sound/36083/563181.mp3"
"pisa kwara ku matasaway su?","How many siblings do you have?","你有幾個兄弟姐妹?","https://web.klokah.tw/text/sound/36083/563182.mp3"
"ungat ku matasaway mu.","I don’t have any siblings.","我沒有兄弟姐妹。","https://web.klokah.tw/text/sound/36083/563183.mp3"
"matasaway simu aw?","Are you brothers?","你們是兄弟嗎?","https://web.klokah.tw/text/sound/36083/563184.mp3"
"huw, hiya ga basuyan mu tamalung.","Yes, he is my brother.","是，他是我哥哥。","https://web.klokah.tw/text/sound/36083/563185.mp3"
"Yencumin simu aw?","Are you aboriginals?","你們是原住民嗎?","https://web.klokah.tw/text/sound/36083/563186.mp3"
"huw, Yencumin sami.","Yes, we are aboriginals.","是，我們是原住民。","https://web.klokah.tw/text/sound/36083/563187.mp3"
"hiya ga Atayan uziy pi?","Is she ’Tayal too?","她也是泰雅族人嗎?","https://web.klokah.tw/text/sound/36083/563188.mp3"
"huw, Atayan hiya uziy.","Yes, she is ’Tayal too.","是的，她也是泰雅族人。","https://web.klokah.tw/text/sound/36083/563189.mp3"
"maha nanu kayan sawni?"," How’s the weather today?","今天天氣如何?","https://web.klokah.tw/text/sound/36086/563228.mp3"
"masakinut kayan yu, kapayux manabuw siya kilux.","It’s a bit cold, so you need to drink more warm water.","天氣有點冷，要多喝熱水。","https://web.klokah.tw/text/sound/36086/563229.mp3"
"maha nanu kayan sawni?","How’s the weather today?","今天天氣如何?","https://web.klokah.tw/text/sound/36086/563230.mp3"
"makilux kayan yu, kapayux manabuw siya.","It’s a bit hot, so you need to drink more water.","天氣有點熱，要多喝水。","https://web.klokah.tw/text/sound/36086/563231.mp3"
"maha nanu kayan ti tanux?","How’s the weather outside?","外面天氣如何?","https://web.klokah.tw/text/sound/36086/563232.mp3"
"rahu witux niya, lungiy ku tasasi su kilux ki.","The sun is bright and remember to wear sunscreen.","太陽很大，要記得防曬。","https://web.klokah.tw/text/sound/36086/563233.mp3"
"maha nanu kayan ti tanux?","How’s the weather outside?","外面天氣如何?","https://web.klokah.tw/text/sound/36086/563234.mp3"
"payux yulung niya, ungat witux ku babaw kayan.","There are a lot of clouds but no sun in the sky.","雲很多，天空沒有太陽。","https://web.klokah.tw/text/sound/36086/563235.mp3"
"pakusa nanu kayan sasan?","How is the weather tomorrow?","明天天氣如何?","https://web.klokah.tw/text/sound/36086/563236.mp3"
