"iqualh, ya mundadaan ashaunatantuiza.","Yes, it is within walking distance.","很近，走路就會到。","https://web.klokah.tw/text/sound/36290/568195.mp3"
"kmaan afu a taun makitqualh sa ia’ianan milhungqu a barimbin a taun qa?","Is the restaurant close to the station?","餐廳離車站近嗎?","https://web.klokah.tw/text/sound/36290/568196.mp3"
"ya mu’apaw sa ia’ianan milhungqu a barimbin a taun uqthawan mundadaan larima wa qumbu ashaunatantuiza.","It only takes five minutes after you walk out of the station.","出車站再走五分鐘就到了。","https://web.klokah.tw/text/sound/36290/568197.mp3"
"ishawanan uhu thuini?","Are you available today?","你今天有空嘛?","https://web.klokah.tw/text/sound/36293/568237.mp3"
"minu qa?","What is the matter?","怎麼了?","https://web.klokah.tw/text/sound/36293/568238.mp3"
"amusui iaku mriqaz ihun.","I would like to visit you.","我想去拜訪你。","https://web.klokah.tw/text/sound/36293/568239.mp3"
"thuini iaku uka shawan numawan uka itaun. suma wa qali shduuiza.","I am out today. How about another day?","我今天有事不在家。改天吧。","https://web.klokah.tw/text/sound/36293/568240.mp3"
"ishawanan uhu ya simaq? amakilhim iaku ihun ya saqaziza.","Then, are you available tomorrow? I’ll visit you tomorrow afternoon.","那你明天有空嗎?我下午去找你。","https://web.klokah.tw/text/sound/36293/568241.mp3"
"shduu, itaun iaku mitalha ihun.","Sure, I will wait for you at home.","可以，我在家等你。","https://web.klokah.tw/text/sound/36293/568242.mp3"
"makikalhiwan qazii ya shduu aru-iin iaku ihun? maqa amatqal iaku.","Would you mind if  I do the voice recording? I would like to keep a record.","請問我可以錄音嗎?我想做紀錄。","https://web.klokah.tw/text/sound/36293/568243.mp3"
"ua! pusa anunin.","Sure! No problem.","好啊!沒有問題。","https://web.klokah.tw/text/sound/36293/568244.mp3"
"shduu ya pulaunin sa bahi?","Would you mind if I do the video recording?","可以錄影嗎?","https://web.klokah.tw/text/sound/36293/568245.mp3"
"ani iaku tu min’miaqitan ya riqazan, numa talhuqan mani antu pinaqitan, ani.","No, I am plain and the warehouse hasn’t been tidied up yet.","我不好看，倉庫也沒整理，不要啦。","https://web.klokah.tw/text/sound/36293/568246.mp3"
"muqayiza iaku pashtiruq.","Then I will just take photos.","那我拍照就好。","https://web.klokah.tw/text/sound/36293/568247.mp3"
"ata mani tu pashtiruq.","No photographing either.","拍照也不要。","https://web.klokah.tw/text/sound/36293/568248.mp3"
"anuniza ihun pakikalhiak.","Thank you for accepting the interview.","謝謝你讓我訪問。","https://web.klokah.tw/text/sound/36293/568249.mp3"
"anunin qa, numa sa amakikalhiwan uhu?","You are welcome. What would you like to know?","沒問題，你想問什麼?","https://web.klokah.tw/text/sound/36293/568250.mp3"
"makikalhiwan iaku ihun ya parhawayuan numa sa kalawan uhu?","What do you do when you are young?","請問您年輕時是做什麼的?","https://web.klokah.tw/text/sound/36293/568251.mp3"
"kahiwan iaku minmaranash, numa iaku pangqaiza thuini.","I was a police officer but I am retired now.","我以前是警察，但我現在退休了。","https://web.klokah.tw/text/sound/36293/568252.mp3"
"itia sa palhkakrikriw ihu thuini?","Then, are you working at the moment?","那你現在有工作嗎?","https://web.klokah.tw/text/sound/36293/568253.mp3"
"itusi iaku lhupilhupishan a taun malhkakrikriw.","I am working at school.","我在學校上班。","https://web.klokah.tw/text/sound/36293/568254.mp3"
"makikalhiwan iaku ihun mihu a azazak itusi kataunan mani qa?","Do your kids live in the tribe too?","請問您的孩子也住在部落嗎?","https://web.klokah.tw/text/sound/36293/568255.mp3"
"uka, naak a azazak itusi mawalhnaq a pruq.","No, my kids are all living in the city.","不，我的孩子在都市居住。","https://web.klokah.tw/text/sound/36293/568256.mp3"
"kamamuri ihu lhkananai?","Then, do you live by yourself?","那你自己一個人住嗎?","https://web.klokah.tw/text/sound/36293/568257.mp3"
"hmadana iaku itiawan latata wa atu numa latata wa rumfaz, thaithuy mani sa naak a taun a thau.","I also keep a dog and a bird. They are my family.","我還有養一隻狗和一隻鳥，他們也是我的家人。","https://web.klokah.tw/text/sound/36293/568258.mp3"
"hmadana iaku latata wa qaruta mani, ianan sa lhkaribush miasuun amaqa antu inawawaaz.","I have a cat too. I won’t get bored with the company of my pet.","我也有養一隻貓，有動物陪伴不會無聊。","https://web.klokah.tw/text/sound/36293/568259.mp3"
"makikalhiwan iaku ihun numanuma wa muribush a parshian.","I would like to ask you about the taboos of hunting.","我想請問你關於打獵的禁忌。","https://web.klokah.tw/text/sound/36293/568260.mp3"
"daza iaku mafazaq, ya mafazaq iaku afuilh ihun.","I don’t know much about that, but I will tell you everything I know.","我知道的不多，但我能回答的都會回答你。","https://web.klokah.tw/text/sound/36293/568261.mp3"
"numa wa parshian maniun ya muribush a aniamin?","Do you have any taboos about hunting weapons?","你們打獵的武器有什麼禁忌嗎?","https://web.klokah.tw/text/sound/36293/568262.mp3"
"naam a muribush a aniamin antu shduu pashuzap sa binanau’az.","Our hunting weapons are untouchable to women.","我們打獵的武器不可以讓女生碰到。","https://web.klokah.tw/text/sound/36293/568263.mp3"
"shduu binanau’az musuun mutusi muribush?","Then, can women go hunting together?","那女人可以一起去打獵嗎?","https://web.klokah.tw/text/sound/36293/568264.mp3"
"ani, antu binanau’az mani ya muntal muribush.","No, women cannot go hunting either.","不行，女人也不可以打獵。","https://web.klokah.tw/text/sound/36293/568265.mp3"
"Qabus, ukaiza itaun zashuq a qilha, ushaiza ihu fariw.","Qabus, our home is out of rice wine, please go and buy some.","Qabus，家裡沒有米酒了，你去買米酒。","https://web.klokah.tw/text/sound/36295/568296.mp3"
"sua-kaa itiawan tata pan, ingqaiza tu afariw.","There is still one bottle left in the kitchen, so there is no need to buy one!","廚房裡還有一瓶，不用買吧。","https://web.klokah.tw/text/sound/36295/568297.mp3"
"antu shduu tata pan, uqthawan fariw tusha pan.","One bottle is not enough for me, go and buy two more back.","一瓶不夠，再去買兩瓶回來。","https://web.klokah.tw/text/sound/36295/568298.mp3"
"afariw iaku zashuq a qilha, itia maniun ya fariwin?","I am looking for rice wine. Do you have any rice wine?","我要買米酒，你們有賣嗎?","https://web.klokah.tw/text/sound/36295/568299.mp3"
"itia! lapiza wa afariwin uhu?","Yes! How many bottles do you need?","有啊!你要買多少?","https://web.klokah.tw/text/sound/36295/568300.mp3"
"afariw iaku tusha pan, numa afariw tata pinutiqu a zashuq.","I want two bottles and a pack of rice.","我要買兩瓶，還要買一包米。","https://web.klokah.tw/text/sound/36295/568301.mp3"
"zashuq inai, numa sa uqthawan afariwin uhu?","Here is the rice, what else do you need?","米在這裡，你還需要什麼嗎?","https://web.klokah.tw/text/sound/36295/568302.mp3"
"amuqthawan fariw iaku qarithuy, itia maniun qa?","I want some eggs too, do you have some?","我還要買蛋，你們有嗎?","https://web.klokah.tw/text/sound/36295/568303.mp3"
"naam a qarithuy ulhthkizin suma wa finariw.","We are out of eggs.","我們的蛋賣完了。","https://web.klokah.tw/text/sound/36295/568304.mp3"
"afariw iaku sa hulus.","I want to buy some clothes.","我要買衣服。","https://web.klokah.tw/text/sound/36295/568305.mp3"
"amiakuza s hulus ushnawin uhu?","What kind of clothes do you like?","你想要什麼樣子的呢?","https://web.klokah.tw/text/sound/36295/568306.mp3"
"afariw iaku luish a rima wa hulus.","I want to buy the clothes with short sleeves.","我要買短袖的衣服","https://web.klokah.tw/text/sound/36295/568307.mp3"
"qazii ya miakuza s izai maqulhaqulha?","How about this red one?","這件紅色的如何?","https://web.klokah.tw/text/sound/36295/568308.mp3"
"qazii ya itiawan suma wa kinasia?","Do you have another color?","有別的顏色嗎?","https://web.klokah.tw/text/sound/36295/568309.mp3"
"iamin itiawan sa mapuzipuzi numa madishlum.","We have white and blue ones too.","我們還有白色和藍色。","https://web.klokah.tw/text/sound/36295/568310.mp3"
"ananaiwan iakin tata wa madishlum a hulus.","Please give me the clothes in blue.","請給我一件藍色的衣服。","https://web.klokah.tw/text/sound/36295/568311.mp3"
"Qabus shintua ihu tu ikahi? shitusi ihu pinkazakaza sa buut?","Qabus, where have you been just now? Did you go exercising?","Qabus你剛剛去哪裡了?你去運動嗎?","https://web.klokah.tw/text/sound/36295/568312.mp3"
"ani, shitusi iaku mindahip apuki’ay fariwin sa shanglaw.","No, I went grocery shopping for my grandma.","不是，我去幫奶奶賣菜。","https://web.klokah.tw/text/sound/36295/568313.mp3"
"ihu ya ishawanan ya mahumhum? qazii ya mat iakin kmaan afu.","No wonder! Are you available at night? Would you like to have a meal with me?","你晚上有沒有空?要不要和我一起吃飯。","https://web.klokah.tw/text/sound/36295/568314.mp3"
"ani, amutusiwak fariw sa hulus.","No, I want to buy some clothes.","不行，我要去買衣服。","https://web.klokah.tw/text/sound/36295/568315.mp3"
"muntal iaku ihun.","Then, I will go with you.","那我跟你一起去。","https://web.klokah.tw/text/sound/36295/568316.mp3"
"maqitan ihu, lakuza wa tuali haya wa finutulh a shanglaw.","Hello, how much is this bunch of vegetables?","你好，請問這把菜多少錢?","https://web.klokah.tw/text/sound/36295/568317.mp3"
"tata wa finutulh a shanglaw mapushaz sui.","The vegetables are $20 for a bunch.","菜一把20元。","https://web.klokah.tw/text/sound/36295/568318.mp3"
"lakuza wa tuali haya wa buna?","How much are these sweet potatoes?","這個地瓜多少錢?","https://web.klokah.tw/text/sound/36295/568319.mp3"
"tata tingting a buna maturuz sui.","Sweet potatoes are thirty dollars for a pound.","地瓜一斤30元","https://web.klokah.tw/text/sound/36295/568320.mp3"
"ananaiwan iakin tusha finutulh a shanglaw numa tata tingting a buna.","Please give me two bunches of vegetables and a pound of sweet potatoes.","請給我兩把菜和一斤地瓜。","https://web.klokah.tw/text/sound/36295/568321.mp3"
"Tuba, min’aura iaku kminathu sa patatash, shduu ihu shimulikuan?","Tuba, I forgot to bring my pen. Can you lend me one?","Tuba，我忘了帶筆，你可以借我嗎?","https://web.klokah.tw/text/sound/36297/568352.mp3"
"uka iaku mani, ti Shuni izai.","I don’t have one either. This is Shuni’s.","我也沒有，這支是Shuni的。","https://web.klokah.tw/text/sound/36297/568353.mp3"
"shduu ya shimulikuan? muhiaw iaku pushuqishin uhu.","Can you lend me the pen for a second? I will return to you immediately.","那可以借我一下子嗎?我很快就還你。","https://web.klokah.tw/text/sound/36297/568354.mp3"
"ua, arahu.","Sure, take it.","好，拿去。","https://web.klokah.tw/text/sound/36297/568355.mp3"
"anuniza, anuniza Shuni mani.","Thank you and thank Shuni for me.","謝謝，也幫我謝謝Shuni。","https://web.klokah.tw/text/sound/36297/568356.mp3"
"numa sa amindahipuan uhu?","May I help you?","需要什麼嗎?","https://web.klokah.tw/text/sound/36297/568357.mp3"
"apushuqishin iaku sa izai a latusha wa patashan.","I want to return these two books.","我要還這兩本書。","https://web.klokah.tw/text/sound/36297/568358.mp3"
"ua, itiawan amindahipuan uhu?","No problem and what else do you need?","好的，還需要什麼嗎?","https://web.klokah.tw/text/sound/36297/568359.mp3"
"amuqthawan iaku shmimul laturu a patashan.","I would like to borrow these three books.","我還要借這三本書。","https://web.klokah.tw/text/sound/36297/568360.mp3"
"shduuiza, ata tu in’auraan ya turuiza wa qali apushuqishin.","Sure and remember to return them after three days.","好了，記得三天後要拿來還。","https://web.klokah.tw/text/sound/36297/568361.mp3"
"niwan ihu tu pushuqishin iakin tatitish.","You haven’t returned me the eraser.","你還沒還我橡皮擦。","https://web.klokah.tw/text/sound/36297/568362.mp3"
"pinushuqishiza iaku ihun tilha.","I returned it yesterday.","我昨天就還了。","https://web.klokah.tw/text/sound/36297/568363.mp3"
"minuiza naak a tatitish makauka.","Then, why is my eraser missing?","那我的橡皮擦怎麼不見了。","https://web.klokah.tw/text/sound/36297/568364.mp3"
"qazii ihu ya pashimul Tuba?","Did you lend it to Tuba?","你是不是借給Tuba了。","https://web.klokah.tw/text/sound/36297/568365.mp3"
"tihawta iaku, pakikalhiwan iaku thithu.","I don’t know. I will go and ask her.","我不知道，我去問問她。","https://web.klokah.tw/text/sound/36297/568366.mp3"
"mihala iaku shimulin naak a tatitish ihun.","I will lend you my eraser first.","我的橡皮擦先借你。","https://web.klokah.tw/text/sound/36297/568367.mp3"
"Shuni, izai a maka’apaw a hulus sa Tuba wa shimulin uhu?","Shuni, did Tuba lend you this coat?","Shuni，這個外套是Tuba借你的嗎?","https://web.klokah.tw/text/sound/36297/568368.mp3"
"ani, haya naak a ina finariw lhai iakin.","No, my mom bought it for me.","不是，這是我媽媽買給我的。","https://web.klokah.tw/text/sound/36297/568369.mp3"
"Tuba wa maka’apaw a hulus tataal mihu.","Tuba’s coat is the same as yours.","Tuba的外套跟你的一樣。","https://web.klokah.tw/text/sound/36297/568370.mp3"
"thithu a maka’apaw a hulus maqusuqusum, antu tataal iamin.","’s coat is thHis coat is black, so our colors are different.e same as yours.","他的外套是黑色的，我們顏色不一樣。","https://web.klokah.tw/text/sound/36297/568371.mp3"
"Shuni, shinimul ihu sa Hudun a tuali?","Shuni, did you borrow money from Hudun?","Shuni，你有跟Hudun借錢嗎?","https://web.klokah.tw/text/sound/36297/568372.mp3"
"ua, naur thuini iaku mriri thithu, min’aura iaku makathu sa tuali.","Yes, I was supposed to return to him today, but I forgot to bring the money.","有，我本來今天要還他，我忘記帶錢了。","https://web.klokah.tw/text/sound/36297/568373.mp3"
"alhakaiza ya pushuqishin uhu?","Then, when will you return the money?","那你什麼時候要還?","https://web.klokah.tw/text/sound/36297/568374.mp3"
"pushuqishin iaku thithu ya simaq.","I will return to him tomorrow.","我明天就還給他。","https://web.klokah.tw/text/sound/36297/568375.mp3"
"ua, afuilh iaku Hudun.","Okay, I will tell Hudun for you.","好，我跟Hudun說。","https://web.klokah.tw/text/sound/36297/568376.mp3"
"ya smapuk sa mashmash apasain sa qadup, numa ya smapuk sa tikulhath apasain sa mahaqu, ya miazithu mubalabalay.","It is correct to catch mice through rangay and catch bamboo partridges through qjiulang.","老鼠應該要⽤⽯壓式陷阱抓，⽵雞應該要⽤套頸式陷阱抓，這樣才對。","https://web.klokah.tw/text/sound/36299/568407.mp3"
"naur ya miazithu, muririw tu suma iaku, amaqa iaku antu mara.","No wonder! I am mistaken and that’s why I cannot catch any of them.","原來是這樣，我都搞錯了！難怪我都抓不到。","https://web.klokah.tw/text/sound/36299/568408.mp3"
"pinfazaq iaku ihun amiakuza kmalawa s izai latusha wa tuqris.","Then I will teach you how to set up these two traps.","那我再教你怎麼製作這兩種陷阱。","https://web.klokah.tw/text/sound/36299/568409.mp3"
"ua! maqitan, ya miazithu shduu iaku mara sa lhkaribush ya kahiza.","Great! I will be able to catch the prey in the future.","好啊！太棒了！這樣我以後就會抓到獵物了。","https://web.klokah.tw/text/sound/36299/568410.mp3"
"buhat a lhmir mathuaw marutawiza, usuiwan uhu thapa mara sa kaklhit, amutusi ita buhat.","The grass in the fields is too tall. Go to the warehouse to take the sickle and let’s go to the fields.","田裡的草太長了，你去倉庫拿鐮刀，我們去田裡。","https://web.klokah.tw/text/sound/36299/568411.mp3"
"pintuan sa kaklhit?","Where are the sickles?","鐮刀放在哪裡?","https://web.klokah.tw/text/sound/36299/594000.mp3"
"isai lhalhahi a shirshir, makuntantu ihu thapa ashaqtuniza.","Beside the back basket, you will see it when you enter the warehouse.","在背簍的旁邊，你進去倉庫就會看到了。","https://web.klokah.tw/text/sound/36299/568412.mp3"
"inanuru ya mara ata tu klhitin, mathuaw kaklhit malamlam.","Be careful and don’t get hurt. The sickle is very sharp.","小心拿不要割到，鐮刀很利。","https://web.klokah.tw/text/sound/36299/568413.mp3"
"ata tu kangqthaan naak a tuqris.","Don’t step on my trap!","不要踩到我的陷阱！","https://web.klokah.tw/text/sound/36299/568414.mp3"
"intua s mihu a tuqris?","Where is your trap?","你的陷阱在哪裡?","https://web.klokah.tw/text/sound/36299/594001.mp3"
"naak a tuqris isai huya wa ribush a bangqir.","My trap is under that tree.","我的陷阱在那棵樹的下面。","https://web.klokah.tw/text/sound/36299/568415.mp3"
"minu ihu qa mangqtuqtu?","How do you remember?","你怎麼會記得?","https://web.klokah.tw/text/sound/36299/594002.mp3"
"pinataqal iaku izai, mafazaq iaku naak a tuqris ya intua.","I make a mark here, so I know where my trap is.","我在這邊有做記號，我知道我的陷阱在哪裡。","https://web.klokah.tw/text/sound/36299/568416.mp3"
"haya wa lhalhuzu, pulhalhuzu iamin falhaza wa shirshir smapuk sa rusaw.","This is a fish trap which we put beside the river for fishing.","這是魚筌，我們放在溪邊捕魚。","https://web.klokah.tw/text/sound/36299/568417.mp3"
"uka iamin lhalhuzu, pasain iamin paniza ya maniza sa rusaw.","We don’t have any fish traps there, so we catch fish with a fishing rod.","我們那邊沒有魚筌，我們都用釣竿抓魚。","https://web.klokah.tw/text/sound/36299/568418.mp3"
"iaku antu pinasa paniza, shduu ihu suma wa qali pinfazaq iakin?","I have never used a fishing rod before, would you mind teaching me next time?","我沒有用過釣竿，你改天教我好嗎?","https://web.klokah.tw/text/sound/36299/568419.mp3"
"ua! suma wa qali apalhintaz ita musui maniza sa rusaw.","Sure! Let’s go fishing together next time.","好啊!我們改天一起去釣魚。","https://web.klokah.tw/text/sound/36299/568420.mp3"
"ya suma wa qali apinfazaq iaku ihun kmalawa sa lhalhuzu.","I will teach you how to make a fish trap next time.","那我改天教你做魚筌。","https://web.klokah.tw/text/sound/36299/568421.mp3"
"makakakri mihu a paniza, qazii ya mupaniza sa rusaw, iahiaw shmuruz ihu.","Your fishing rod is moving. Isn’t the fish on the hook? Pull it up!","你的釣竿動了，是不是有魚上鉤了!你快拉起來。","https://web.klokah.tw/text/sound/36299/568422.mp3"
"italhawan, ma’a’a’inur sa ruza, inai iaku shmuruz sa paniza, utusiwan uhu mara sa dawaz.","Wait, the ship is rolling heavily. I am here to pull the fishing rod and you should go there to grab me the net.","等等，船太晃了。我在這邊拉釣竿，你去那邊幫我拿網子來。","https://web.klokah.tw/text/sound/36299/568423.mp3"
"shuruz ihu sa rusaw pakunanai, shuruzikuan sa rusaw.","Pull the fish to my side and I will help you pull it up.","你把魚拉到我這邊，我幫妳拉起來。","https://web.klokah.tw/text/sound/36299/568424.mp3"
"mathuaw maqitan! u’araan manasha sa rusaw thuini, mathuaw mapunishiza luluman sa rusaw.","Great! It is a bumper crop today with full fish baskets.","太好了!今天大豐收，魚簍都裝滿了。","https://web.klokah.tw/text/sound/36299/568425.mp3"
"iahiaw mutaun ita mashtay kungqruman.","Let’s go back immediately and share it with everyone.","我們快回去和大家分享。","https://web.klokah.tw/text/sound/36299/568426.mp3"
"itiza fuifuilh patashan a shinshii munai.","The teacher is here.","老師來了。","https://web.klokah.tw/text/sound/63334/886782.mp3"
"ingqaiza malhalhiqash, iahiaw ushai mihu a pangka milhungqu.","Stop playing and quickly sit in your seat.","不要再玩了，快坐在座位上。","https://web.klokah.tw/text/sound/63334/886783.mp3"
"amazaiza, saqazian iaku munai!","Sorry, I’m late!","抱歉，我遲到了!","https://web.klokah.tw/text/sound/63334/886784.mp3"
"iahiaw mutaun.","Come in quickly.","快進來。","https://web.klokah.tw/text/sound/63334/886785.mp3"
"ripay piza thuini?","What day is it today?","今天星期幾?","https://web.klokah.tw/text/sound/63334/886786.mp3"
"ripay rima thuini, pangqaiza simaq, musuun ita kilhnaqualh!","It’s Friday today, we have a day off tomorrow. Let’s go out and play together!","今天星期五，明天放假，一起出去玩吧!","https://web.klokah.tw/text/sound/63334/886787.mp3"
"ua! musuun ita mutusi falhaza.","Great! Let’s go to the riverside.","好啊!我們去河邊。","https://web.klokah.tw/text/sound/63334/886788.mp3"
"ripay piza simaq?","What day will it be tomorrow?","明天星期幾?","https://web.klokah.tw/text/sound/63334/886789.mp3"
"ripay turu simaq, musuun ita matinhina sa maqarimusuz ya simaq saqazi!","Tomorrow will be Wednesday. Let’s go play ball tomorrow afternoon!","明天星期三，我們明天下午去玩球吧!","https://web.klokah.tw/text/sound/63334/886790.mp3"
"numa s kalawan uhu simaq a shashanu?","What will you be doing tomorrow morning?","你明天早上要做什麼?","https://web.klokah.tw/text/sound/63334/886791.mp3"
"amuntal iaku naak a ina, mutusi balinuqaz a taun.","Tomorrow will be Sunday, I will be going to church with my mom.","明天是星期日，我要和媽媽去教會。","https://web.klokah.tw/text/sound/63334/886792.mp3"
"minu ihu qa?","What’s wrong?","你怎麼了?","https://web.klokah.tw/text/sound/63334/886793.mp3"
"miku’utaq iaku, amutusi iaku puthaqian.","I feel like vomiting. I need to go to the restroom.","我想吐，我要去廁所。","https://web.klokah.tw/text/sound/63334/886794.mp3"
"minqaqarimuzmuz naak a punuq.","I feel dizzy.","我頭好暈。","https://web.klokah.tw/text/sound/63334/886795.mp3"
"pangqawan uhu isaiwan pangka matikmuthmuth.","Lie down and rest.","你趴著休息。","https://web.klokah.tw/text/sound/63334/886796.mp3"
"shinshii, makashpar naak a tiaz, amutusiwak puthaqian.","Teacher, I have a stomachache. I need to go to the restroom.","老師，我肚子痛，要去廁所。","https://web.klokah.tw/text/sound/63334/886797.mp3"
"ua, iahiaw mutantu.","Okay, go quickly.","好，快一點去。","https://web.klokah.tw/text/sound/63334/886798.mp3"
"qazii iaku musui mashinaw rima qa?","May I go wash my hands?","我可以去洗手嗎?","https://web.klokah.tw/text/sound/63334/886799.mp3"
"apangqaiza, shana ikahi mutantu.","It’s almost time for class to end. Wait a little longer.","快下課了，等一下再去。","https://web.klokah.tw/text/sound/63334/886800.mp3"
"shinshii, mathuaw makashpar naak a punuq, apangqawak ya saqazi.","It’s almost time for class to end. Wait a little longer.","老師，我頭好痛，下午要請假。","https://web.klokah.tw/text/sound/63334/886801.mp3"
"ua, ata iaramaz ya mutaun.","Okay, take care and go home.","好，回家小心。","https://web.klokah.tw/text/sound/63334/886802.mp3"
"shinshii, apangqawak ya ripay tata, maqa amariqaz iaku mriqariqaz shiz a shinshii.","Teacher, I need to take a sick leave next Monday. I have to see a doctor.","老師，我下禮拜一要請假，我要去看醫生。","https://web.klokah.tw/text/sound/63334/886803.mp3"
"ua, piakakalinkin s mihu a buut.","Alright, take care of yourself.","好，保重身體。","https://web.klokah.tw/text/sound/63334/886804.mp3"
"intua sa Apin?","Where is Apin?","Apin在哪裡?","https://web.klokah.tw/text/sound/63334/886805.mp3"
"makashpar thithu tiaz, itusi thithu sa puthaqian.","She has a stomachache. She’s in the restroom.","她肚子痛，她在廁所。","https://web.klokah.tw/text/sound/63334/886806.mp3"
"intua sa Shuhut？","Where is Shuhut?","Shuhut在哪裡?","https://web.klokah.tw/text/sound/63334/886807.mp3"
"shinshii, makashpar Shuhut a lahulahu, pangqa thuini.","Teacher, Shuhut has a sore throat. She took a sick leave today.","老師，Shuhut喉嚨痛，今天請假。","https://web.klokah.tw/text/sound/63334/886808.mp3"
"minu qa Apin uka munai?","Why didn’t Apin come?","Apin為甚麼沒來?","https://web.klokah.tw/text/sound/63334/886809.mp3"
"matata dai thithu a buut.","She has a fever.","她發燒了。","https://web.klokah.tw/text/sound/63334/886810.mp3"
"in’ananak uhu mzai mihu a numanuma.","Please introduce yourself.","請自我介紹。","https://web.klokah.tw/text/sound/63337/886848.mp3"
"naak a lhanaz zain Qaba Lhkapamumu, iaku thuini makthin a qamishan.","My name is Qaba Lhkapamumu, and I’m 10 years old.","我叫Qaba Lhkapamumu，我今年10歲。","https://web.klokah.tw/text/sound/63337/886849.mp3"
"kuzan mihu a lhanaz?","What’s your name?","你叫甚麼名字?","https://web.klokah.tw/text/sound/63337/886850.mp3"
"naak a lhanaz zain Qaba Lhkapamumu.","My name is Qaba Lhkapamumu.","我叫Qaba Lhkapamumu。","https://web.klokah.tw/text/sound/63337/886851.mp3"
"lhkanantua wa azazak ihu?","What ethnic group are you from?","你是哪一族的小孩?","https://web.klokah.tw/text/sound/63337/886852.mp3"
"tu Thau a azazak iaku.","I’m from the Thau.","我是邵族小孩。","https://web.klokah.tw/text/sound/63337/886853.mp3"
"mihu a taun az’az miniahala inai a thau qa?","Are all your family members indigenous?","你的家人都是原住民嗎?","https://web.klokah.tw/text/sound/63337/886854.mp3"
"ua, iamin tata taun az’az Thau.","Yes, my whole family is Thau.","是的，我們全家都是邵族人。","https://web.klokah.tw/text/sound/63337/886855.mp3"
"mihu a taun az’az miniahala inai a thau qa?","Are all your family members indigenous?","你的家人都是原住民嗎?","https://web.klokah.tw/text/sound/63337/886856.mp3"
