"Niqal maanu ka pgyaun Qyqeya Phuling?","Do you have any taboos about hunting weapons?","你們打獵的武器有什麼禁忌嗎?","https://web.klokah.tw/text/sound/36357/569816.mp3"
"Ini ptlengi mmqedil ka Qyqeya Phuling.","Our hunting weapons are untouchable to women.","我們打獵的武器不可以讓女生碰到。","https://web.klokah.tw/text/sound/36357/569817.mp3"
"Ma, ye ini huwa musa phuling ka mmqedil duri ha?","Then, can women go hunting together?","那女人可以一起去打獵嗎?","https://web.klokah.tw/text/sound/36357/569818.mp3"
"Ini! Ini srwai phuling ka mmqedil duri.","No, women cannot go hunting either.","不行，女人也不可以打獵。","https://web.klokah.tw/text/sound/36357/569819.mp3"
"Awi, uka sino da! Sai tikuh maruy!","Awi, our home is out of rice wine, please go and buy some.","Awi，沒有米酒了，去買一下!","https://web.klokah.tw/text/sound/36359/569850.mp3"
"Ga prayan hi ka kingal rusuq nana, anaq ini baruy hayan!","There is still one bottle left in the kitchen, so there is no need to buy one!","廚房裡還有一瓶，不用買吧!","https://web.klokah.tw/text/sound/36359/569851.mp3"
"Ini baka kingal rusuq, usa maruy daha rusuq dungal.","One bottle is not enough for me, go and buy two more back.","一瓶不夠，再去買兩瓶回來。","https://web.klokah.tw/text/sound/36359/569852.mp3"
"Mbaruy ku sino. Ya namu ga gnbaruy sino?","I am looking for rice wine. Do you have any rice wine?","我要買米酒，你們有賣嗎?","https://web.klokah.tw/text/sound/36359/569853.mp3"
"Niqal wa! Maruy su knhenu?","Yes! How many bottles do you need?","有啊!你要買多少?","https://web.klokah.tw/text/sound/36359/569854.mp3"
"Daha rusuq, ma kingal lubuy beras.","I want two bottles and a pack of rice.","我要買兩瓶，還要買一包米。","https://web.klokah.tw/text/sound/36359/569855.mp3"
"Nii ka beras, maanu ngalun su dungal?","Here is the rice, what else do you need?","米在這裡，你還需要什麼嗎?","https://web.klokah.tw/text/sound/36359/569856.mp3"
"Niqal ka balung?","Are there eggs?","有蛋嗎?","https://web.klokah.tw/text/sound/36359/569857.mp3"
"Uka ka balung da!","We are out of eggs.","蛋賣完囉！","https://web.klokah.tw/text/sound/36359/569858.mp3"
"Maruy ku lukus.","I want to buy some clothes.","我要買衣服。","https://web.klokah.tw/text/sound/36359/569859.mp3"
"So kenu ka kuxul su?","What kind of clothes do you like?","喜歡什麼樣子的呢?","https://web.klokah.tw/text/sound/36359/569860.mp3"
"Lukus puto usuk.","I want to buy the clothes with short sleeves.","我要買短袖的衣服。","https://web.klokah.tw/text/sound/36359/569861.mp3"
"Muwa ka mtanah nii?","How about this red one?","這件紅色的如何?","https://web.klokah.tw/text/sound/36359/569862.mp3"
"Niqal rako maanu nana?","Do you have another color?","有別的顏色嗎?","https://web.klokah.tw/text/sound/36359/569863.mp3"
"Niqal mbhege, ma mblawa.","We have white and blue ones too.","還有白色和藍色。","https://web.klokah.tw/text/sound/36359/569864.mp3"
"Biqi ku kingal mbhege.","Please give me the clothes in blue.","請給我一件藍色的衣服。","https://web.klokah.tw/text/sound/36359/569865.mp3"
"Awi, mnusa su inu ka soni? Mnusa su pstarin?","Awi, where have you been just now? Did you go exercising?","Awi，你剛剛去哪裡了?你去運動嗎?","https://web.klokah.tw/text/sound/36359/569866.mp3"
"Uxe, snkgulan ku pai musa maruy sama.","No, I went grocery shopping for my grandma.","不是，奶奶派我去買菜。","https://web.klokah.tw/text/sound/36359/569867.mp3"
"Ye kiya! Niqal ali su keeman? Spuwe ta mekan ido.","No wonder! Are you available at night? Would you like to have a meal with me?","這樣啊，你晚上有沒有空?要不要和我一起吃飯。","https://web.klokah.tw/text/sound/36359/569868.mp3"
"Bobo na da ho? Maha ku maruy lukus.","No, I want to buy some clothes.","不行，我要去買衣服。","https://web.klokah.tw/text/sound/36359/569869.mp3"
"Spuwe ta musa denu!","Then, I will go with you.","那我們一起去吧!","https://web.klokah.tw/text/sound/36359/569870.mp3"
"Sndamac su bale! Piya pila ka sama nii?","Hello, how much is this bunch of vegetables?","你好，請問這把菜多少錢?","https://web.klokah.tw/text/sound/36359/569871.mp3"
"Mpusan ka kingal bnkeyan sama.","The vegetables are $20 for a bunch.","菜一把20元。","https://web.klokah.tw/text/sound/36359/569872.mp3"
"Piya pila ka bunga nii?","How much are these sweet potatoes?","這個地瓜多少錢?","https://web.klokah.tw/text/sound/36359/569873.mp3"
"Mterun ka kingal toting bunga.","Sweet potatoes are thirty dollars for a pound.","地瓜一斤30元。","https://web.klokah.tw/text/sound/36359/569874.mp3"
"Biqi ku daha bnkeyan sama, ma kingal toting bunga.","Please give me two bunches of vegetables and a pound of sweet potatoes.","請給我兩把菜和一斤地瓜。","https://web.klokah.tw/text/sound/36359/569875.mp3"
"Awi, ni ku cmhungi madis ppatis, kbrexi ku tikuh nisu han ho?","Sudu, I forgot to bring my pen. Can you lend me one?","Awi，我忘了帶筆，你可以借我嗎?","https://web.klokah.tw/text/sound/36361/569906.mp3"
"Uka ku yaku duri, na Padiq ka ni mu dooyun duri wa!","","我也沒有，我拿的這支也是Padiq的喔!","https://web.klokah.tw/text/sound/36361/569907.mp3"
"Muwa kbrexun saku tikuh? Maha sumu asi prihi naq saya.","Can you lend me the pen for a second? I will return to you immediately.","那可以借我一下子嗎?我很快就還你。","https://web.klokah.tw/text/sound/36361/569908.mp3"
"Un, ngali.","Sure, take it.","好，拿去。","https://web.klokah.tw/text/sound/36361/569909.mp3"
"Mhuwe su bale, mhuwe su bale kesa ka Padiq duri.","Thank you and thank Padiq for me.","謝謝，也幫我謝謝Padiq。","https://web.klokah.tw/text/sound/36361/569910.mp3"
"Maanu nana wa?","May I help you?","需要什麼嗎?","https://web.klokah.tw/text/sound/36361/569911.mp3"
"Daha patis nii.","I want to return these two books.","這兩本書。","https://web.klokah.tw/text/sound/36361/569912.mp3"
"Un, maanu nana?","No problem and what else do you need?","好的，還需要什麼嗎?","https://web.klokah.tw/text/sound/36361/569913.mp3"
"Pkbarux ku teru patis nii duri.","I would like to borrow these three books.","我還要借這三本書。","https://web.klokah.tw/text/sound/36361/569914.mp3"
"Un, hadi hini da bobo mkteru ali.","Sure and remember to return them after three days.","好了，記得三天後要拿來還。","https://web.klokah.tw/text/sound/36361/569915.mp3"
"Ini saku hadi hini ka serus nana.","You haven’t returned me the eraser.","你還沒還我橡皮擦。","https://web.klokah.tw/text/sound/36361/569916.mp3"
"Wada sumu hadun ciga da hayan.","I returned it yesterday.","我昨天就還了。","https://web.klokah.tw/text/sound/36361/569917.mp3"
"Ma wada uka ka serus mu duri di?","Then, why is my eraser missing?","那我的橡皮擦怎麼不見了？","https://web.klokah.tw/text/sound/36361/569918.mp3"
"Uxe su wada skbarux Awi di peni!","Did you lend it to Awi?","你是不是借給Awi了！","https://web.klokah.tw/text/sound/36361/569919.mp3"
"Ini mu klai wa. Hae mu smiling hayan.","I don’t know. I will go and ask her.","我不知道。我去問問她。","https://web.klokah.tw/text/sound/36361/569920.mp3"
"Ngali naku nii hayan peni.","I will lend you my eraser first.","先拿我的去吧!","https://web.klokah.tw/text/sound/36361/569921.mp3"
"Padiq, knbrexan suna Awi ka lukus pbabo nii?","Padiq, did Awi lend you this coat?","Padiq，這個外套是Awi借你的嗎?","https://web.klokah.tw/text/sound/36361/569922.mp3"
"Uxe, bnaruy kuna bubu mu ka nii.","No, my mom bought it for me.","不是，這是我媽媽買給我的。","https://web.klokah.tw/text/sound/36361/569923.mp3"
"Mntena bale ka lukus pbabo namu yamu ka Awi.","Awi’s coat is the same as yours.","Awi的外套跟你的一樣。","https://web.klokah.tw/text/sound/36361/569924.mp3"
"Qalux lukus pbabo na ka heya. Ini pntena ka rako nami.","His coat is black, so our colors are different.","他的外套是黑色的，我們的顏色不一樣。","https://web.klokah.tw/text/sound/36361/569925.mp3"
"Padiq, ye su knbarux pila na Awi ka isu ha?",",Padiq did you borrow money from Awi?","Padiq，你有跟Awi借錢嗎?","https://web.klokah.tw/text/sound/36361/569926.mp3"
"Kiya ma, naka mu bale prihun saya, ni ku cmhungi madis pila da.","Yes, I was supposed to return to him today, but I forgot to bring the money.","有，我本來今天要還他，我忘記帶錢了。","https://web.klokah.tw/text/sound/36361/569927.mp3"
"So kiya de, prrihun su knuwan denu?","Then, when will you return the money?","那你什麼時候要還?","https://web.klokah.tw/text/sound/36361/569928.mp3"
"Kusun.","tomorrow.","明天。","https://web.klokah.tw/text/sound/36361/569929.mp3"
"Oo, sae sumu mrengo Awi denu.","Okay, I will tell Awi for you.","好，我幫你跟Awi說。","https://web.klokah.tw/text/sound/36361/569930.mp3"
"Sqapi btunux ka qolic, ma sdurang snuyuk ka tkurih.","It is correct to catch mice through rangay and catch bamboo partridges through qjiulang.","老鼠應該要⽤⽯壓式陷阱抓，⽵雞應該要⽤套頸式陷阱抓，這樣才對。","https://web.klokah.tw/text/sound/36363/569961.mp3"
"Kela naq so kiya, ni ku qnuuqu da! Kiya uka ba ka nngalan mu.","No wonder! I am mistaken and that’s why I cannot catch any of them.","原來是這樣，我都搞錯了！難怪我都抓不到。","https://web.klokah.tw/text/sound/36363/569962.mp3"
"Tgsae sumu smmalu daha spoosa tmlenga nii dungal.","Then I will teach you how to set up these two traps.","那我再教你怎麼製作這兩種陷阱。","https://web.klokah.tw/text/sound/36363/569963.mp3"
"Bale, malu wa! Maha ku maangal bobo na denu!","Great! I will be able to catch the prey in the future.","好啊！太棒了！這樣我以後就會抓到獵物了！","https://web.klokah.tw/text/sound/36363/569964.mp3"
"Eguw ba sudu hmneru yqeyaq ni da! Sai mangal kagul ga sapah, maha ta tmatak sudu yqeyaq.","The grass in the fields is too tall. Go to the warehouse to take the sickle and let’s go to the fields.","田裡的草太長了，你去家裡拿鐮刀，我們去田裡。","https://web.klokah.tw/text/sound/36363/569965.mp3"
"Ga inu ka kagul?","Where are the sickles?","鐮刀放在哪裡?","https://web.klokah.tw/text/sound/36363/593962.mp3"
"Gaga siyo btuku, remux su sapah, maha su asi qtai.","It is next to the round basket. You will see it when you enter the warehouse.","在圓篩的旁邊，你進去家裡就會看到了。","https://web.klokah.tw/text/sound/36363/569966.mp3"
"Tai hari mangal su, ngale su luqah, mhungun bale ka kagul.","Be careful and don’t get hurt. The sickle is very sharp.","小心拿，不要受傷。鐮刀很利。","https://web.klokah.tw/text/sound/36363/569967.mp3"
"Qlqahe su ka durang mu!","Don’t step on my trap!","不要踩到我的陷阱!","https://web.klokah.tw/text/sound/36363/569968.mp3"
"Ga inu ka durang su?","Where is your trap?","你的陷阱在哪裡?","https://web.klokah.tw/text/sound/36363/593963.mp3"
"Ga toma qhuni waga ka durang mu.","My trap is under that tree.","我的陷阱在那棵樹的下面。","https://web.klokah.tw/text/sound/36363/569969.mp3"
"Masu klaun?","How do you remember?","你怎麼會記得?","https://web.klokah.tw/text/sound/36363/593964.mp3"
"Niqal pnskraya mu hini, klaun mu naq ga inu ka durang mu.","I make a mark here, so I know where my trap is.","我在這邊有做記號，我知道我的陷阱在哪裡。","https://web.klokah.tw/text/sound/36363/569970.mp3"
"Nii ge, kobu qcurux, psaun miyan ruru saangal qcurux.","This is a fish trap which we put beside the river for fishing.","這是魚筌，我們放在溪邊捕魚。","https://web.klokah.tw/text/sound/36363/569971.mp3"
"Uka miyan kobu qcurux ka yami, pllingun miyan ka mangal qcurux.","We don’t have any fish traps there, so we catch fish with a fishing rod.","我們那邊沒有魚筌，我們都用釣竿抓魚。","https://web.klokah.tw/text/sound/36363/569972.mp3"
"Ini ku plaling mnnexan ka yaku, muwa tgsaun saku ka bobo na?","I have never used a fishing rod before, would you mind teaching me next time?","我沒有用過釣竿，你下次教我好嗎?","https://web.klokah.tw/text/sound/36363/569973.mp3"
"Malu wa! Spuwe ta musa plaling ka bobo na denu.","Sure! Let’s go fishing together next time.","好啊!我們下次一起去釣魚。","https://web.klokah.tw/text/sound/36363/569974.mp3"
"Ma tgsae sumu smmalu kobo qcurux bobo da duri.","I will teach you how to make a fish trap next time.","那我下次也教你做魚筌。","https://web.klokah.tw/text/sound/36363/569975.mp3"
"Mlgelu pnlingan su da! Ye uxe ga tdiyan qcurux di? Nleelu blebil!","Your fishing rod is moving. Isn’t the fish on the hook? Pull it up!","你的釣竿動了，是不是有魚上鉤了!你快拉起來！","https://web.klokah.tw/text/sound/36363/569976.mp3"
"Trai tikuh hayan, mlgelu riyung ka asu. Blbilo mu hini, sai mangal tikuh ka kadi waga.","Wait, the ship is rolling heavily. I am here to pull the fishing rod and you should go there to grab me the net.","等等，船太晃了。我在這邊拉釣竿，你去那邊幫我拿網子來。","https://web.klokah.tw/text/sound/36363/569977.mp3"
"Blbili quri hini ka qcurux, dyage sumu blebil.","Pull the fish to my side and I will help you pull it up.","你把魚拉到我這邊。我幫妳拉起來。","https://web.klokah.tw/text/sound/36363/569978.mp3"
"Keyan bale knmalu! Stenge rawa Nnngalanl ta qcurux di.","Great! It is a bumper crop today with full fish baskets.","太好了!今天大豐收，魚簍都裝滿了。","https://web.klokah.tw/text/sound/36363/569979.mp3"
"Hae ta nleeluw musa msaasu sapah hiya.","Let’s go back immediately and share it with everyone.","我們快回去和大家分享。","https://web.klokah.tw/text/sound/36363/569980.mp3"
"Gisu mptgesa di.","The teacher is here.","老師來了。","https://web.klokah.tw/text/sound/63366/887474.mp3"
"iya theyaq di, Nhari tlong tloongan.","Stop playing and quickly sit in your seat.","不要再玩了，快坐在座位上。","https://web.klokah.tw/text/sound/63366/887475.mp3"
"Wah, nii ku smrahuq di!","Sorry, I’m late!","抱歉，我遲到了!","https://web.klokah.tw/text/sound/63366/887476.mp3"
"Eyah truma.","Come in quickly.","快進來。","https://web.klokah.tw/text/sound/63366/887477.mp3"
"Gndregan maanu, ka ali saya?","What day is it today?","今天星期幾?","https://web.klokah.tw/text/sound/63366/887478.mp3"
"Ali gndregan rima ka saya, mduru ka kusun, nita suupu theyaq!","It’s Friday today, we have a day off tomorrow. Let’s go out and play together!","今天星期五，明天放假，一起出去玩吧!","https://web.klokah.tw/text/sound/63366/887479.mp3"
"Un! wa. Nita siyo yayung.","Great! Let’s go to the riverside.","好啊!我們去河邊。","https://web.klokah.tw/text/sound/63366/887480.mp3"
"Ali gndregan maanu ka kusun?","What day will it be tomorrow?","明天星期幾?","https://web.klokah.tw/text/sound/63366/887481.mp3"
"Ali gndregan teru kusun, kusun bobo mnekan nita theyaq cubu!","Tomorrow will be Wednesday. Let’s go play ball tomorrow afternoon!","明天星期三，我們明天下午去玩球吧!","https://web.klokah.tw/text/sound/63366/887482.mp3"
"Mphuwa su mgrebu kusun?","What will you be doing tomorrow morning?","你明天早上要做什麼?","https://web.klokah.tw/text/sound/63366/887483.mp3"
"Ali gndregan ka kusun, yami bubu mu maha miyan sapah thmukuwan.","Tomorrow will be Sunday, I will be going to church with my mom.","明天是星期日，我要和媽媽去教會。","https://web.klokah.tw/text/sound/63366/887484.mp3"
"Ga su hmuwa di?","What’s wrong?","你怎麼了?","https://web.klokah.tw/text/sound/63366/887485.mp3"
"nii ku mpbheriq, maha ku benjyo.","I feel like vomiting. I need to go to the restroom.","我想吐，我要去廁所。","https://web.klokah.tw/text/sound/63366/887486.mp3"
"Nii tgiya tunux mu.","I feel dizzy.","我頭好暈。","https://web.klokah.tw/text/sound/63366/887487.mp3"
"Uras sange ka isu.","Lie down and rest.","你趴著休息。","https://web.klokah.tw/text/sound/63366/887488.mp3"
"Mptgesa, nii ku mnarux nbuyas, maha ku benjyo.","Teacher, I have a stomachache. I need to go to the restroom.","老師，我肚子痛，要去廁所。","https://web.klokah.tw/text/sound/63366/887489.mp3"
"Un, osa nhari.","Okay, go quickly.","好，快一點去。","https://web.klokah.tw/text/sound/63366/887490.mp3"
"malu mosa ku trima baga?","May I go wash my hands?","我可以去洗手嗎?","https://web.klokah.tw/text/sound/63366/887491.mp3"
"Uxe beyo msange di, usa kiya hari.","It’s almost time for class to end. Wait a little longer.","快下課了，等一下再去。","https://web.klokah.tw/text/sound/63366/887492.mp3"
"mptgesa, niku mnarux tunux, mdru ku bobo mnekan.","It’s almost time for class to end. Wait a little longer.","老師，我頭好痛，下午要請假。","https://web.klokah.tw/text/sound/63366/887493.mp3"
"un, Tai hari mosa sapah.","Okay, take care and go home.","好，回家小心。","https://web.klokah.tw/text/sound/63366/887494.mp3"
"Mptgesa, mdru ku meyah ali gndregan kingal, maha ku pqita ising.","Teacher, I need to take a sick leave next Monday. I have to see a doctor.","老師，我下禮拜一要請假，我要去看醫生。","https://web.klokah.tw/text/sound/63366/887495.mp3"
"Un, qlahang hari hei su.","Alright, take care of yourself.","好，保重身體。","https://web.klokah.tw/text/sound/63366/887496.mp3"
"Gaga inu ka Iwan?","Where is Iwan?","Iwan在哪裡?","https://web.klokah.tw/text/sound/63366/887497.mp3"
"Gaga mnarux nbuyas, ga meniq benjyo.","She has a stomachache. She’s in the restroom.","她肚子痛，她在廁所。","https://web.klokah.tw/text/sound/63366/887498.mp3"
"Gaga inu ka Awi?","Where is Awi?","Awi在哪裡?","https://web.klokah.tw/text/sound/63366/887499.mp3"
"mptgesa, mnarux gelu ka Awi, mdru ka ali saya.","Teacher, Awi has a sore throat. She took a sick leave today.","老師，Awi喉嚨痛，今天請假。","https://web.klokah.tw/text/sound/63366/887500.mp3"
"malux ini eyah ka Iwan?","Why didn’t Iwan come?","Iwan為甚麼沒來?","https://web.klokah.tw/text/sound/63366/887501.mp3"
"Ga mttilux hei.","She has a fever.","她發燒了。","https://web.klokah.tw/text/sound/63366/887502.mp3"
"Pgkela ku yaku.","Please introduce yourself.","請自我介紹。","https://web.klokah.tw/text/sound/63369/887540.mp3"
"Tado ku Walis, maxal ka knkawas mu saya.","My name is Walis, and I’m 10 years old.","我叫Walis，我今年10歲。","https://web.klokah.tw/text/sound/63369/887541.mp3"
"Ima ka ngayan su?","What’s your name?","你叫甚麼名字?","https://web.klokah.tw/text/sound/63369/887542.mp3"
"Awi Pering ngayan mu.","My name is Awi Pering.","我叫Awi Pering。","https://web.klokah.tw/text/sound/63369/887543.mp3"
"Laqi su seediq inu?","What ethnic group are you from?","你是哪一族的小孩?","https://web.klokah.tw/text/sound/63369/887544.mp3"
"laqi ku Seediq ka yaku.","I’m from the Seediq.","我是賽德克族小孩。","https://web.klokah.tw/text/sound/63369/887545.mp3"
"Ye Seediq kana ka tnsapah su?","Are all your family members indigenous?","你的家人都是原住民嗎?","https://web.klokah.tw/text/sound/63369/887546.mp3"
"Seediq, kana tnsapah mu.","Yes, my whole family is Seediq.","是的，我們全家都是賽德克族人。","https://web.klokah.tw/text/sound/63369/887547.mp3"
"Ye Seediq kana tnsapah su?","Are all your family members indigenous?","你的家人都是原住民嗎?","https://web.klokah.tw/text/sound/63369/887548.mp3"
"uxe, Seediq ka tama mu mukan ka bubu mu.","No, my father is Seediq, and my mother is Han Taiwanese.","不是，我的爸爸是賽德克族，我的媽媽是漢人。","https://web.klokah.tw/text/sound/63369/887549.mp3"
"Laqi su naq ima?","Whose child are you?","你是誰的小孩?","https://web.klokah.tw/text/sound/63369/887550.mp3"
"Laqi ku na Awi Temu ka yaku.","I am Awi Temu’s child.","我是Awi Temu的小孩。","https://web.klokah.tw/text/sound/63369/887551.mp3"
"Ima ka tamas su? Piya ka knkawas na heya di?","Is that your father? How old is he?","那位是你爸爸嗎? 他幾歲了?","https://web.klokah.tw/text/sound/63369/887552.mp3"
"mterun kmxalan knkawas na heya.","He is 60 years old.","他六十歲了。","https://web.klokah.tw/text/sound/63369/887553.mp3"
"kenu ka tama su? Piya ka knkawas na di?","Is that your father? How old is he?","那位是你爸爸嗎? 他幾歲了?","https://web.klokah.tw/text/sound/63369/887554.mp3"
"Uxe, rudan alang miyan ka heya, mmsepac kmxalan ka knkawas na.","No, he is an elder of our tribe. He is 80 years old.","不是，他是我們部落的耆老，他80歲了。","https://web.klokah.tw/text/sound/63369/887555.mp3"
"piya knkawas na ka qbsurun su rseno?","How old is your brother?","你哥哥幾歲了?","https://web.klokah.tw/text/sound/63369/887556.mp3"
"Maxal mmsepac knkawas na ka qbsuran mu rseno.","My brother is 18 years old.","我哥哥18歲了。","https://web.klokah.tw/text/sound/63369/887557.mp3"
"ye hmrinsa egu knkawas na qbsuran rseno su daka isu?","Is your brother much older than you?","你哥哥年紀比你大很多嗎?","https://web.klokah.tw/text/sound/63369/887558.mp3"
"Hmrinas miyan rima knkawas.","We have a 5-year age difference.","我們差5歲。","https://web.klokah.tw/text/sound/63369/887559.mp3"
"Piya knbbaro hnyegan su?","How tall are you?","你身高多少?","https://web.klokah.tw/text/sound/63369/887560.mp3"
"Kingal kbekuy msptaun snkukuh qndisan knbbaro mu ka yaku.","I’m 140 centimeters.","我140公分。","https://web.klokah.tw/text/sound/63369/887561.mp3"
"Bsiyaq ta ini pqita, nii su so hari mdakil di?","I haven’t seen you in a while. Have you grown taller?","好久不見，你是不是長高了?","https://web.klokah.tw/text/sound/63369/887562.mp3"
"kiya ma kingal mterun snkukuh qndisan knbbaro mu ka yaku.","Yes, I’m 130 centimeters now.","對阿，我130公分了。","https://web.klokah.tw/text/sound/63369/887563.mp3"
"Uxe su ga qtehur?","Have you gained weight?","你是不是胖了?","https://web.klokah.tw/text/sound/63369/887564.mp3"
"Iya, tgqui qmita.","No, you’re mistaken.","沒有，你看錯了。","https://web.klokah.tw/text/sound/63369/887565.mp3"
"Uxe su kure di?","Have you lost weight?","你瘦了嗎?","https://web.klokah.tw/text/sound/63369/887566.mp3"
"ini, qtehur ku di.","No, I’ve gained weight.","沒有，我胖了。","https://web.klokah.tw/text/sound/63369/887567.mp3"
"Ye su ga qtehur di?","Have you gained weight?","你胖了嗎?","https://web.klokah.tw/text/sound/63369/887568.mp3"
"un, Mterun knchedil mu saya.","Yes, I weigh 30 kilograms now.","對，我現在30公斤了。","https://web.klokah.tw/text/sound/63369/887569.mp3"
"Maha su inu?","Where are you going?","你要去哪裡?","https://web.klokah.tw/text/sound/63372/887604.mp3"
"Maha ku sapah ptasan skadi mptgesa.","I’m going to the office to see the teacher.","我要去辦公室找老師。","https://web.klokah.tw/text/sound/63372/887605.mp3"
"Ukan, maha sui nu?","Where is Ukan going?","Ukan要去哪裡?","https://web.klokah.tw/text/sound/63372/887606.mp3"
"Maha qmada sudu nlaxn.","He’s going to throw away the trash.","他要去丟垃圾。","https://web.klokah.tw/text/sound/63372/887607.mp3"
"Gaga inu ka Pihu?","Where is Pihu?","Pihu在哪裡?","https://web.klokah.tw/text/sound/63372/887608.mp3"
"Gaga han rmanguy, maha psseung rmanguy kiya hari.","He’s at the swimming pool. He’s going to compete in a swimming competition later.","他在游泳池，他等一下要比賽游泳。","https://web.klokah.tw/text/sound/63372/887609.mp3"
"Gaga inu Ape? Maha psseung tmalang kiya hari.","Where is Ape? She’s going to compete in a running competition later.","Ape在哪裡?她等一下要比賽跑步。","https://web.klokah.tw/text/sound/63372/887610.mp3"
"Gaga thmkuwan, hae mu mlawa.","She’s in the auditorium. I’ll go call her.","她在禮堂，我去叫她。","https://web.klokah.tw/text/sound/63372/887611.mp3"
"Suupu nita undozo.","Let’s go to the playground together.","一起去操場吧。","https://web.klokah.tw/text/sound/63372/887612.mp3"
"Maha ku skadi isu kiya hari, hae ku mari puqun ceka naali han.","I’ll go buy lunch first, and then I’ll meet you later.","我先去買午餐，等一下去找你。","https://web.klokah.tw/text/sound/63372/887613.mp3"
"Nita suupu dmidil hndayu.","Let’s carry the lunch boxes together!","一起去抬便當吧!","https://web.klokah.tw/text/sound/63372/887614.mp3"
"Maha ku skadi mptgesa, usa skadi seediq.","You find someone else, I’m going to find the teacher.","你找別人，我要去找老師。","https://web.klokah.tw/text/sound/63372/887615.mp3"
"Iyung maha su psseung cubu biciq ka saya?","Is Iyung competing in croquet today?","Iyung今天要比賽槌球嗎?","https://web.klokah.tw/text/sound/63372/887616.mp3"
"Uxe, maha psseung milo.","No, he’s competing in high jump.","沒有，他要比賽跳高。","https://web.klokah.tw/text/sound/63372/887617.mp3"
"Ye su maha psseung tmalang psseung pstarin ali ciida?","Will you compete in the sports day?","運動會那天你會上場比賽嗎?","https://web.klokah.tw/text/sound/63372/887618.mp3"
"Un, maha ku psseung tmalang.","Yes, I’ll compete in running.","會阿，我會比賽跑步。","https://web.klokah.tw/text/sound/63372/887619.mp3"
"Ye su maha psseung tmalang psseung pstarin ali ciida?","Will you compete in the sports day?","運動會那天你會上場比賽嗎?","https://web.klokah.tw/text/sound/63372/887620.mp3"
"Maha ku psseung cubu biciq.","I’ll compete in croquet.","我會比賽槌球。","https://web.klokah.tw/text/sound/63372/887621.mp3"
"Mphuwa ta ail Psseung pstarin ciida?","What will we do in the sports day?","我們運動會那天要做甚麼?","https://web.klokah.tw/text/sound/63372/887622.mp3"
