"maqati, saw alapu ta su sikava."," Well, you take it yourself.","好，你自己拿你要穿的衣服。","https://web.klokah.tw/text/sound/27273/450162.mp3"
"maqati a su pasedjaman aken ta su sunatj?"," Can I borrow your book?","我可以借你的書嗎?","https://web.klokah.tw/text/sound/27273/450163.mp3"
"ku sinipasedjam anga tjai kapi."," I lent it to piya.","我借給kapi了。","https://web.klokah.tw/text/sound/27273/450164.mp3"
"nasakisedjam aken ta su zidingsia, maqati?"," Can I borrow your bicycle, please?","我想跟你的腳踏車，可以借我嗎?","https://web.klokah.tw/text/sound/27273/450165.mp3"
"maqati, ljakua pacikelu anga nutiaw."," Okay, but you have to give it back to me tomorrow."," 好，但是明天要還給我。","https://web.klokah.tw/text/sound/27273/450166.mp3"
"qemudjalj anga, namasi ljinay sun?"," It's raining, I don't have an umbrella, can you lend me one?","下雨了，你有帶傘嗎?","https://web.klokah.tw/text/sound/27273/450167.mp3"
"izua ku ljinay, kaciuri a ljeminay numaya!"," I only have an umbrella, let's stick together!"," 我有帶傘，我們一起撐吧!","https://web.klokah.tw/text/sound/27273/450168.mp3"
"pacikel aken tjanusun ta ku kinisedjam ka tjaisangas a sunatj."," This is the book you borrowed from me last time, I give it back to you.","我要還你上次借我的書。","https://web.klokah.tw/text/sound/27273/450169.mp3"
"nasapacun anan sun ta zuma a sunatj?","You can tell me what else you want to read.","還想看別的書嗎?","https://web.klokah.tw/text/sound/27273/450170.mp3"
"nungida anga a ku sivalit tjanusun ta paisu?"," When do I have to pay you back?","我什麼時候要還你錢?","https://web.klokah.tw/text/sound/27273/450171.mp3"
"pumayan, pacikelu anga nu izua su paisu."," It doesn't matter, you can talk about it when you have money.","沒關係，你有錢的時候再說。","https://web.klokah.tw/text/sound/27273/450172.mp3"
"nungida su valitan aken ta su kinisedjam a paisu?"," When are you going to pay me back?","你什麼時候要還我錢?","https://web.klokah.tw/text/sound/27273/450173.mp3"
"ku valitan sun nutiaw."," I will return it to you tomorrow.","我明天還你。","https://web.klokah.tw/text/sound/27273/450174.mp3"
"nungida su pacikelen a ku sunatj."," When are you going to return my book?","你什麼時候要還我書?","https://web.klokah.tw/text/sound/27273/450175.mp3"
"aku ku pinacikel anga katiaw?"," Didn't I return it to you yesterday?","我昨天不是已經還了嗎?","https://web.klokah.tw/text/sound/27273/450176.mp3"
"ti pia napasedjam tjanusun ta inpic?"," Did Pia lend you this pen?","這隻筆是pia借你的嗎？","https://web.klokah.tw/text/sound/27273/479049.mp3"
"ui, pinasedjaman aken ta inpic nimadju."," Yes, I borrowed it from him today.","對，鉛筆是他借我的。","https://web.klokah.tw/text/sound/27273/450178.mp3"
"aicu a inpic su kinisedjam tjai piya?"," Did you borrow this pen from piya?","這支筆是你跟piya借的嗎?","https://web.klokah.tw/text/sound/27273/450179.mp3"
"ini, vinelian na ku kina tjanuaken."," No, this is what mom bought.","不是，這是媽媽買給我的。","https://web.klokah.tw/text/sound/27273/450180.mp3"
"neka anga qatia, kisedjamu ta nia tjuku."," We are out of salt, so let's borrow some from tjuku.","沒有鹽了，去跟tjuku借。","https://web.klokah.tw/text/sound/27273/450181.mp3"
"ui, ku kisedjamay."," Okay, I'll borrow it.","好，我去借。","https://web.klokah.tw/text/sound/27273/450182.mp3"
"pacikelu ayavu ti muni ta kinisedjam tjanuaken a paisu."," Go tell mumi to return my money.","去叫mumi還我錢。","https://web.klokah.tw/text/sound/27273/450183.mp3"
"pida kinisedjam a paisu tjanusun?"," How much does she owe you?","她跟你借多少錢呢?","https://web.klokah.tw/text/sound/27273/450184.mp3"
"uri sema inu sun?"," Where are you going?","你要去哪裡?","https://web.klokah.tw/text/sound/27274/450185.mp3"
"uri vaik aken a temalem ta ljaceng a sema ta ku puljacengan."," I’m going to plant vegetables in the garden.","我要去菜園裡種菜。","https://web.klokah.tw/text/sound/27274/450186.mp3"
"anema su kudakudain?"," What are you doing?","你在做什麼?","https://web.klokah.tw/text/sound/27274/450187.mp3"
"uri ku ljivaseng ca namasan cemecemel anga a kadjunangan.","There’s too much grass, I’m cutting it, I’ll have to water it later.","草太多了，我在砍草。","https://web.klokah.tw/text/sound/27274/450188.mp3"
"alapan aken ta dramia kata pitaw."," Will you get my scythes and hoes, please?","幫我拿鐮刀和鋤頭。","https://web.klokah.tw/text/sound/27274/450189.mp3"
"ku pinizua i ljaving ta kakara."," Put it next to the plow rake.","放在犁耙旁邊。","https://web.klokah.tw/text/sound/27274/450191.mp3"
"na kemangekang anga sun?"," Did you turn over the soil?","你犁過田了嗎?","https://web.klokah.tw/text/sound/27274/450192.mp3"
"na kemakang anga ken, uri ku vusaman nusauni."," I just turned over the soil, and so on to sow seeds.","我剛犁過田，待會兒要播種。","https://web.klokah.tw/text/sound/27274/450193.mp3"
"maqati anga tjen a kiljaceng?"," Are your vegetables ready to be harvested?","你種的菜可以收成了嗎?","https://web.klokah.tw/text/sound/27274/450194.mp3"
"amin a qaudriudri a maqati a nu kiljacengen."," The cabbage here is ready to be harvested, but the Showa grass there is not yet ready to be harvested.","你們只能採昭和草。","https://web.klokah.tw/text/sound/27274/450195.mp3"
"liaw angata a su kinivurasi"," Wow! You dug up so many gourds.","你挖了這麼多的地瓜。","https://web.klokah.tw/text/sound/27274/450196.mp3"
"seqetju a pasa kuvkuv aicu a ku kinivurasi."," Will you help me with the barn?","這些地瓜幫我放穀倉。","https://web.klokah.tw/text/sound/27274/450197.mp3"
"anema nu kudakudain?"," What are you doing?","你們在做什麼?","https://web.klokah.tw/text/sound/27274/450198.mp3"
"qemayuqayu amen i veljeluan, uri kiciqaw amen.","I’m pounding the vines for fish.","我們正在搗魚藤,準備抓魚.","https://web.klokah.tw/text/sound/27274/480597.mp3"
"liaw a ciqaw imaza?"," Are there many fish here?","這裡的魚多嗎?","https://web.klokah.tw/text/sound/27274/450200.mp3"
"namapeljuq anga dradrakuyan ta nia kiniciqaw."," The fish basket has been full of fish.","魚簍已經裝滿了。","https://web.klokah.tw/text/sound/27274/450201.mp3"
"seman dringay aken ta ku siqaljup"," I usually catch my prey with a trap, but occasionally I hunt with a gun and a dog.","我會製作陷阱抓獵物。","https://web.klokah.tw/text/sound/27274/450205.mp3"
"aicu nua vavuy a djekap."," These are the footprints of the boar, so this is the path the boar took.","這是山豬的腳印。","https://web.klokah.tw/text/sound/27274/450208.mp3"
"aku su sikeljang?"," How do you know?","你怎麼知道?","https://web.klokah.tw/text/sound/27274/479039.mp3"
"makeljang tu djinavacan nua vavuy a qelju."," I can see the traces of the boar.","看得出來是山豬走過的痕跡。","https://web.klokah.tw/text/sound/27274/479040.mp3"
"ari tjapacunay a tjadringay."," Go and see our trap, for it seems that we have caught our prey.","快去看我們的陷阱。","https://web.klokah.tw/text/sound/27274/450209.mp3"
"nasemequ anga vatu."," The dog seems to have smelled it. Let’s follow them.","狗聞到味道了。","https://web.klokah.tw/text/sound/27274/450211.mp3"
"anema su alalangen?"," What are you working on?","你在製作的是什麼東西?","https://web.klokah.tw/text/sound/27274/450212.mp3"
"aicu a rusung sipudringay ta kulavaw."," This is a cage trap, used to catch rats.","這是籠子陷阱，用來抓老鼠的。","https://web.klokah.tw/text/sound/27274/450213.mp3"
"anema nemanga a su pinizua"," What is that thing you put there?","你放在那裡的是什麼東西?","https://web.klokah.tw/text/sound/27274/450214.mp3"
"aicu sidringadringay ta takec ni kama."," It was a leg-rigged rope trap, and we used it to catch Shankiang.","這是爸爸專門抓山羌的陷阱。","https://web.klokah.tw/text/sound/27274/450215.mp3"
"masalu angata ta naqemati, liaw a tja qinaljupan kasauni."," Thanks to the blessing of our ancestors, we had a great harvest today.","感謝祖靈賜福，今天很多獵物。","https://web.klokah.tw/text/sound/27274/450216.mp3"
"ui angatalja! masalu aravac tua sinipagaugaw tjanuitjen nua naqemati."," Yeah! Let’s take it back to the tribe and share it!","是的!非常感謝上主的恩賜!","https://web.klokah.tw/text/sound/27274/450217.mp3"
"nusauny uli temulu aken tjanumun aza dubuc kemuda lukai ta pinaiwanan.","I will teach everyone all kinds of animals in Paiwan language today.","今天我要教大家動物的排灣語怎麼說。","https://web.klokah.tw/text/sound/36558/597603.mp3"
"nusauny uli temulu aken tjanumun aza cemel kemuda lukai ta pinaiwanan.","","今天我要教大家植物的排灣語怎麼說。","https://web.klokah.tw/text/sound/36558/574675.mp3"
"nusauny uli temulu aken tjanumun aza kudamunu kemuda lukai ta pinaiwanan.","I will teach everyone all kinds of fruits in Paiwan language today.","今天我要教大家水果的排灣語怎麼說。","https://web.klokah.tw/text/sound/36558/574676.mp3"
"maya taqed.","Don’t sleep.","不要睡覺。","https://web.klokah.tw/text/sound/36558/574677.mp3"
"maya kiljavaran.","Don’t talk.","不要講話。","https://web.klokah.tw/text/sound/36558/574678.mp3"
"maya keman ta nemanga.","Don’t eat.","不要吃東西。","https://web.klokah.tw/text/sound/36558/574679.mp3"
"patjevutaw su sapitj.","Take out your textbook.","拿出你的課本。","https://web.klokah.tw/text/sound/36558/574680.mp3"
"patjevutaw su inpic..","Take out your pen.","拿出你的筆。","https://web.klokah.tw/text/sound/36558/574681.mp3"
"patjevutaw su vavecikan..","Take out your homework.","拿出你的作業。","https://web.klokah.tw/text/sound/36558/574682.mp3"
"sananguaqu a sapitj.","Put your textbook away.","把課本收起來。","https://web.klokah.tw/text/sound/36558/574683.mp3"
"sananguaqu a inpic.","Put your pen away.","把筆收起來。","https://web.klokah.tw/text/sound/36558/574684.mp3"
"sananguaqu a kakanen.","Put your food away.","把食物收起來。","https://web.klokah.tw/text/sound/36558/574685.mp3"
"sananguaqu a vangavanga.","Put your toy away.","把玩具收起來。","https://web.klokah.tw/text/sound/36558/574686.mp3"
"nia ken.","It’s mine.","是我的。","https://web.klokah.tw/text/sound/36558/574688.mp3"
"nima ca sapitj.","Whose textbook is it?","這是誰的課本?","https://web.klokah.tw/text/sound/36558/574689.mp3"
"ni giyu.","It’s giyu’s.","是giyu的。","https://web.klokah.tw/text/sound/36558/574690.mp3"
"nima ca siquliqulip?","Whose eraser is it?","這是誰的橡皮擦?","https://web.klokah.tw/text/sound/36558/574691.mp3"
"ika en kemeljan.","I don’t know.","我不知道 。","https://web.klokah.tw/text/sound/36558/574692.mp3"
"azua ni camak a hansudi?","Is that camak’s shirt?","那是camak的襯衫嗎?","https://web.klokah.tw/text/sound/36558/574693.mp3"
"ini! ni akay a tjiaku.","No, this is akay’s coat.","不是！這是akay的外套。","https://web.klokah.tw/text/sound/36558/574694.mp3"
"sinsi, ika na masi sapitj aken.","Teacher, I didn’t bring my textbook.","老師，我沒帶課本。","https://web.klokah.tw/text/sound/36558/574695.mp3"
"kiciul kata ljaqediqedi maciul a pacun.","Share the book with your classmate next to you.","跟旁邊同學一起看。","https://web.klokah.tw/text/sound/36558/574696.mp3"
"mapengedruq a ku inpic.","My pencil is broken.","我的鉛筆斷了。","https://web.klokah.tw/text/sound/36558/574697.mp3"
"ayau ta yincepi a venecik..","Write with a ball pen.","用原子筆寫。","https://web.klokah.tw/text/sound/36558/574698.mp3"
"maulaw a u siquliqulip.","My eraser is missing.","我的橡皮擦不見了。","https://web.klokah.tw/text/sound/36558/574699.mp3"
"u sipasedjam a siquliqulip tjanusun.","I will lend you my eraser.","我的橡皮擦借你。","https://web.klokah.tw/text/sound/36558/574700.mp3"
"uli tjaljumaza tja kitulu, nu sema tjumaq kigalju anga i djalan.","It is the end of the class, be careful on your way home.","我們要下課了，回家路上要小心。","https://web.klokah.tw/text/sound/36558/574701.mp3"
"ui. masalu sinsi.","Got it, thank you teacher.","好。謝謝老師。","https://web.klokah.tw/text/sound/36558/574702.mp3"
"uli tjaljumaza tja kitulu, mecevungi anga mapuljat.","The class is over, goodbye everyone.","我們要下課了，大家再見。","https://web.klokah.tw/text/sound/36558/574703.mp3"
"vaikanga sinsi.","Goodbye teacher.","老師再見。","https://web.klokah.tw/text/sound/36558/574704.mp3"
"djavadjavay, a mapuljat. a ku ngadan ti buya.","Hello everyone, my name is buya.","大家好，我的名字是buya。","https://web.klokah.tw/text/sound/36561/574742.mp3"
"buya djavadjavay.",""," buya你好。","https://web.klokah.tw/text/sound/36561/574743.mp3"
"djavadjavay a mapuljat, a ku ngadan ti kuliw.","Hello everyone, my name is kuliw.","大家好，我的名字是kuliw。","https://web.klokah.tw/text/sound/36561/574744.mp3"
"kuliw djavadjavay.","Hello,kuliw."," kuliwk你好。","https://web.klokah.tw/text/sound/36561/574745.mp3"
"djavadjavay, ti buya ken.","Hello, I am buya.","你好，我是buya。","https://web.klokah.tw/text/sound/36561/574746.mp3"
"buya djavadjavay, tiaken ti sakinu.","Hello buya, I am sakinu.","buya你好，我是sakinu。","https://web.klokah.tw/text/sound/36561/574747.mp3"
"djavadjavay, tiaken ti kuliw.","Hello, I am kuliw.","你好，我是kiliw。","https://web.klokah.tw/text/sound/36561/574748.mp3"
"kuliw djavadjavay, tiaken ti sakinu.","Hello kuliw, I am sakinu.","kuliw你好，我是sakinu。","https://web.klokah.tw/text/sound/36561/574749.mp3"
"tima sun?","Who are you?","你是誰?","https://web.klokah.tw/text/sound/36561/574750.mp3"
"tiaken ni kiusi a kina, ti tjuku a ken.","I am kiusi’s mom, tjuku.","我是kiusi的媽媽，我是tjuku。","https://web.klokah.tw/text/sound/36561/574751.mp3"
"tima sun?","Who are you?","你是誰?","https://web.klokah.tw/text/sound/36561/574752.mp3"
"ni kiusi a tjakeri a kaka vavayan, a ku ngadan ti kenge.","I am kiusi’s sister. My name is kenge.","我是kiusi的妹妹，我的名字是kenge。","https://web.klokah.tw/text/sound/36561/574753.mp3"
"tima zua?","Who is he?","他是誰?","https://web.klokah.tw/text/sound/36561/574754.mp3"
"timadju niaken a sinsi, ti sedjam a ngadan.","He is my teacher, sedjam.","他是我的老師，他叫sedjam。","https://web.klokah.tw/text/sound/36561/574755.mp3"
"tima a caucau?","Who is that person?","那個人是誰?","https://web.klokah.tw/text/sound/36561/574756.mp3"
"timadju ku kaka tjavulung uqaljay, ti utjung a ngadan.","He is my brother, utjung.","他是我的哥哥，他叫utjung。","https://web.klokah.tw/text/sound/36561/574757.mp3"
"timadju ti buya?","Is he buya?","他是buya嗎?","https://web.klokah.tw/text/sound/36561/574758.mp3"
"ui, timadju ti buya.","Yes, he is buya.","是，他是buya。","https://web.klokah.tw/text/sound/36561/574759.mp3"
"ti buya sun?","Are you buya?","你是buya嗎?","https://web.klokah.tw/text/sound/36561/574760.mp3"
"ini, ti sakinu a ken.","No, I am sakinu.","不是，我是sakinu。","https://web.klokah.tw/text/sound/36561/574761.mp3"
"tima ti buya?","Who is buya?","誰是buya?","https://web.klokah.tw/text/sound/36561/574762.mp3"
"avan ti buya ken.","I am buya.","我就是buya。","https://web.klokah.tw/text/sound/36561/574763.mp3"
"tima ti sakinu?","Who is sakinu?","誰是sakinu?","https://web.klokah.tw/text/sound/36561/574764.mp3"
"ti sakinu niaken a qali.","sakinu is my friend.","sakinu是我的朋友。","https://web.klokah.tw/text/sound/36561/574765.mp3"
"tima ngadan na su kaka tjavulung a vavayan?","What is your elder sister’s name?","你姐姐的名字是什麼?","https://web.klokah.tw/text/sound/36561/574766.mp3"
"a ngadan na ku kaka tjavulung a vavayan ti ljeljeng.","My elder sister’s name is ljeljeng.","我的姐姐的名字是ljeljeng。","https://web.klokah.tw/text/sound/36561/574767.mp3"
"tima ngadan na su kaka tjakeri a vavayan?","What is your younger sister’s name?","你妹妹的名字是什麼?","https://web.klokah.tw/text/sound/36561/574768.mp3"
"a ngadan na ku kaka tjakeri a vavayan ti gesi.","My younger sister’s name is gesi.","我的妹妹的名字是gesi。","https://web.klokah.tw/text/sound/36561/574769.mp3"
"kemeljan sun ta ngadan nimadju?","Do you know his name?","你知道他的名字嗎?","https://web.klokah.tw/text/sound/36561/574770.mp3"
"a ngadan nimadju ti buya.","He is called buya.","他叫做buya。","https://web.klokah.tw/text/sound/36561/574771.mp3"
"pidanga cavilj na su kaka tjavulung a uqaljay?","How old is your elder brother?","你哥哥今年幾歲?","https://web.klokah.tw/text/sound/36561/574772.mp3"
"tucu puluq sa lima anga cavilj nimadju.","He is fifteen years old.","他今年15歲了。","https://web.klokah.tw/text/sound/36561/574773.mp3"
"pida anga cavilj na su kaka tjakeri a uqaljay?","How old is your younger brother?","你弟弟今年幾歲?","https://web.klokah.tw/text/sound/36561/574774.mp3"
"tucu lima anga cavilj nimadju.","He is five years old.","他今年5歲了。","https://web.klokah.tw/text/sound/36561/574775.mp3"
"a nu qinaljan izua gaku?","Do you have schools in your community?","你們的部落有學校嗎?","https://web.klokah.tw/text/sound/36561/574776.mp3"
"izua.","Yes.","有。","https://web.klokah.tw/text/sound/36561/574777.mp3"
"kitulutulu sun itua qinaljan a gaku?","Do you study in your tribe’s school?","你在部落的學校讀書嗎?","https://web.klokah.tw/text/sound/36561/574778.mp3"
"ui, nu kitulu amen i gaku matu taqumaqanan.","Yes, we are like family while we are studying at school.","是的，在學校讀書我們像一家人。","https://web.klokah.tw/text/sound/36561/574779.mp3"
"tima zua uqaljay?","Who is that man?","那個男生是誰?","https://web.klokah.tw/text/sound/36564/574816.mp3"
"ku djisan timadju.","","他是我叔叔。","https://web.klokah.tw/text/sound/36564/574817.mp3"
"tima zua vavayan.","Who is that woman?","那個女生是誰?","https://web.klokah.tw/text/sound/36564/574818.mp3"
"u kaka tjavulung a vavayan.","She is my sister.","她是我姐姐。","https://web.klokah.tw/text/sound/36564/574819.mp3"
"tima zua qaqunuan?","Who is that kid?","那個小孩是誰?","https://web.klokah.tw/text/sound/36564/574820.mp3"
"u kaka tjakeri a uqaljay.","He is my younger brother.","他是我的弟弟。","https://web.klokah.tw/text/sound/36564/574821.mp3"
"anema sengsengan na su kina?","What does your mother do?","你的媽媽從事什麼工作?","https://web.klokah.tw/text/sound/36564/574822.mp3"
"sividay timadju.","She is a soldier.","她是軍人。","https://web.klokah.tw/text/sound/36564/574823.mp3"
"anema sengsengan na su kama?","What does your father do?","你的爸爸從事什麼工作?","https://web.klokah.tw/text/sound/36564/574824.mp3"
"sinsi timadju.","He is a teacher.","他是老師。","https://web.klokah.tw/text/sound/36564/574825.mp3"
"timadju su kaka tjakeri a uqaljay?","Is he your younger brother?","他是你弟弟嗎?","https://web.klokah.tw/text/sound/36564/574826.mp3"
"ini, timadju na ku kaka tjakeri uqaljay a qali.","No, he is my younger brother’s friend.","不是，他是我弟弟的朋友。","https://web.klokah.tw/text/sound/36564/574827.mp3"
"timadju su kaka tjavulung a vavayan?","Is she your elder sister?","她是你姊姊嗎?","https://web.klokah.tw/text/sound/36564/574828.mp3"
"ini, u kaka tjakeri a vavayan timadju.","No, she is my younger sister.","不是，她是我的妹妹。","https://web.klokah.tw/text/sound/36564/574829.mp3"
"mapida mun a taqumaqanan?","How many people in their family?","他們全家有幾個人?","https://web.klokah.tw/text/sound/36564/574830.mp3"
"izua lima taqumaqanan niamadju.","There are five people in their family.","他們全家有五個人。","https://web.klokah.tw/text/sound/36564/574831.mp3"
"mapida nu taqumaqanan a kakerian?","How many children in your family?","你們家有幾個小孩?","https://web.klokah.tw/text/sound/36564/574832.mp3"
"ma sepatj a nia aljak.","There are four children in our family.","我們共有四個小孩。","https://web.klokah.tw/text/sound/36564/574833.mp3"
"mapida su kaka tjakeri uqaljay kata vavayan?","How many younger siblings do you have?","你有幾個弟妹?","https://web.klokah.tw/text/sound/36564/574834.mp3"
"neka ku kaka tjakeri a uqaljay, izua tjelu tjakeri a kaka vavayan.","I don’t have any younger brothers, but I have three younger sisters.","我沒有弟弟，有三位妹妹。","https://web.klokah.tw/text/sound/36564/574835.mp3"
"mapida su kaka tjavulung a uqaljay kata vavayan.","How many older siblings do you have?","你有幾個兄姊?","https://web.klokah.tw/text/sound/36564/574836.mp3"
"neka ku kaka tjavulung a uqaljay kata vavayan.","I don’t have any older siblings.","我沒有兄姊。","https://web.klokah.tw/text/sound/36564/574837.mp3"
"mapida su siruvetjek?","How many siblings do you have?","你有幾個兄弟姐妹?","https://web.klokah.tw/text/sound/36564/574838.mp3"
"neka ku siruvetjek.","I don’t have any siblings.","我沒有兄弟姐妹。","https://web.klokah.tw/text/sound/36564/574839.mp3"
"marekaka mun a uqaljay?","Are you brothers?","你們是兄弟嗎?","https://web.klokah.tw/text/sound/36564/574840.mp3"
"ui, timadju ku kaka tjavulung a uqaljay.","Yes, he is my brother.","是，他是我哥哥。","https://web.klokah.tw/text/sound/36564/574841.mp3"
"kacalisian mun?","Are you aboriginals?","你們是原住民嗎?","https://web.klokah.tw/text/sound/36564/574842.mp3"
"ui, kacalisian na men.","Yes, we are aboriginals.","是，我們是原住民。","https://web.klokah.tw/text/sound/36564/574843.mp3"
"paiwazuku timadju tauta?","Is she Paiwan too?","她也是排灣族嗎?","https://web.klokah.tw/text/sound/36564/574844.mp3"
"ui, timadju paiwanzuku uta.","Yes, she is Paiwan too.","是的，她也是排灣族人。","https://web.klokah.tw/text/sound/36564/574845.mp3"
"kasauny makuda kalevelevan?","How’s the weather today?","今天天氣如何?","https://web.klokah.tw/text/sound/36567/574884.mp3"
"a kalevelevan pasu ljaljeqel, temekel itjen tua linalja a zaljum.","It’s a bit cold, so you need to drink more warm water.","天氣有點冷，要多喝熱水。","https://web.klokah.tw/text/sound/36567/574885.mp3"
"kasauny makuda kalevelevan?","How’s the weather today?","今天天氣如何?","https://web.klokah.tw/text/sound/36567/574886.mp3"
"a kalevelevan pasu semezam, temekel itjen tua liaw a zaljum.","It’s a bit hot, so we need to drink more water.","天氣有點熱，我們要多喝水。","https://web.klokah.tw/text/sound/36567/574887.mp3"
"makuda kalevelevan i sasaw?","How’s the weather outside?","外面天氣如何?","https://web.klokah.tw/text/sound/36567/574888.mp3"
"qaca qadaw, paqenetju kiljaungu tua qadaw.","The sun is bright and remember to wear sunscreen.","太陽很大，要記得防曬。","https://web.klokah.tw/text/sound/36567/574889.mp3"
"makuda kalevelevan i sasaw?","How’s the weather outside?","外面天氣如何?","https://web.klokah.tw/text/sound/36567/574890.mp3"
"liaw qerepus, neka qadaw i kalevelevan.","There are a lot of clouds but no sun in the sky.","雲很多，天空沒有太陽。","https://web.klokah.tw/text/sound/36567/574891.mp3"
"makuda kalevelevan nutiyaw?","How is the weather tomorrow?","明天天氣如何?","https://web.klokah.tw/text/sound/36567/574892.mp3"
"nutiyaw neka qadaw, liaw qerepus, qaca vali.","It will be cloudy and windy but not sunny tomorrow.","明天沒有太陽，雲很多，風很大。","https://web.klokah.tw/text/sound/36567/574893.mp3"
"tazua qadaw makuda kalevelevan?","How was the weather that day?","那天天氣如何?","https://web.klokah.tw/text/sound/36567/574894.mp3"
"tazua qadaw pasu ljaljeqel, kavau ta tjiaku nu ljisasaw.","It was a bit cold and you needed to wear a jacket when you went outside.","這天有點冷，出門要穿外套。","https://web.klokah.tw/text/sound/36567/574895.mp3"
"nu kilavay makuda kalevelevan?","How’s the weather on the weekend?","假日天氣如何?","https://web.klokah.tw/text/sound/36567/574896.mp3"
"nu kilavay sarenguaq a kalevelevan.","It will be sunny on the weekend.","假日天氣晴朗(舒服)。","https://web.klokah.tw/text/sound/36567/574897.mp3"
"tazua qadaw uri qemudjalj?","Will it be rainy that day?","那天會下雨嗎?","https://web.klokah.tw/text/sound/36567/574898.mp3"
"tazua maqadaw a kalevelevan, ika qemudjalj.","It will have no rain and be sunny that day.","那天天氣晴朗，不會下雨。","https://web.klokah.tw/text/sound/36567/574899.mp3"
"tazua qadaw uri qemudjalj?","Will it be rainy that day?","那天會下雨嗎?","https://web.klokah.tw/text/sound/36567/574900.mp3"
"ui, uri qemudjalj nu tazua qadaw.","Yes, it will be rainy that day.","是，那天會下雨。","https://web.klokah.tw/text/sound/36567/574901.mp3"
"tucu na qemudjalj ri?","Is it raining now?","現在有下雨嗎?","https://web.klokah.tw/text/sound/36567/574902.mp3"
"meljay anga, tjevutanga qadaw.","The rain stops and the sun comes out.","雨停了，太陽出來了。","https://web.klokah.tw/text/sound/36567/574903.mp3"
"izua qudjalj tucu?","Is it raining now?","現在有下雨嗎?","https://web.klokah.tw/text/sound/36567/574904.mp3"
"qemudjalj anga, ika namasi ljinay aken.","It is raining and I don’t have an umbrella with me.","下雨了，我沒有帶傘。","https://web.klokah.tw/text/sound/36567/574905.mp3"
"qemudjaqudjalj a i sasaw?","Is it raining outside?","外面有下雨嗎?","https://web.klokah.tw/text/sound/36567/574906.mp3"
