"aza nimun siqaljuqaljup a kuwang a turivecan izua anema palisi?","Do you have any taboos about hunting weapons?","你們打獵的武器有什麼禁忌嗎?","https://web.klokah.tw/text/sound/36582/575256.mp3"
"aza tja siqaljup kuwang a turivecan dikinay vavayan a cemelcel.","Our hunting weapons are untouchable to women.","我們打獵的武器不可以讓女生碰到。","https://web.klokah.tw/text/sound/36582/575257.mp3"
"aza vavayan dikilu kiciul a qemaljup?","Then, can women go hunting together?","那女人可以一起去打獵嗎?","https://web.klokah.tw/text/sound/36582/575258.mp3"
"dikinay, a vavayan inika dikilu a qemaljup tauta.","No, women cannot go hunting either.","不行，女人也不可以打獵。","https://web.klokah.tw/text/sound/36582/575259.mp3"
"buya nekanga vauwa i tjumaq, sau veliu ta vauwa.","buya, our home is out of rice wine, please go and buy some.","buya，家裡沒有米酒了，你去買米酒。","https://web.klokah.tw/text/sound/36584/575290.mp3"
"izuanan ita dalilj i kakesan. pasaladji a venely.","There is still one bottle left in the kitchen, so there is no need to buy one!","廚房裡還有一瓶，不用買吧!","https://web.klokah.tw/text/sound/36584/575291.mp3"
"talanay a ita dalilj, sau veliu anan tu drusa mangetjez.","One bottle is not enough for me, go and buy two more back.","一瓶不夠，再去買兩瓶回來。","https://web.klokah.tw/text/sound/36584/575292.mp3"
"uli veneli aken ta vauwa, pavelively mun?","I am looking for rice wine. Do you have any rice wine?","我要買米酒，你們有賣嗎?","https://web.klokah.tw/text/sound/36584/575293.mp3"
"izua ! uli pida su velin?","Yes! How many bottles do you need?","有啊!你要買多少?","https://web.klokah.tw/text/sound/36584/575294.mp3"
"uli venely aken tu drusa dalilj, venely anan tua talubukan a paday","I want two bottles and a pack of rice.","我要買兩瓶，還要買一包米。","https://web.klokah.tw/text/sound/36584/575295.mp3"
"imaza paday, anemanan su kinasaljingan?","Here is the rice, what else do you need?","米在這裡，你還需要什麼嗎?","https://web.klokah.tw/text/sound/36584/575296.mp3"
"uli venely anan ken ta qecilu, izua nimun?","I want some eggs too, do you have some?","我還要買蛋，你們有嗎?","https://web.klokah.tw/text/sound/36584/575297.mp3"
"nekanga nia qecilu na sepavei anga.","We are out of eggs.","我們的蛋賣完了。","https://web.klokah.tw/text/sound/36584/575298.mp3"
"uli venely aken ta kava.","I want to buy some clothes.","我要買衣服。","https://web.klokah.tw/text/sound/36584/575299.mp3"
"anema su kinasaljinga a alang.","What kind of clothes do you like?","你想要什麼樣子的呢?","https://web.klokah.tw/text/sound/36584/575300.mp3"
"uli venely aken tua hansudi a kava.","I want to buy the clothes with short sleeves.","我要買短袖的衣服","https://web.klokah.tw/text/sound/36584/575301.mp3"
"aicu qudjidjilj a kava makuda?","How about this red one?","這件紅色的如何?","https://web.klokah.tw/text/sound/36584/575302.mp3"
"izua malji a quljaw.","Do you have another color?","有別的顏色嗎?","https://web.klokah.tw/text/sound/36584/575303.mp3"
"izuanan niamen a vuteqiteqilj kata cangiangia.",": We have white and blue ones too.","我們還有白色和藍色。","https://web.klokah.tw/text/sound/36584/575304.mp3"
"pavai a ken ta cangiangia a kava tu ita.","Please give me the clothes in blue.","請給我一件藍色的衣服。","https://web.klokah.tw/text/sound/36584/575305.mp3"
"camak na mainu sun kasauny? na vaik sun a undu?","camak, where have you been just now? Did you go exercising?","camak你剛剛去哪裡了?你去運動嗎?","https://web.klokah.tw/text/sound/36584/575306.mp3"
"ini, uli vaik pusaladj ta ku vuvu vavayan pavely ta ljaceng.","No, I went grocery shopping for my grandma.","不是，我去幫奶奶賣菜。","https://web.klokah.tw/text/sound/36584/575307.mp3"
"maitazua! izua su djikan nu qezemetj? timitja kaciul a kaiv.","No wonder! Are you available at night? Would you like to have a meal with me?","這樣啊，你晚上有沒有空?要不要和我一起吃飯。","https://web.klokah.tw/text/sound/36584/575308.mp3"
"dikinay, uli vaik aken venely tua kava.","No, I want to buy some clothes.","不行，我要去買衣服。","https://web.klokah.tw/text/sound/36584/575309.mp3"
"saka kiciul aken tjanusun a vaik.","Then, I will go with you.","那我跟你一起去。","https://web.klokah.tw/text/sound/36584/575310.mp3"
"djavadjavay, kivadaqaw aicu a talekelekan a ljaceng pida pakiyaw?","Hello, how much is this bunch of vegetables?","你好，請問這把菜多少錢?","https://web.klokah.tw/text/sound/36584/575311.mp3"
"a ljaceng nu ita talekelekan drusa puluq a pakiyaw.","The vegetables are $20 for a bunch.","菜一把20元。","https://web.klokah.tw/text/sound/36584/575312.mp3"
"aicu a vurasi pida paisu?","How much are these sweet potatoes?","這個地瓜多少錢?","https://web.klokah.tw/text/sound/36584/575313.mp3"
"a vurasi nu ita tjingtjing tjelu puluq a pakiyaw.","Sweet potatoes are thirty dollars for a pound.","地瓜一斤30元","https://web.klokah.tw/text/sound/36584/575314.mp3"
"pavai en tu drusa talekelekan a ljaceng kata ita tjingtjing a vurasy.","Please give me two bunches of vegetables and a pound of sweet potatoes.","請給我兩把菜和一斤地瓜。","https://web.klokah.tw/text/sound/36584/575315.mp3"
"camak madraudraw a kemacu ta tingnaw ken, dikilu sun a pasedjam tjanuaken?","camak, I forgot to bring my pen. Can you lend me one?","camak，我忘了帶筆，你可以借我嗎?","https://web.klokah.tw/text/sound/36586/575346.mp3"
"neka niaken tauta, aicu ni muni.","I don’t have one either. This is muni’s.","我也沒有，這支是muni的。","https://web.klokah.tw/text/sound/36586/575347.mp3"
"dikilu pasedjam tjanuaken a palamu? djaljaw ki u pacikely tjanusun.","Can you lend me the pen for a second? I will return to you immediately.","那可以借我一下子嗎?我很快就還你。","https://web.klokah.tw/text/sound/36586/575348.mp3"
"ui, alapu.","Sure, take it.","好，拿去。","https://web.klokah.tw/text/sound/36586/575349.mp3"
"masalu, pusaladji anga ken a pasemalaw tjai muni tu masalu.","Thank you and thank muni for me.","謝謝，也幫我謝謝muni。","https://web.klokah.tw/text/sound/36586/575350.mp3"
"anemanan su kinasaljinga?","May I help you?","需要什麼嗎?","https://web.klokah.tw/text/sound/36586/575351.mp3"
"uli pacikel aken tua aicu a drusa sapitj.","I want to return these two books.","我要還這兩本書。","https://web.klokah.tw/text/sound/36586/575352.mp3"
"ui, uli saljinganan sun ta anema?","No problem and what else do you need?","好的，還需要什麼嗎?","https://web.klokah.tw/text/sound/36586/575353.mp3"
"tiaken uli kisedjam anan ta aicu tjelu a sapitj.","I would like to borrow these three books.","我還要借這三本書。","https://web.klokah.tw/text/sound/36586/575354.mp3"
"ui, nusikatjelu anga paqenetju a pacikel.","Sure and remember to return them after three days.","好了，記得三天後要拿來還。","https://web.klokah.tw/text/sound/36586/575355.mp3"
"inianan pacikel sun ta ku siquluqulip.","You haven’t returned me the eraser.","你還沒還我橡皮擦。","https://web.klokah.tw/text/sound/36586/575356.mp3"
"katiaw u pinacikel anga.","I returned it yesterday.","我昨天就還了。","https://web.klokah.tw/text/sound/36586/575357.mp3"
"aza ku siquliqulip manu mainu maulav anga.","Then, why is my eraser missing?","那我的橡皮擦怎麼不見了。","https://web.klokah.tw/text/sound/36586/575358.mp3"
"su sinipasedjam tjai camak anga.","Did you lend it to camak?","你是不是借給canak了。","https://web.klokah.tw/text/sound/36586/575359.mp3"
"ika ken kemeljang. u vaiki a kivadaq timadju.","I don’t know. I will go and ask her.","我不知道。我去問問她。","https://web.klokah.tw/text/sound/36586/575360.mp3"
"pasedjamay anan sun ta u siquliqulip.","I will lend you my eraser first.","我的橡皮擦先借你。","https://web.klokah.tw/text/sound/36586/575361.mp3"
"muni, ti camak a na pasedjam tjanusun tucu a tjiaku?","muni, did camak lend you this coat?","muni，這個外套是camak借你的嗎?","https://web.klokah.tw/text/sound/36586/575362.mp3"
"ini, aicu na u kina vinelian tjanuaken.","No, my mom bought it for me.","不是，這是我媽媽買給我的。","https://web.klokah.tw/text/sound/36586/575363.mp3"
"mamaw tjiaku kati camak.","camak’s coat is the same as yours.","camak的外套跟你的一樣。","https://web.klokah.tw/text/sound/36586/575364.mp3"
"a nimadju tjiaku qecengecengel, ika mamaw niamen quljaw.","His coat is black, so our colors are different.","他的外套是黑色的，我們的顏色不一樣。","https://web.klokah.tw/text/sound/36586/575365.mp3"
"muni, na kisedjam sun ta paisu ni camak?","muni, did you borrow money from camak?","muni，你有跟camak借錢嗎?","https://web.klokah.tw/text/sound/36586/575366.mp3"
"izua, uli pacikeleng angata kasauny tjaimadju, ljakua madraudraw a kemacu ta paisu.","Yes, I was supposed to return to him today, but I forgot to bring the money.","有，我本來今天要還他，我忘記帶錢了。","https://web.klokah.tw/text/sound/36586/575367.mp3"
"sa nungida uli su pacikeleng?","Then, when will you return the money?","那你什麼時候要還?","https://web.klokah.tw/text/sound/36586/575368.mp3"
"nutiaw u pacikelaw anga tjaimadju.","I will return to him tomorrow.","我明天就還給他。","https://web.klokah.tw/text/sound/36586/575369.mp3"
"ui, u pusaladjay sun a pasemalav tjai camak.","Okay, I will tell camak for you.","好，我幫你跟camak說。","https://web.klokah.tw/text/sound/36586/575370.mp3"
"nu djemekep tua kulavaw ayaing ta siqezetjan tua qaciljay a dringay, a djemekep tua tjikuray ayaing ta veceqel a dringay.","It is correct to catch mice through rangay and catch bamboo partridges through qjiulang.","老鼠應該要⽤⽯壓式陷阱抓，⽵雞應該要⽤套頸式陷阱抓，這樣才對。","https://web.klokah.tw/text/sound/36588/575401.mp3"
"manu maitucu, pasalisaliw anga ken djaljepan ika na djemameq.","No wonder! I am mistaken and that’s why I cannot catch any of them.","原來是這樣，我都搞錯了！難怪我都抓不到。","https://web.klokah.tw/text/sound/36588/575402.mp3"
"u su tuluvi anga tu kemuda cukulu ta drusa malji a dringay.","Then I will teach you how to set up these two traps.","那我再教你怎麼製作這兩種陷阱。","https://web.klokah.tw/text/sound/36588/575403.mp3"
"ui! bulay ngata! nu maitucu uli macaqu a djemekep ta sacemel.","Great! I will be able to catch the prey in the future.","好啊！太棒了！這樣我以後就會抓到獵物了。","https://web.klokah.tw/text/sound/36588/575404.mp3"
"laladruqan anga cemel i can, sau alapu ta dramiya i kuvaw, ali semavavua.","The grass in the fields is too tall. Go to the warehouse to take the sickle and let’s go to the fields.","田裡的草太長了，你去倉庫拿鐮刀，我們去田裡。","https://web.klokah.tw/text/sound/36588/708370.mp3"
"pini inu a dramiya?","Where are the sickles?","鐮刀放在哪裡?","https://web.klokah.tw/text/sound/36588/594024.mp3"
"aza itua cepeng a gidigidi, nu ljitaladj sun ta kuvaw su pacuanan anga.","It is next to the round basket. You will see it when you enter the warehouse.","在簍子的旁邊，你進去倉庫就會看到了。","https://web.klokah.tw/text/sound/36588/575406.mp3"
"kigalju a malap, maya mapasaqetju. ladjay a dramiya.","Be careful and don’t get hurt. The sickle is very sharp.","小心拿，不要受傷。鐮刀很利。","https://web.klokah.tw/text/sound/36588/575407.mp3"
"maya djemulat a ku dringay!","Don’t step on my trap!","不要踩到我的陷阱!","https://web.klokah.tw/text/sound/36588/575408.mp3"
"inuan a su dringay?","Where is your trap?","你的陷阱在哪裡?","https://web.klokah.tw/text/sound/36588/594025.mp3"
"a ku dringay izua i petekuteku ta kasiw.","My trap is under that tree.","我的陷阱在那棵樹的下面。","https://web.klokah.tw/text/sound/36588/575409.mp3"
"akumaya paqenetj sun?","How do you remember?","你怎麼會記得?","https://web.klokah.tw/text/sound/36588/594026.mp3"
"imaza u pinizua ta pukeljang, kemeljang a ken ta u dringay tu inu.","I make a mark here, so I know where my trap is.","我在這邊有做記號，我知道我的陷阱在哪裡。","https://web.klokah.tw/text/sound/36588/575410.mp3"
"aicu a kadrau tja pasa maza i pana a kiciqaw.","This is a fish trap which we put beside the river for fishing.","這是魚筌，我們放在溪邊捕魚。","https://web.klokah.tw/text/sound/36588/575411.mp3"
"aza izua neka tja kadrau, tiamen ayaing ta panadip a djemekep ta ciqaw.","We don’t have any fish traps there, so we catch fish with a fishing rod.","我們那邊沒有魚筌，我們都用釣竿抓魚。","https://web.klokah.tw/text/sound/36588/575412.mp3"
"inianan paqayam a panadip a ken, nu tjaivililj tului anga ken wi?","I have never used a fishing rod before, would you mind teaching me next time?","我沒有用過釣竿，你下次教我好嗎?","https://web.klokah.tw/text/sound/36588/575413.mp3"
"ui! nu tjaivililj maciuli anga panadip.","Sure! Let’s go fishing together next time.","好啊!我們下次一起去釣魚。","https://web.klokah.tw/text/sound/36588/575414.mp3"
"nu tjaivililj u tului anga sun ta seman kadrau","I will teach you how to make a fish trap next time.","那我下次教你做魚筌。","https://web.klokah.tw/text/sound/36588/575415.mp3"
"midradrua su panadip, qadjaw izua ciqaw na makalavic! kilimu lakacu.","Your fishing rod is moving. Isn’t the fish on the hook? Pull it up!","你的釣竿動了，是不是有魚上鉤了!你快拉起來。","https://web.klokah.tw/text/sound/36588/575416.mp3"
"galjuanan, mirarua ravac a varukur, imaza en a lemakac ta panadip, sau mazua pusaladj a malap tua ku aralj.","Wait, the ship is rolling heavily. I am here to pull the fishing rod and you should go there to grab me the net.","等等，船太晃了，我在這邊拉釣竿，你去那邊幫我拿網子來。","https://web.klokah.tw/text/sound/36588/575417.mp3"
"lakacu a ciqaw pasa maza tjanuaken, u pusaladjay sun a lemakac.","Pull the fish to my side and I will help you pull it up.","你把魚拉到我這邊。我幫妳拉起來。","https://web.klokah.tw/text/sound/36588/575418.mp3"
"bulay angata! kasauny pulamy, aza kadrangu na mapeljuq anga.","Great! It is a bumper crop today with full fish baskets.","太好了!今天大豐收，魚簍都裝滿了。","https://web.klokah.tw/text/sound/36588/575419.mp3"
"kilimu vaiki tja sipaseljavak katua mapuljat.","Let’s go back immediately and share it with everyone.","我們快回去和大家分享。","https://web.klokah.tw/text/sound/36588/575420.mp3"
"mangedjez anga ti sinsi.","The teacher is here.","老師來了。","https://web.klokah.tw/text/sound/63478/889896.mp3"
"maya kivangavang anga, qiladju kilimu i ta qiladjan.","Stop playing and quickly sit in your seat.","不要再玩了，快坐在座位上。","https://web.klokah.tw/text/sound/63478/889897.mp3"
"pazekadjan, gemaljuanga ken.","Sorry, I’m late!","抱歉，我遲到了。","https://web.klokah.tw/text/sound/63478/889898.mp3"
"tedepu a kilimu.","Come in quickly.","快進來。","https://web.klokah.tw/text/sound/63478/889899.mp3"
"sikapida qadaw tucu?","What day is it today?","今天星期幾?","https://web.klokah.tw/text/sound/63478/889900.mp3"
"sikalima a’adaw tucu, pulavay nu tiyav, kaciwciwli anga vayika kivangavang!","It’s Friday today, we have a day off tomorrow. Let’s go out and play together!","今天星期五，明天放假，一起出去玩吧!","https://web.klokah.tw/text/sound/63478/889901.mp3"
"nanguwa! vayikanga djen a semapana.","Great! Let’s go to the riverside.","好啊!我們去河邊。","https://web.klokah.tw/text/sound/63478/889902.mp3"
"sikapida ’adaw nu tiyiav?","What day will it be tomorrow?","明天星期幾?","https://web.klokah.tw/text/sound/63478/889903.mp3"
"sikadjelu nu tiyav, nu tiyave a makakecengelj vayikanga djen a kivangavang ta benulu!","Tomorrow will be Wednesday. Let’s go play ball tomorrow afternoon!","明天星期三，我們明天下午去玩球吧!","https://web.klokah.tw/text/sound/63478/889904.mp3"
"anema su kudayin nu tiyav a qadjaman?","What will you be doing tomorrow morning?","你明天早上要做什麼?","https://web.klokah.tw/text/sound/63478/889905.mp3"
"sikapidjulj nu tiyav, vayiq a ken sema kiyukay kati kina.","Tomorrow will be Sunday, I will be going to church with my mom.","明天是星期日，我要和媽媽去教會。","https://web.klokah.tw/text/sound/63478/889906.mp3"
"makuda sun?","What’s wrong?","你怎麼了?","https://web.klokah.tw/text/sound/63478/889907.mp3"
"pasumudjaq ken, vayiq a ken sema bingzu(aluvu).","I feel like vomiting. I need to go to the restroom.","我想吐，我要去廁所。","https://web.klokah.tw/text/sound/63478/889908.mp3"
"malingace alavac a ku qulu.","I feel dizzy.","我頭好暈。","https://web.klokah.tw/text/sound/63478/889909.mp3"
"su sikebung anan a kisuzeliyan.","Lie down and rest.","你趴著休息。","https://web.klokah.tw/text/sound/63478/889910.mp3"
"sinsi, sakedju a ku djiyalj, pasa mabingzu.","Teacher, I have a stomachache. I need to go to the restroom.","老師，我肚子痛，要去廁所。","https://web.klokah.tw/text/sound/63478/889911.mp3"
"ui, sau pakilimu.","Okay, go quickly.","好，快一點去。","https://web.klokah.tw/text/sound/63478/889912.mp3"
"makaiy(dikilu) ken a vayika pilima?","May I go wash my hands?","我可以去洗手嗎?","https://web.klokah.tw/text/sound/63478/889913.mp3"
"uri paluwanga ta kakituluan, galjuwanan a su sivayiq.","It’s almost time for class to end. Wait a little longer.","快下課了，等一下再去。","https://web.klokah.tw/text/sound/63478/889914.mp3"
"sinsi, sa’edju a ku ’ulu, kivada ken nu maka kingcengelj.","It’s almost time for class to end. Wait a little longer.","老師，我頭好痛，下午要請假。","https://web.klokah.tw/text/sound/63478/889915.mp3"
"ui, kinemenemu a madjumaq.","Okay, take care and go home.","好，回家小心。","https://web.klokah.tw/text/sound/63478/889916.mp3"
"sinsi, uri kivadaq a ken nu djayvililj a sika ita qadaw, vayiq aken kipacun ta kuysang.","Teacher, I need to take a sick leave next Monday. I have to see a doctor.","老師我下禮拜一要請假，我要去看醫生。","https://web.klokah.tw/text/sound/63478/889917.mp3"
"ui, kiljivakan a su kinacavacavan.","Alright, take care of yourself.","好，保重身體。","https://web.klokah.tw/text/sound/63478/889918.mp3"
"maynu ti paday?","Where is paday?","paday在哪裡?","https://web.klokah.tw/text/sound/63478/889919.mp3"
"sa’edju a djialj ni madju, i bingzu ti madju.","She has a stomachache. She’s in the restroom.","她肚子痛，她在廁所。","https://web.klokah.tw/text/sound/63478/889920.mp3"
"inuan ti kadraw?","Where is kadraw?","kadraw在哪裡?","https://web.klokah.tw/text/sound/63478/889921.mp3"
"sinsi, sa’edju a djugerau ni kadraw, na kivada tusaa ’adaw.","Teacher, kadraw has a sore throat. She took a sick leave today.","老師，kadraw喉嚨痛，今天請假。","https://web.klokah.tw/text/sound/63478/889922.mp3"
"awmaya ini a mangedjez ti paday?","Why didn’t paday come?","paday為甚麼沒來?","https://web.klokah.tw/text/sound/63478/889923.mp3"
"na masezam ti madju.","She has a fever.","她發燒了。","https://web.klokah.tw/text/sound/63478/889924.mp3"
"pai kipakeljangu dja nu sun.","Please introduce yourself.","請自我介紹。","https://web.klokah.tw/text/sound/63481/889962.mp3"
"a ku ngada ti camak, tapuluq aku cavilj.","My name is camak, and I’m 10 years old.","我叫camak，我今年10歲。","https://web.klokah.tw/text/sound/63481/889963.mp3"
"anemaya su ngadan?","What’s your name?","你叫甚麼名字?","https://web.klokah.tw/text/sound/63481/889964.mp3"
"a ku ngada ti camak.","My name is camak.","我叫camak。","https://web.klokah.tw/text/sound/63481/889965.mp3"
"aljaq su na anema zuku?","What ethnic group are you from?","你是哪一族的小孩?","https://web.klokah.tw/text/sound/63481/889966.mp3"
"aljaq a ken na paywan zuku.","I’m from the paywan.","我是排灣族小孩。","https://web.klokah.tw/text/sound/63481/889967.mp3"
"kacalisiyan a su kinacemeqeljan?","Are all your family members indigenous?","你的家人都是原住民嗎?","https://web.klokah.tw/text/sound/63481/889968.mp3"
"ui, paywan amen a tacekeljan.","Yes, my whole family is paywan.","是的，我們全家都是排灣族人。","https://web.klokah.tw/text/sound/63481/889969.mp3"
"kacalisiyan a su kinacemeqeljan?","Are all your family members indigenous?","你的家人都是原住民嗎?","https://web.klokah.tw/text/sound/63481/889970.mp3"
"ini, paywan aku kama, paylang aku kina.","No, my father is paywan, and my mother is Han Taiwanese.","不是，我的爸爸是排灣族，我的媽媽是漢人。","https://web.klokah.tw/text/sound/63481/889971.mp3"
"nima sun a aljak?","Whose child are you?","你是誰的小孩?","https://web.klokah.tw/text/sound/63481/889972.mp3"
"aljaq aken ni camak.","I am camak’s child.","我是camak的小孩。","https://web.klokah.tw/text/sound/63481/889973.mp3"
"su kama a zuwa? pidanga cavilje ni madju?","Is that your father? How old is he?","那位是你爸爸嗎? 他幾歲了?","https://web.klokah.tw/text/sound/63481/889974.mp3"
"unem a pulu anga cavilj ni madju.","He is 60 years old.","他六十歲了。","https://web.klokah.tw/text/sound/63481/889975.mp3"
"su kama a zuwa? pidanga cavilje ni madju?","Is that your father? How old is he?","那位是你爸爸嗎? 他幾歲了?","https://web.klokah.tw/text/sound/63481/889976.mp3"
"ini, niya lamaljeng ti madju i qinalja, alu a pulu anga a cavilj ni madju.","No, he is an elder of our tribe. He is 80 years old.","不是，他是我們部落的耆老，他80歲了。","https://web.klokah.tw/text/sound/63481/889977.mp3"
"pida anga a cavilj na su kaka djavulung?","How old is your brother?","你哥哥幾歲了?","https://web.klokah.tw/text/sound/63481/889978.mp3"
"a ku kukaka a djavulung ita sa alu pulu a cavilj.","My brother is 18 years old.","我哥哥18歲了。","https://web.klokah.tw/text/sound/63481/889979.mp3"
"a su kaka djavulung ta cavilj djavulung alavac djanusun?","Is your brother much older than you?","你哥哥年紀比你大很多嗎?","https://web.klokah.tw/text/sound/63481/889980.mp3"
"lima cavilj a nia tideq.","We have a 5-year age difference.","我們差5歲。","https://web.klokah.tw/text/sound/63481/889981.mp3"
"pida a su pasaqaca?","How tall are you?","你身高多少?","https://web.klokah.tw/text/sound/63481/889982.mp3"
"ita sa sepadj pulu a ku pasaqaca.","I’m 140 centimeters.","我140公分。","https://web.klokah.tw/text/sound/63481/889983.mp3"
"cuacuay anga ini a mapacucun, tuki sun na ljavavaw anga?","I haven’t seen you in a while. Have you grown taller?","好久不見，你是不是長高了?","https://web.klokah.tw/text/sound/63481/889984.mp3"
"ui, ita sa djelu a puluq a ku pasavavaw.","Yes, I’m 130 centimeters now.","對阿，我130公分了。","https://web.klokah.tw/text/sound/63481/889985.mp3"
"tu kisun a meqaca anga?","Have you gained weight?","你是不是胖了?","https://web.klokah.tw/text/sound/63481/889986.mp3"
"ini, pasaliv anga a su pinacunan.","No, you’re mistaken.","沒有，你看錯了。","https://web.klokah.tw/text/sound/63481/889987.mp3"
"maliljai anga sun?","Have you lost weight?","你瘦了嗎?","https://web.klokah.tw/text/sound/63481/889988.mp3"
"ini, meqaca anga ken.","No, I’ve gained weight.","沒有，我胖了。","https://web.klokah.tw/text/sound/63481/889989.mp3"
"meqacanga sun?","Have you gained weight?","你胖了嗎?","https://web.klokah.tw/text/sound/63481/889990.mp3"
"ui, djelu a pulu anga djindjin a ku siqaacanga tucu.","Yes, I weigh 30 kilograms now.","對，我現在30公斤了。","https://web.klokah.tw/text/sound/63481/889991.mp3"
"semay nu sun?","Where are you going?","你要去哪裡?","https://web.klokah.tw/text/sound/63484/890026.mp3"
"vayike ken sema pangkungse kemim tay singsi.","I’m going to the office to see the teacher.","我要去辦公室找老師。","https://web.klokah.tw/text/sound/63484/890027.mp3"
"semaynu ti kadraw?","Where is kadraw going?","kadraw要去哪裡?","https://web.klokah.tw/text/sound/63484/890028.mp3"
"uri vayika venelic ta cemel ti madju.","He’s going to throw away the trash.","他要去丟垃圾。","https://web.klokah.tw/text/sound/63484/890029.mp3"
"inuan ti kadraw?","Where is kadraw?","kadraw在哪裡?","https://web.klokah.tw/text/sound/63484/890030.mp3"
"i ta kakavekavan ti madju, uri malalumalje ta kemavekav ti madju nusawni.","He’s at the swimming pool. He’s going to compete in a swimming competition later.","他在游泳池，他等一下要比賽游泳。","https://web.klokah.tw/text/sound/63484/890031.mp3"
"inuan ti paday? uri malalumalje ta mekelje ti madju nusawni.","Where is paday? She’s going to compete in a running competition later.","paday在哪裡?她等一下要比賽跑步。","https://web.klokah.tw/text/sound/63484/890032.mp3"
"i ta kakaqepuan ti madj, ku vaykaw a djemaulj ti madj.","She’s in the auditorium. I’ll go call her.","她在禮堂，我去叫她。","https://web.klokah.tw/text/sound/63484/890033.mp3"
"kawdelji a vayiq sema ta aungduan.","Let’s go to the playground together.","一起去操場吧。","https://web.klokah.tw/text/sound/63484/890034.mp3"
"vayikanan akn a kiveli ta cengelj, kalikimen anga sun nusawni.","I’ll go buy lunch first, and then I’ll meet you later.","我先去買午餐，等一下去找你。","https://web.klokah.tw/text/sound/63484/890035.mp3"
"kaciyuli a vayiq cemaculju ta bingtu!","Let’s carry the lunch boxes together!","一起去抬便當吧!","https://web.klokah.tw/text/sound/63484/890036.mp3"
