"mavacangʉ mʉmʉa, ruamia cita.","Hello everyone. Here we go.","大家好。我們開始了。","https://web.klokah.tw/text/sound/27431/455314.mp3"
"umacʉka kiia! malitʉnʉlʉ!"," Please stand up! Salute!","請起立! 敬禮!","https://web.klokah.tw/text/sound/27431/455315.mp3"
"mavacangʉ pakiaturua."," Hello.","老師好。","https://web.klokah.tw/text/sound/27431/455316.mp3"
"tuapuru kiia!"," Please sit down.","請坐下!","https://web.klokah.tw/text/sound/27431/455317.mp3"
"mavacangʉ mʉmʉa, tumatuturua pakiaturua mʉmʉa arinani sipiamia kari aanʉaanʉ hla’alua."," Hello everyone. Today I am going to teach you how to say \\\"food\\\" in Raalua.","大家好。今天老師要教大家食物的拉阿魯哇語怎麼說。","https://web.klokah.tw/text/sound/27431/455318.mp3"
"tumakahlangi u i kari pakiaturua na?"," Do you understand what the teacher says?","你聽得懂老師的話嗎?","https://web.klokah.tw/text/sound/27431/455319.mp3"
"pakiaturua, ku aku takahlangʉ, tuahlʉ i pi ngahlangahla?"," I don’t understand. Can you repeat it again?","老師，我不懂。可以再說一次嗎?","https://web.klokah.tw/text/sound/27431/455320.mp3"
"ku aku a timahla, tuahlʉ i pi taisa?","I can’t hear you, can you speak louder?","我聽不到，可以大聲一點嗎?","https://web.klokah.tw/text/sound/27431/455321.mp3"
"kumakita kiia naani! pi ʉlʉsa ihlaku pi ngahlangahla.","Look here, please! Repeat after me.","請看這裡! 跟著我唸一遍。","https://web.klokah.tw/text/sound/27431/455322.mp3"
"mavacangʉ hliarimia.","It’s very well read.","唸得很好。","https://web.klokah.tw/text/sound/27431/455323.mp3"
"pia ngahlangahla. pia taisa kiia vahliungu.","Read it again. Please speak louder.","再唸一次。請大聲一點。","https://web.klokah.tw/text/sound/27431/455324.mp3"
"kukia rumariringi, kukia maluliri.","Please be quiet. Don’t talk.","請安靜。不要說話。","https://web.klokah.tw/text/sound/27431/455325.mp3"
"ruapuhlu kiia suhlatʉ."," Please take out your textbook.","請把課本拿出來。","https://web.klokah.tw/text/sound/27431/455326.mp3"
"a’ʉ, pakiaturua."," Yes, sir.","是的，老師。","https://web.klokah.tw/text/sound/27431/455327.mp3"
"ruapuhlu kiia siasuhlatʉ."," Please take out your pen.","請把筆拿出來。","https://web.klokah.tw/text/sound/27431/455328.mp3"
"pakiaturua, asapucu aku mahlava siasuhlatʉ."," I forgot to bring my pen.","老師，我忘了帶筆。","https://web.klokah.tw/text/sound/27431/455329.mp3"
"ruapuhlu kiia siasamusu."," Please take out the eraser.","請把橡皮擦拿出來。","https://web.klokah.tw/text/sound/27431/455330.mp3"
"pakiaturua, asapucu aku mahlava siasamusu."," I forgot to bring my eraser.","老師，我忘了帶橡皮擦。","https://web.klokah.tw/text/sound/27431/455331.mp3"
"umauhli kiia patʉkʉ laʉlaʉvʉ na siasamusu."," Please borrow erasers from your classmates.","請跟旁邊同學借橡皮擦。","https://web.klokah.tw/text/sound/27431/455332.mp3"
"pauhliu aku siasamusu a’ʉ i?"," Can I borrow your eraser?","借我橡皮擦好嗎?","https://web.klokah.tw/text/sound/27431/455333.mp3"
"taluvaili cu amu.","Class is over.","我們下課了。","https://web.klokah.tw/text/sound/27431/455334.mp3"
"umaria tainana cu amu, arupakakita mana taluavaʉlana.","Class dismissed, see you next week.","我們就上到這邊，下週再見。","https://web.klokah.tw/text/sound/27431/455335.mp3"
"ngahlaisa u?"," Who are you?","你是誰?","https://web.klokah.tw/text/sound/27432/455336.mp3"
"ihlaku ia Mu’u.","","我是Mu’u。","https://web.klokah.tw/text/sound/27432/455337.mp3"
"ngahlaisa u?"," Who are you?","你是誰?","https://web.klokah.tw/text/sound/27432/455338.mp3"
"ihlaku ia mamaini isa Tautau, ihlaku ia pia Paa’ʉ.","I am the son of Tautau, and my name is Paa’ʉ.","我是Tautau的兒子，我叫Paa’ʉ。","https://web.klokah.tw/text/sound/27432/455339.mp3"
"ngahlaisa u?"," Who are you?","你是誰?","https://web.klokah.tw/text/sound/27432/455340.mp3"
"ihlaku ia mamaini umaiapʉ isa Paa’ʉ ihlaku ia pia Mu’u.","I’m a student of Paa’ʉ, and my name is Mu’u.","我是Paa’ʉ的學生，我叫Mu’u。","https://web.klokah.tw/text/sound/27432/455341.mp3"
"ngahlaisa ngahla u?"," What’s your name?","你的名字是什麼?","https://web.klokah.tw/text/sound/27432/455342.mp3"
"ngahla ku ia Mu’u.","My name is Mu’u.","我的名字是Mu’u。","https://web.klokah.tw/text/sound/27432/455343.mp3"
"ngasa ngahlaisa ama u?"," What’s your father’s name?","你爸爸的名字是什麼?","https://web.klokah.tw/text/sound/27432/455344.mp3"
"ngahlaisa ama ku ia Paa’ʉ.","My dad’s name is Paa’ʉ.","我爸爸的名字是Paa’ʉ。","https://web.klokah.tw/text/sound/27432/455345.mp3"
"ngahlaisa kana’ana?"," Who is he?","他是誰?","https://web.klokah.tw/text/sound/27432/455346.mp3"
"kana’ana ia Muakai.","He’s Muakai.","他是Muakai。","https://web.klokah.tw/text/sound/27432/466977.mp3"
"kana’ana ia ahlalua ku hlahlusa, kana’ana ia pia Muakai."," He’s my brother, his name is Muakai.","他是我的哥哥，他叫Muakai。","https://web.klokah.tw/text/sound/27432/455347.mp3"
"ngasa ngahlaisa kana’ana?"," What’s his name?","他的名字是什麼?","https://web.klokah.tw/text/sound/27432/455348.mp3"
"ngahlaisa kana’ana ia Muakai."," His name is Muakai.","他的名字是Muakai。","https://web.klokah.tw/text/sound/27432/455349.mp3"
"ngahlaisa ia Paa’ʉ i?"," Is his name Paa’ʉ?","他的名字是Paa’ʉ嗎?","https://web.klokah.tw/text/sound/27432/455350.mp3"
"a’ʉ, ngahlaisa kana’ana ia Paa’ʉ.","Yes, his name is Paa’ʉ.","是，他的名字是Paa’ʉ。","https://web.klokah.tw/text/sound/27432/455351.mp3"
"ngahlaisa ia Paa’ʉ i?"," Is his name Paa’ʉ?","他的名字是Paa’ʉ嗎?","https://web.klokah.tw/text/sound/27432/455352.mp3"
"ku, ngahlaisa kana’ana ia Muakai.","No, his name is Muakai.","不是，他的名字是Muakai。","https://web.klokah.tw/text/sound/27432/466978.mp3"
"ngasa cucu’u a kana’ana?"," Who is that guy?","那個人是誰?","https://web.klokah.tw/text/sound/27432/455353.mp3"
"kana’ana ia Kuatʉ. kana’ana ia tam Kuati ku."," She’s Kuatʉ. she’s my aunt.","她是Kuatʉ。她是我的阿姨。","https://web.klokah.tw/text/sound/27432/455354.mp3"
"ngasa cucu’u a kana’ana?"," Who is that guy?","那個人是誰?","https://web.klokah.tw/text/sound/27432/455355.mp3"
"kana’ana ia tukucu ku, ngahlaisa kana’ana ia ’Avi.","She is a friend of mine, her name is Avari.","他是我的朋友，他的名字是’Avi.。","https://web.klokah.tw/text/sound/27432/455356.mp3"
"tainini a caihli u mamisa?"," How old are you?","你今年幾歲?","https://web.klokah.tw/text/sound/27432/455357.mp3"
"mahlʉ caihli ku mamisa."," I am 10 years old.","我今年10歲。","https://web.klokah.tw/text/sound/27432/455358.mp3"
"tainini a caihli isa kana’ana?"," How old is he?","他今年幾歲?","https://web.klokah.tw/text/sound/27432/455359.mp3"
"laihla usua caihli isa kana’ana mamisa."," He is 12 years old.","他今年12歲。","https://web.klokah.tw/text/sound/27432/455360.mp3"
"tainini a caihli isa amau mamisa?"," How old is your father?","你爸爸今年幾歲?","https://web.klokah.tw/text/sound/27432/455361.mp3"
"malimahlʉ caihli isa ama ku na mamisa."," My father is 50 years old.","我爸爸今年50歲。","https://web.klokah.tw/text/sound/27432/455362.mp3"
"papiaini a ahlahlalua hlimihlimilavai u?"," How many brothers and sisters do you have?","你有幾個兄弟姊妹?","https://web.klokah.tw/text/sound/27432/455363.mp3"
"maru sasua ahlahlalua ku, cacihli a hlimilavaʉ."," I have two brothers and sisters and one younger brother and sister.","我有兩個兄姐，一個弟妹。","https://web.klokah.tw/text/sound/27432/455364.mp3"
"maru i ahlaluauhlahlusa?"," Do you have a brother?","你有哥哥嗎?","https://web.klokah.tw/text/sound/27432/455365.mp3"
"uka’a ahlaluakuhlahlusa."," I don’t have a brother.","我沒有哥哥。","https://web.klokah.tw/text/sound/27432/455366.mp3"
"maru papiaini cucusalia mu?"," How many people are in your family?","你們家有幾個人?","https://web.klokah.tw/text/sound/27432/455367.mp3"
"maru aupatʉ cucusalia hlamu."," There are four of us in our family.","我們家有4個人。","https://web.klokah.tw/text/sound/27432/455368.mp3"
"ini u paninau umiiapʉ?"," Where did you study?","你在哪裡讀書?","https://web.klokah.tw/text/sound/27432/455369.mp3"
"ma ku Takau umiiapʉ."," I studied in Kaohsiung.","我在高雄讀書。","https://web.klokah.tw/text/sound/27432/455370.mp3"
"ngasa kana’ana?"," Who is he?","他是誰?","https://web.klokah.tw/text/sound/27433/455371.mp3"
"kana’ana ia tamalʉngali ku.","He is my uncle.","他是我的叔叔。","https://web.klokah.tw/text/sound/27433/455372.mp3"
"ngasa ta’i’iara isa tarʉtarʉvʉnga u?"," What does your uncle do for a living?","你的舅舅從事什麼工作?","https://web.klokah.tw/text/sound/27433/455373.mp3"
"kana’ana ia ’aumu."," He’s a cop.","他是警察。","https://web.klokah.tw/text/sound/27433/455374.mp3"
"ngasa kana’ana?"," Who is that guy?","那個人是誰?","https://web.klokah.tw/text/sound/27433/455375.mp3"
"kana’ana ia ahlaluakuahlaina."," She’s my sister.","她是我的姊姊。","https://web.klokah.tw/text/sound/27433/455376.mp3"
"maru i ta’iara ahlaluauahlaina?"," Does your sister have a job?","你的姊姊有工作嗎?","https://web.klokah.tw/text/sound/27433/455377.mp3"
"ma kana’ana parana maisavusavuanʉ taku’i’iarʉ."," She works in a hospital.","她在醫院上班。","https://web.klokah.tw/text/sound/27433/455378.mp3"
"murituturua i sasua hlakana’ana?"," Are they brothers and sisters?","他們兩個人是兄弟姐妹嗎?","https://web.klokah.tw/text/sound/27433/455379.mp3"
"ku, tukutukucu a hlakana’ana."," No, they are friends.","不是，他們是朋友。","https://web.klokah.tw/text/sound/27433/455380.mp3"
"cucumacu u i?"," Are you Aboriginal?","你是原住民嗎?","https://web.klokah.tw/text/sound/27433/455381.mp3"
"a’ʉ, ihlaku ia tahlana Hla’alua."," Yes, I am an Hla’alua.","是，我是拉阿魯哇族的。","https://web.klokah.tw/text/sound/27433/455382.mp3"
"cucumacu i usumani u?"," Is your spouse Aboriginal?","你的配偶是原住民嗎?","https://web.klokah.tw/text/sound/27433/455383.mp3"
"a’ʉ, ucaniika kana’ana ia tahlana Pinan."," Yes, but she is a Pinan.","是，但是她是卑南族的。","https://web.klokah.tw/text/sound/27433/455384.mp3"
"tam langica i ama u na?"," Is your father very tall?","你的爸爸很高嗎?","https://web.klokah.tw/text/sound/27433/455385.mp3"
"a’ʉ, tam langica cucusalia hlamu."," Yes, we are all very tall.","對，我們全家都很高。","https://web.klokah.tw/text/sound/27433/455386.mp3"
"umiiapi cu i hlimilavaiuahlaina?"," Does your sister go to school?","你的妹妹上學了嗎?","https://web.klokah.tw/text/sound/27433/455387.mp3"
"a’ʉ, umiiapi cu a kana’ana."," Yes, she went to school.","是，她上學了。","https://web.klokah.tw/text/sound/27433/455388.mp3"
"macahlia u i hlimihlimilavaʉ na masi kari cucumacu?"," Do your siblings speak the language?","你的弟妹會說族語嗎?","https://web.klokah.tw/text/sound/27433/455389.mp3"
"a’ʉ, macahlia hlakana’ana masi kari cucumacu."," Yes, they speak the ethnic language.","是，他們會說族語。","https://web.klokah.tw/text/sound/27433/455390.mp3"
"maru papiaini a ahlahlalua hlimihlimilavai u?"," How many brothers and sisters do you have?","你有幾個兄弟姐妹?","https://web.klokah.tw/text/sound/27433/455391.mp3"
"maru tatulu ahlahlalua ku."," I have three brothers and sisters.","我有三個兄弟姐妹。","https://web.klokah.tw/text/sound/27433/455392.mp3"
"miaʉlʉsi u i hlamama?"," Do you live with your parents?","你和爸爸媽媽一起住嗎?","https://web.klokah.tw/text/sound/27433/455393.mp3"
"a’ʉ, miaʉlʉsʉ aku hlamama."," Yes, I live with my mom and dad.","是，我和爸爸媽媽一起住。","https://web.klokah.tw/text/sound/27433/455394.mp3"
"miaʉlʉsi u i tamutamua?"," Do you live with your grandparents?","你和爺爺奶奶一起住嗎?","https://web.klokah.tw/text/sound/27433/455395.mp3"
"ku, ku aku miaʉlʉsʉ hlakana’ana."," No, I didn’t live with them.","不，我沒和跟他們一起住。","https://web.klokah.tw/text/sound/27433/455396.mp3"
"ngahlaisa hliaʉlʉsʉ a u?"," Who do you live with?","你和誰一起住?","https://web.klokah.tw/text/sound/27433/455397.mp3"
"miaʉlʉsʉ aku ama’a, ina’a, ahlaluahlahlusa."," I live with my father, mother and brother.","我跟爸爸、媽媽、哥哥住在一起。","https://web.klokah.tw/text/sound/27433/455398.mp3"
"ini u hliangahli mʉcʉkʉhlʉ?"," Where are you from?","你從哪裡來?","https://web.klokah.tw/text/sound/27433/455399.mp3"
"hliangahli aku takau mʉcʉkʉhlʉ."," I’m from Kaohsiung.","我從高雄來。","https://web.klokah.tw/text/sound/27433/455400.mp3"
"ini paninau a salia u?"," Where is your home?","你們的家在哪裡?","https://web.klokah.tw/text/sound/27433/455401.mp3"
"salia ku ia ma takau."," Our home is in Kaohsiung.","我們的家在高雄。","https://web.klokah.tw/text/sound/27433/455402.mp3"
"ini paninau a miararuma u?","Where is your hometown?","你的故鄉在哪裡?","https://web.klokah.tw/text/sound/27433/455403.mp3"
"miararuma ku ia ma takau."," My hometown is in Kaohsiung.","我的故鄉在高雄。","https://web.klokah.tw/text/sound/27433/455404.mp3"
"ini paninau a miararuma mu?"," Where is your tribe?","你們的部落在哪裡?","https://web.klokah.tw/text/sound/27433/455405.mp3"
"miararuma hlamu ia ma takau."," Our tribe is in Kaohsiung.","我們的部落在高雄。","https://web.klokah.tw/text/sound/27433/455406.mp3"
"cuhlaumangi u puaili miararuma?"," When are you going back to the tribe?","你什麼時候會回去部落?","https://web.klokah.tw/text/sound/27433/455407.mp3"
"taruamacici a puaili aku."," I will go back in the summer.","我暑假都會回去。","https://web.klokah.tw/text/sound/27433/455408.mp3"
"ihlaku ia mamaini hla’alua."," I’m a La Aluva child.","我是拉阿魯哇族小孩。","https://web.klokah.tw/text/sound/27433/471126.mp3"
"aunini a langica na arinani?"," How is the weather today?","今天天氣如何?","https://web.klokah.tw/text/sound/27434/455409.mp3"
"murumitacu a tahliaria, tam macici a langica.","The sun is coming out, it's very hot.","太陽出來了，天氣很熱。","https://web.klokah.tw/text/sound/27434/455410.mp3"
"tam masarʉmʉ i vahlita na?"," Is it going to be cold outside?","外面會很冷嗎?","https://web.klokah.tw/text/sound/27434/455411.mp3"
"tam masarʉmʉ, tumua kia maritatʉpʉhlʉ."," It's cold, so wear more clothes.","很冷，要多穿衣服。","https://web.klokah.tw/text/sound/27434/455412.mp3"
"tam macici a vahlita na?"," Will it be hot outside?","外面會很熱嗎?","https://web.klokah.tw/text/sound/27434/455413.mp3"
"ku, pariavarati cu, tam matahlʉkʉtʉkʉ."," No, it's windy and cool.","不會，起風了，很涼快。","https://web.klokah.tw/text/sound/27434/455414.mp3"
"aunini a langica na arinani?"," How is the weather today?","今天天氣怎麼樣?","https://web.klokah.tw/text/sound/27434/455415.mp3"
"arinani ku asarʉmʉ ku acici, tam mavacangʉ."," It's neither cold nor hot today, very comfortable.","今天不冷也不熱，很舒服。","https://web.klokah.tw/text/sound/27434/455416.mp3"
"aunini a langicana curuvana?"," How is the weather tonight?","今天晚上天氣如何?","https://web.klokah.tw/text/sound/27434/455417.mp3"
"uka’a lulunga langica na, kipuhlu cu a ’acangʉrahlʉ."," There were no clouds in the sky; the stars came out.","天空沒有雲，星星出來了。","https://web.klokah.tw/text/sound/27434/455418.mp3"
"aunini a langica vahlita na?"," How is the weather outside?","外面天氣如何?","https://web.klokah.tw/text/sound/27434/455419.mp3"
"hlamuna mikacʉ, murumita cu a tahliaria , murumita cu a valahlʉvahlʉ."," The rain has just stopped, the sun has come out, the rainbow is coming out.","雨剛剛停，出了太陽，彩虹出來了。","https://web.klokah.tw/text/sound/27434/455420.mp3"
"aunini a langica u naana?"," What's the weather like where you are?","你那裡的天氣如何?","https://web.klokah.tw/text/sound/27434/455421.mp3"
"ihlahlamu naani pariataisa varatʉ na."," We're going to have a big storm here.","我們這裡颳大風。","https://web.klokah.tw/text/sound/27434/455422.mp3"
"mavacangʉ i langica u naana?"," How's the weather there?","你那裡的天氣好嗎?","https://web.klokah.tw/text/sound/27434/455423.mp3"
"tam mavacangʉ, tam macici a langica."," Very well, out of the big sun.","很好，出大太陽。","https://web.klokah.tw/text/sound/27434/455424.mp3"
"muasa ku ariatʉkʉrana."," I have to go to school.","我要去上學了。","https://web.klokah.tw/text/sound/27434/455425.mp3"
"tam masarʉmʉ a langica na, tumua kia paritatʉpʉhlʉ."," The weather is very cold, so wear more clothes.","天氣很冷，要多穿衣服。","https://web.klokah.tw/text/sound/27434/455426.mp3"
"kipuhlu cu a ku vahlita."," I'm going out.","我要出門了。","https://web.klokah.tw/text/sound/27434/455427.mp3"
"miataisa usahlʉ cucuvanana, atʉhlʉngʉ kia ihlau mahlava saunga."," It's going to rain heavily, you have to remember to bring an umbrella.","等一下會下大雨，你要記得帶傘。","https://web.klokah.tw/text/sound/27434/455428.mp3"
"umausahlʉ i?"," Is it going to rain?","會下雨嗎?","https://web.klokah.tw/text/sound/27434/455429.mp3"
"hlitalasululunga kicuvanana, mairahlu umausahlʉ cucuvanana."," There was thunder just now, and it's supposed to rain later.","剛剛打雷了，等一下應該就會下雨。","https://web.klokah.tw/text/sound/27434/455430.mp3"
"umausahli cu i?"," Is it raining?","下雨了嗎?","https://web.klokah.tw/text/sound/27434/455431.mp3"
"hlamuna umusahlʉ kicuvanana, mikacicu kani’i."," It just rained, and now it's stopped.","剛剛有下雨，現在雨停了。","https://web.klokah.tw/text/sound/27434/455432.mp3"
"umausahli cu i?"," Is it raining?","下雨了嗎?","https://web.klokah.tw/text/sound/27434/455433.mp3"
"ausi cu hliumusahli, matarʉngʉ a sala’a na."," It seems to have rained and the road is wet.","好像下過雨了，馬路是濕的。","https://web.klokah.tw/text/sound/27434/455434.mp3"
"hliumusahlʉ i? tiarau matarʉngʉ a tihla’ahlʉ?"," Is it raining? Why are you all wet?","有下雨嗎?你怎麼全身都濕了?","https://web.klokah.tw/text/sound/27434/455435.mp3"
"umausausahlʉ vahlita na, ku aku ahlava saunga."," It's raining outside, so I didn't bring an umbrella.","外面在下雨，我沒有帶雨傘。","https://web.klokah.tw/text/sound/27434/455436.mp3"
"mavacangi u mana i?"," Are you all right?","你還好嗎?","https://web.klokah.tw/text/sound/27434/455437.mp3"
"tam taisa varatʉ na, paricarʉmʉ vunguku."," The wind is blowing so hard that my head hurts.","風好大，吹得我頭好痛。","https://web.klokah.tw/text/sound/27434/455438.mp3"
"mavacangi u mana i?"," Are you all right?","你還好嗎?","https://web.klokah.tw/text/sound/27434/455439.mp3"
"tam macici a tahliaria na, sumahlilingipasʉ vunguku."," The sun is so big, it makes me dizzy.","太陽好大，曬得我頭好暈。","https://web.klokah.tw/text/sound/27434/455440.mp3"
"asapu cu a ku mahlava siasuhlatʉ."," I forgot to bring my pen.","我忘了帶筆。","https://web.klokah.tw/text/sound/27435/455441.mp3"
"umauhli aku ihlau.","I can lend you.","我借你。","https://web.klokah.tw/text/sound/27435/455442.mp3"
"asapu cu a ku mahlava ’aratingi."," I forgot to bring my chopsticks.","我忘了帶筷子。","https://web.klokah.tw/text/sound/27435/455443.mp3"
"ku aku ahlava mʉmʉa, muasa ita pu’a."," I don’t have one either, let’s go buy one.","我也沒有帶，我們去買。","https://web.klokah.tw/text/sound/27435/455444.mp3"
"hlaa pu’a ita siasuhlatʉ a’ʉ i ia?"," Let’s go buy a pen, shall we?","我們去買筆好嗎?","https://web.klokah.tw/text/sound/27435/455445.mp3"
"a’ʉ, tumua ku mana pu’a siasamusu."," Well, I still have to buy erasers.","好，我還要買橡皮擦。","https://web.klokah.tw/text/sound/27435/455446.mp3"
"hlaa pu’a ita kuamaivʉvʉrʉnga a’ʉ i ia?"," Let’s go get breakfast, shall we?","我們去買早餐好嗎?","https://web.klokah.tw/text/sound/27435/455447.mp3"
"sianata, hliumucuaku salia."," No, I’ve already eaten at home.","不要，我在家吃過了。","https://web.klokah.tw/text/sound/27435/466979.mp3"
"asapucu cu a ku paracici cʉrʉ."," I forgot to steam my lunchbox.","我忘記蒸便當了。","https://web.klokah.tw/text/sound/27435/455448.mp3"
"alu pasakulai paracici."," Take it to the heat!","趕快拿去加熱吧!","https://web.klokah.tw/text/sound/27435/455449.mp3"
"asapu cu a ku mahlava cʉrʉ."," I forgot to bring my lunchbox.","我忘記帶便當了。","https://web.klokah.tw/text/sound/27435/455450.mp3"
"kʉlʉsa ita umuu ciri ku na!"," Then let’s eat my lunch box together!","那我們一起吃我的便當吧!","https://web.klokah.tw/text/sound/27435/455451.mp3"
"ngasa aani u mahlipapu?"," What are you having for lunch?","你中午要吃什麼?","https://web.klokah.tw/text/sound/27435/455452.mp3"
"tumua ku umau kuamamahlipapu a isa ariatʉkʉrana."," I want a nutritious school lunch.","我要吃學校的營養午餐。","https://web.klokah.tw/text/sound/27435/455453.mp3"
"ngasa aani u mahlipapu?"," What are you having for lunch?","你中午要吃什麼?","https://web.klokah.tw/text/sound/27435/455454.mp3"
"hlimahlava ku cʉrʉ arinani, kʉlʉsa ita mau umuu kumamahlipapu."," I’ve brought a lunchbox today, let’s eat together at noon!","我今天有帶便當，我們中午一起吃吧!","https://web.klokah.tw/text/sound/27435/455455.mp3"
"hlaa muasa ita pi taʉhlʉkai a’ʉ i ia?"," Let’s go play basketball, shall we?","我們去打籃球好嗎?","https://web.klokah.tw/text/sound/27435/455456.mp3"
"a’ʉ hlamau."," Okay! Let’s go.","好喔!我們走。","https://web.klokah.tw/text/sound/27435/455457.mp3"
"hlaa muasa ita maritʉkʉ taʉhlʉkai a’ʉ i ia?"," Shall we go play baseball?","我們去打棒球好嗎?","https://web.klokah.tw/text/sound/27435/455458.mp3"
"ku, tumua ku umiiapʉ."," No, I want to study.","不要，我要讀書。","https://web.klokah.tw/text/sound/27435/455459.mp3"
"tumalʉlʉvʉ kia ihlaku umala vʉtʉraʉ."," Please help me with the broom.","請幫我拿掃把。","https://web.klokah.tw/text/sound/27435/455460.mp3"
"a’ʉ, kani’i vʉtʉraʉ na avuri ku ihlau."," Okay, here’s a broomstick for you.","好，這支掃把給你。","https://web.klokah.tw/text/sound/27435/455461.mp3"
"talʉlʉvani aku umala sipasasahli a’ʉ i ia?"," Can you help me with the cloth?","幫我拿布好嗎?","https://web.klokah.tw/text/sound/27435/455462.mp3"
"maivavʉvʉtʉraʉ aku, auhlunu a Amahlʉ na tumalʉlʉvʉ ihlau umala."," I’m sweeping the floor and you asked Amahlʉ to carry it for you.","我在掃地，你叫Amahlʉ幫你拿。","https://web.klokah.tw/text/sound/27435/455463.mp3"
"makilipingi cu i?"," Are you done sweeping?","你掃好了嗎?","https://web.klokah.tw/text/sound/27435/455464.mp3"
"makilipingi cu aku."," I swept it.","我掃好了。","https://web.klokah.tw/text/sound/27435/455465.mp3"
"tairau ku paivavʉtʉraʉ?"," Why don’t you clean up?","你怎麼不打掃?","https://web.klokah.tw/text/sound/27435/455466.mp3"
"makilipingi cu aku."," I’ve finished cleaning up.","我打掃完了。","https://web.klokah.tw/text/sound/27435/455467.mp3"
"tam ’aʉrʉ a sasaruana na, cu samusu."," The floor is dirty, go clean it.","地板很髒，去擦一下。","https://web.klokah.tw/text/sound/27435/455468.mp3"
"a’ʉ, muasa ku umala sipasasahli."," Okay, I’ll go get the cloth.","好，我去拿布。","https://web.klokah.tw/text/sound/27435/455469.mp3"
"tam ’aʉrʉ a kana’a cingarʉ na."," That window is very dirty, go clean it.","那個窗戶很髒，去擦一下。","https://web.klokah.tw/text/sound/27435/455470.mp3"
"cucuvanana, kuna ku pailalʉpʉngʉ naani na."," Wait a minute, I’m not done sweeping here yet.","等一下，我還沒掃完這裡。","https://web.klokah.tw/text/sound/27435/455471.mp3"
"ngasa ta’iara u cucuvanana?"," What are you doing later?","你等一下要做什麼?","https://web.klokah.tw/text/sound/27435/455472.mp3"
"muasa ku ukikirimi pakiaturua?"," I’m going to see my teacher.","我要去找老師。","https://web.klokah.tw/text/sound/27435/455473.mp3"
"ngasa ta’iara macu u taluvaʉlʉ umiiapʉ?"," What do you do after school?","你放學要做什麼?","https://web.klokah.tw/text/sound/27435/455474.mp3"
"muasa ku kiʉlʉsʉ tukucu pahlusahli."," I’m going to sing with my friends.","我要跟朋友去唱歌。","https://web.klokah.tw/text/sound/27435/455475.mp3"
"ngasa ta’iara isa kana’ana maci taluvaʉlʉ umiiapʉ?"," What’s he doing after school?","他放學要做什麼?","https://web.klokah.tw/text/sound/27435/455476.mp3"
"muasa kana’ana makahlangulu."," He’s going swimming.","他要去游泳。","https://web.klokah.tw/text/sound/27435/455477.mp3"
"pakisuahlai ma i salia Vanau na?"," Is Vanau at home, please?","請問Vanau在家嗎?","https://web.klokah.tw/text/sound/27436/455478.mp3"
"ma salia kana’ana, puaruma kia.","She’s at home, please come in.","她在家，請進來。","https://web.klokah.tw/text/sound/27436/455479.mp3"
"pakisuahlai ma i salia Vanau na?"," Is Vanau at home, please?","請問Vanau在家嗎?","https://web.klokah.tw/text/sound/27436/455480.mp3"
"uka’a salia kana’ana, pakisuahlai ngasa ta’iara u?"," She’s not here, what can I do for you?","她不在，請問你有什麼事?","https://web.klokah.tw/text/sound/27436/455481.mp3"
