"masahli i i’a’ana tarʉtatʉkʉhlʉ pahlivinga aatʉ salia mu?","Is the market close to your house?","超市離你們家近嗎?","https://web.klokah.tw/text/sound/36995/585290.mp3"
"kuasahli, riani ku mulikihli umaru ’urai musa i’a’ana tarʉtatʉkʉhlʉ pahlivinga.","No, it is not, so I always ride the motorcycle to the market.","不近，我都騎摩托車去超市。","https://web.klokah.tw/text/sound/36995/585291.mp3"
"masahli i aihlana aatʉ ariatʉkʉranana?","Is the post office close to the school?","郵局離學校近嗎?","https://web.klokah.tw/text/sound/36995/585292.mp3"
"tam masahli, miungu maci musasala.","Yes, it is within walking distance.","很近，走路就會到。","https://web.klokah.tw/text/sound/36995/585293.mp3"
"masahli i tai’a’ana aatʉ parana utatungusa likihli?","Is the restaurant close to the station?","餐廳離車站近嗎?","https://web.klokah.tw/text/sound/36995/585294.mp3"
"kipuhlu utatungusa likihli, musasala mʉlʉngʉsʉ takʉmʉnʉ ulima utuatapusana miungu cu.","It only takes five minutes after you walk out of the station.","出車站再走五分鐘就到了。","https://web.klokah.tw/text/sound/36995/585295.mp3"
"maru i pasamia u arinani?","Are you available today?","你今天有空嘛?","https://web.klokah.tw/text/sound/36998/585335.mp3"
"aunini cu?","What is the matter?","怎麼了?","https://web.klokah.tw/text/sound/36998/585336.mp3"
"hlatumua ku takuliliungu ihlau.","I would like to visit you.","我想去拜訪你。","https://web.klokah.tw/text/sound/36998/585337.mp3"
"maru ku ta’iara arinani kuaku ma salia. mungahlʉ mau ari .","I am out today. How about another day?","我今天有事不在家。改天吧。","https://web.klokah.tw/text/sound/36998/585338.mp3"
"hla maru i pasamia u matata? musa ku ukikirimi ihlau kʉlʉpʉngʉ mahlipapu.","Then, are you available tomorrow? I’ll visit you tomorrow afternoon.","那你明天有空嗎?我下午去找你。","https://web.klokah.tw/text/sound/36998/585339.mp3"
"acahli, ma ku salia pupapalu ihlau.","Sure, I will wait for you at home.","可以，我在家等你。","https://web.klokah.tw/text/sound/36998/585340.mp3"
"pakisuahlai tuahlʉ ku i sumasuhlatʉ? hlatumua ku sumasuhlatʉ.","Would you mind if  I do the voice recording? I would like to keep a record.","請問我可以錄音嗎?我想做紀錄。","https://web.klokah.tw/text/sound/36998/585341.mp3"
"a’ʉ! kupipahlumiamia.","Sure! No problem.","好啊!沒有問題。","https://web.klokah.tw/text/sound/36998/585342.mp3"
"acahli i pia’ahlingu?","Would you mind if I do the video recording?","可以錄影嗎?","https://web.klokah.tw/text/sound/36998/585343.mp3"
"takuliacʉ aku kumita uka’a hlimaihlʉmʉhlʉmʉ risakʉ mʉmʉa, sianata.","No, I am plain and the warehouse hasn’t been tidied up yet.","我不好看，倉庫也沒整理，不要啦。","https://web.klokah.tw/text/sound/36998/585344.mp3"
"hla iatʉhlʉngʉ a ku pia’ahlingu","Then I will just take photos.","那我拍照就好。","https://web.klokah.tw/text/sound/36998/585345.mp3"
"sianata pia’ahlingu mʉmʉa.","No photographing either.","拍照也不要。","https://web.klokah.tw/text/sound/36998/585346.mp3"
"’ʉ’ʉraisamana ihlau sikisuahlaiaku.","","謝謝你讓我訪問。","https://web.klokah.tw/text/sound/36998/738299.mp3"
"kupipahlumiamia, ngasa hlatumua kiahlahlamu a u?","You are welcome. What would you like to know?","沒問題，你想問什麼?","https://web.klokah.tw/text/sound/36998/585348.mp3"
"pakisuahlai akuisa alamuru ngasa ta’iarau?","What do you do when you are young?","請問您年輕時是做什麼的?","https://web.klokah.tw/text/sound/36998/585349.mp3"
"hlipi’aumu aku kiariari, hla malilʉpʉngʉ cu aku ta’iara kani’i.","I was a police officer but I am retired now.","我以前是警察，但我現在退休了。","https://web.klokah.tw/text/sound/36998/585350.mp3"
"hla maru i ta’iarau kani’i?","Then, are you working at the moment?","那你現在有工作嗎?","https://web.klokah.tw/text/sound/36998/585351.mp3"
"maku ariatʉkʉrana taku’i’iarʉ.","I am working at school.","我在學校上班。","https://web.klokah.tw/text/sound/36998/585352.mp3"
"pakisuahlai maruaru i mamaini u miararuma mʉmʉa?","Do your kids live in the tribe too?","請問您的孩子也住在部落嗎?","https://web.klokah.tw/text/sound/36998/585353.mp3"
"ku, maruaru mamaini ku ikatumahlana.","No, my kids are all living in the city.","不，我的孩子在都市居住。","https://web.klokah.tw/text/sound/36998/585354.mp3"
"hla maruaru u i takacicihli?","Then, do you live by yourself?","那你自己一個人住嗎?","https://web.klokah.tw/text/sound/36998/585355.mp3"
"umupangʉ ku mana cacihli tasau hla ucani ahlamʉ, ihlaisa ia ucani pihlingi ku mʉmʉa.","I also keep a dog and a bird. They are my family.","我還有養一隻狗和一隻鳥，他們也是我的家人。","https://web.klokah.tw/text/sound/36998/585356.mp3"
"umupangʉ ku cacihli ngiau mʉmʉa, maru kuli’i pualaʉvʉ kucu mialala.","I have a cat too. I won’t get bored with the company of my pet.","我也有養一隻貓，有動物陪伴不會無聊。","https://web.klokah.tw/text/sound/36998/585357.mp3"
"pakisuahlai aku ihlau ausikan palisiaisa mʉrʉcʉkana.","I would like to ask you about the taboos of hunting.","我想請問你關於打獵的禁忌。","https://web.klokah.tw/text/sound/36998/585358.mp3"
"kuatumuhlua acahliaku, hla ucanika tuahlʉ umalivalʉ rianʉ aliavali aku ihlau.","I don’t know much about that, but I will tell you everything I know.","我知道的不多，但我能回答的都會回答你。","https://web.klokah.tw/text/sound/36998/585359.mp3"
"maru i ngasa palisia amu vuuru mʉrʉcʉka?","Do you have any taboos about hunting weapons?","你們打獵的武器有什麼禁忌嗎?","https://web.klokah.tw/text/sound/36998/585360.mp3"
"kuacahli a pititupu ahlaina vuuru mu mʉrʉcʉka.","Our hunting weapons are untouchable to women.","我們打獵的武器不可以讓女生碰到。","https://web.klokah.tw/text/sound/36998/585361.mp3"
"hla acahli i ahlaina musa mʉrʉcʉka mʉmʉa?","Then, can women go hunting together?","那女人可以一起去打獵嗎?","https://web.klokah.tw/text/sound/36998/585362.mp3"
"kuacahli, kuacahli ahlaina mʉrʉcʉka mʉmʉa.","No, women cannot go hunting either.","不行，女人也不可以打獵。","https://web.klokah.tw/text/sound/36998/585363.mp3"
"Hlakuta’i, uka’a cu a mapaci salia, cu pu’a.","Hlakuta’i, our home is out of rice wine, please go and buy some.","Hlakuta’i，家裡沒有米酒了，去買。","https://web.klokah.tw/text/sound/37000/585394.mp3"
"marumana ucani talangahlʉ tavava, sianata’ai pu’a!","","廚房還有一瓶，不用買吧!","https://web.klokah.tw/text/sound/37000/738300.mp3"
"kuiatʉhlʉngʉ ucani talangahlʉ, mungahlʉ musa pu’a usua talangahlʉ puaili.","One bottle is not enough for me, go and buy two more back.","一瓶不夠，再去買兩瓶回來。","https://web.klokah.tw/text/sound/37000/585396.mp3"
"pu’a ku mapaci, maru amu i i’a’a?","I am looking for rice wine. Do you have any rice wine?","我要買米酒，你們有賣嗎?","https://web.klokah.tw/text/sound/37000/585397.mp3"
"maru, tainini tumua pu’a u?","Yes! How many bottles do you need?","有啊!你要買多少?","https://web.klokah.tw/text/sound/37000/585398.mp3"
"pu’a ku usua talangahlʉ, tumuamana pu’a ucani cavu ʉvʉraʉ.","I want two bottles and a pack of rice.","我要買兩瓶，還要買一包米。","https://web.klokah.tw/text/sound/37000/585399.mp3"
"ma naani a ʉvʉraʉ, marumana i misaini?","Here is the rice, what else do you need?","米在這裡，你還需要什麼嗎?","https://web.klokah.tw/text/sound/37000/585400.mp3"
"pu’a ku mana ’asarʉ, maru amu i?","I want some eggs too, do you have some?","我還要買蛋，你們有嗎?","https://web.klokah.tw/text/sound/37000/585401.mp3"
"mikucu cu a mu ’asarʉ.","We are out of eggs.","我們的蛋賣完了。","https://web.klokah.tw/text/sound/37000/585402.mp3"
"tumua ku pu’a tikuru.","I want to buy some clothes.","我要買衣服。","https://web.klokah.tw/text/sound/37000/585403.mp3"
"misaini sapi hlatumu u pu’a?","What kind of clothes do you like?","你想要什麼樣子的呢?","https://web.klokah.tw/text/sound/37000/585404.mp3"
"tumua ku pu’a tapungu manitʉkʉ tikuru.","I want to buy the clothes with short sleeves.","我要買短袖的衣服。","https://web.klokah.tw/text/sound/37000/585405.mp3"
"aunini a matavuhliu kani’ina?","How about this red one?","這件紅色的如何?","https://web.klokah.tw/text/sound/37000/585406.mp3"
"maru i tapaʉ usumanʉ?","Do you have another color?","有別的顏色嗎?","https://web.klokah.tw/text/sound/37000/585407.mp3"
"marumana mu mapuhli hla valacuku.","We have white and blue ones too.","我們還有白色和藍色。","https://web.klokah.tw/text/sound/37000/585408.mp3"
"uvura ihlaku ucani tikuru valacuku.","Please give me the clothes in blue.","請給我一件藍色的衣服。","https://web.klokah.tw/text/sound/37000/585409.mp3"
"Hlakuta’i inihliangahli cu a kicuvanana? sikuatitipa u i?","Hlakuta’i, where have you been just now? Did you go exercising?","Hlakuta’i你剛剛去哪裡了?你去運動嗎?","https://web.klokah.tw/text/sound/37000/585410.mp3"
"ku, tumalʉlʉvʉ tamuku i’a’a hlatʉngʉ.","No, I went grocery shopping for my grandma.","不是，我去幫奶奶賣菜。","https://web.klokah.tw/text/sound/37000/585411.mp3"
"aunaniiau, maru i pasamia u ruvana, tumua i kualʉsʉ ku uumu uuru.","No wonder! Are you available at night? Would you like to have a meal with me?","這樣啊，你晚上有沒有空?要不要和我一起吃飯。","https://web.klokah.tw/text/sound/37000/585412.mp3"
"kuacahli, tumua ku musa pu’a tikuru.","No, I want to buy some clothes.","不行，我要去買衣服。","https://web.klokah.tw/text/sound/37000/585413.mp3"
"hla mulʉvʉ ku ihlau musa.","Then, I will go with you.","那我跟你一起去。","https://web.klokah.tw/text/sound/37000/585414.mp3"
"mavacangi u, pakisuahlai tainini a vahlituku hlatʉngʉ kani’ina?","Hello, how much is this bunch of vegetables?","你好，請問這把菜多少錢?","https://web.klokah.tw/text/sound/37000/585415.mp3"
"ucani lʉmʉhlana hlatʉngʉna ia mapuahlʉ vahlituku ahlamʉ.","The vegetables are $20 for a bunch.","菜一把20元。","https://web.klokah.tw/text/sound/37000/585416.mp3"
"tainini a vahlituku mairangʉ kani’ina?","How much are these sweet potatoes?","這個地瓜多少錢?","https://web.klokah.tw/text/sound/37000/585417.mp3"
"ucani tingatinga mairangʉ ia matuluhlu vahlituku ahlamʉ.","Thirty dollars for a pound.","地瓜一斤30元","https://web.klokah.tw/text/sound/37000/585418.mp3"
"uvura ihlaku usua lʉmʉhlana hlatʉngʉ hla ucani tingatinga mairangʉ.","Please give me two bunches of vegetables and a pound of sweet potatoes.","請給我兩把菜和一斤地瓜。","https://web.klokah.tw/text/sound/37000/585419.mp3"
"Vintia asapu cu aku mahlava siasuhlatʉ, acahli u i pauhli ihlaku?","Vintia, I forgot to bring my pen. Can you lend me one?","Vintia，我忘了帶筆，你可以借我嗎?","https://web.klokah.tw/text/sound/37002/585450.mp3"
"uka’a ku mʉmʉa, Apʉisa kani’ina.","I don’t have one either. This is Apʉ’s.","我也沒有，這支是Apʉ的。","https://web.klokah.tw/text/sound/37002/585451.mp3"
"hla acahli i pauhli aku mu’alivatʉ, makacani aku apuaili ihlau.","Can you lend me the pen for a second? I will return to you immediately.","那可以借我一下子嗎?我很快就還你。","https://web.klokah.tw/text/sound/37002/585452.mp3"
"a’ʉ, alʉmau.","Sure, take it.","好，拿去。","https://web.klokah.tw/text/sound/37002/585453.mp3"
"’ʉ’ʉraisa, tumalʉlʉvʉaku sia’ʉ’ʉraisa mʉmʉa Apʉna.","Thank you and thank Apʉ for me.","謝謝，也幫我謝謝Apʉ。","https://web.klokah.tw/text/sound/37002/585454.mp3"
"tumua i misaini?","May I help you?","需要什麼嗎?","https://web.klokah.tw/text/sound/37002/585455.mp3"
"tumua ku apuaili usua tʉpʉhlana suhlatʉ kani’ina.","I want to return these two books.","我要還這兩本書。","https://web.klokah.tw/text/sound/37002/585456.mp3"
"a’ʉ, marumana i misaini?","No problem and what else do you need?","好的，還需要什麼嗎?","https://web.klokah.tw/text/sound/37002/585457.mp3"
"tumua ku mana umuhli utulu tʉpʉhlana suhlatʉ kani’ina.","I would like to borrow these three books.","我還要借這三本書。","https://web.klokah.tw/text/sound/37002/585458.mp3"
"tuahlisa cu, atʉhlʉngʉ alʉ apuaili utulu ari mulavaʉ.","Sure and remember to return them after three days.","好了。記得三天後要拿來還。","https://web.klokah.tw/text/sound/37002/585459.mp3"
"kunau apuaili siasamusu ku.","You haven’t returned me the eraser.","你還沒還我橡皮擦。","https://web.klokah.tw/text/sound/37002/585460.mp3"
"apuaili cu aku kiira.","I returned it yesterday.","我昨天就還了。","https://web.klokah.tw/text/sound/37002/585461.mp3"
"tiaraisa maruka cu siasamusu ku.","Then, why is my eraser missing?","那我的橡皮擦怎麼不見了。","https://web.klokah.tw/text/sound/37002/585462.mp3"
"ku u i umuhli cu a Vintia.","Did you lend it to Vintia?","你是不是借給Vintia了。","https://web.klokah.tw/text/sound/37002/585463.mp3"
"kuaku acahlia. musa ku pakisuahlai kana’ana.","I don’t know. I will go and ask her.","我不知道。我去問問他。","https://web.klokah.tw/text/sound/37002/585464.mp3"
"mualualu umuhli ihlau siasamusu ku.","I will lend you my eraser first.","我的橡皮擦先借你。","https://web.klokah.tw/text/sound/37002/585465.mp3"
"Apʉ paritatʉpʉhla kani’i hliumuhli i Vintia ihlau?","Apʉ, did Vintia lend you this coat?","Apʉ，這個外套是Vintia借你的嗎?","https://web.klokah.tw/text/sound/37002/585466.mp3"
"ku hlipu’a inaku uvura ihlaku kani’i.","No, my mom bought it for me.","不是，這是我媽媽買給我的。","https://web.klokah.tw/text/sound/37002/585467.mp3"
"maraiahlʉ paritatʉpʉhlaisa Vintiana ihlau.","Vintia’s coat is the same as yours.","Vintia的外套跟你的一樣。","https://web.klokah.tw/text/sound/37002/585468.mp3"
"malicʉcʉ a paritatʉpʉhla isa, kuparaiahlʉ tapaʉ a mu.","His coat is black, so our colors are different.","他的外套是黑色的，我們的顏色不一樣。","https://web.klokah.tw/text/sound/37002/585469.mp3"
"Apʉ, hliumuhli i vahlituku Vintiana ihlau?","Apʉ, did you borrow money from Vintia?","Apʉ，你有跟Vintia借錢嗎?","https://web.klokah.tw/text/sound/37002/585470.mp3"
"maru, mairahlu ku apuaili isana arinani, asapu cu ku mahlava vahlituku.","Yes, I was supposed to return to him today, but I forgot to bring the money.","有，我本來今天要還他，我忘記帶錢了。","https://web.klokah.tw/text/sound/37002/585471.mp3"
"hla cuhlaumangi u apuaili?","Then, when will you return the money?","那你什麼時候要還?","https://web.klokah.tw/text/sound/37002/585472.mp3"
"apuaili isana ku matata","I will return to him tomorrow.","我明天就還給他。","https://web.klokah.tw/text/sound/37002/585473.mp3"
"a’ʉ, tumalʉlʉvi aku ihlau kihlamuhlamu Vintiana.","Okay, I will tell Vintia for you.","好，我幫你跟Vintia說。","https://web.klokah.tw/text/sound/37002/585474.mp3"
"tumua matisangalʉ taluvucu mairahlu umarumia takingi, ’ikarʉna ia mairahlu aruamia tiluu matiasangalʉ, takumacu aunani.","It is correct to catch mice through rangay and catch bamboo partridges through qjiulang.","老鼠應該要⽤⽯壓式陷阱抓，⽵雞應該要⽤套頸式陷阱抓，這樣才對。","https://web.klokah.tw/text/sound/37004/585505.mp3"
"usuanganai aunani, takʉsapu cu a ku! usuangana ku kupatiakʉhla.","No wonder! I am mistaken and that’s why I cannot catch any of them.","原來是這樣，我都搞錯了！難怪我都抓不到。","https://web.klokah.tw/text/sound/37004/585506.mp3"
"mungahlʉ aku tumututuru ihlau tumamahlʉngʉ usua ngahlana ringai.","Then I will teach you how to set up these two traps.","那我再教你怎麼製作這兩種陷阱。","https://web.klokah.tw/text/sound/37004/585507.mp3"
"a’ʉ! tam mavacangʉ! aunani ia macahlia aku matiasangalʉ cu a kuli’i cucuari.","Great! I will be able to catch the prey in the future.","好啊！太棒了！這樣我以後就會抓到獵物了。","https://web.klokah.tw/text/sound/37004/585508.mp3"
"mʉlʉngʉsʉ angatʉ cu a sʉsʉngʉ hlipatuaiiailia, musa u risakʉ umala kakamalʉ, musa mu hlipatuaiiailia.","The grass in the fields is too tall. Go to the warehouse to take the sickle and let’s go to the fields.","田裡的草太長了，你去倉庫拿鐮刀，我們去田裡。","https://web.klokah.tw/text/sound/37004/585509.mp3"
"iku ninau a kakamalʉ?","Where are the sickles?","鐮刀放在哪裡?","https://web.klokah.tw/text/sound/37004/594063.mp3"
"ma patʉkʉ parangahlʉ, puaruma u risakʉna ia taratʉahlʉ cu.","It is next to the round basket. You will see it when you enter the warehouse.","在大圓簍的旁邊，你進去倉庫就會看到了。","https://web.klokah.tw/text/sound/37004/585510.mp3"
"maiatuhluhlu umala, kukia patahlivu. tam mavarʉvarʉ a kakamalʉna.","Be careful and don’t get hurt. The sickle is very sharp.","小心拿，不要受傷。鐮刀很利。","https://web.klokah.tw/text/sound/37004/585511.mp3"
"kukia rumakua ringai ku!","Don’t step on my trap!","不要踩到我的陷阱!","https://web.klokah.tw/text/sound/37004/585512.mp3"
"maninau ringai u?","Where is your trap?","你的陷阱在哪裡?","https://web.klokah.tw/text/sound/37004/594064.mp3"
"ma kalahlapa palungu kiu’u ringai ku.","My trap is under that tree.","我的陷阱在那棵樹的下面。","https://web.klokah.tw/text/sound/37004/585513.mp3"
"tiarau atʉhlʉngʉ?","How do you remember?","你怎麼會記得?","https://web.klokah.tw/text/sound/37004/594065.mp3"
"ma ku nani patacukahlangʉ, macahlia ku maninau ringai ku.","I make a mark here, so I know where my trap is.","我在這邊有做記號，我知道我的陷阱在哪裡。","https://web.klokah.tw/text/sound/37004/585514.mp3"
"talahlʉ kani’ina, iku aku patʉkʉ hluhlungu pariavuvutukuhlu.","This is a fish trap which we put beside the river for fishing.","這是魚筌，我們放在溪邊捕魚。","https://web.klokah.tw/text/sound/37004/585515.mp3"
"uka’a mu talahlʉ kaiu, rianʉ uruamia iacapa mu matisangalʉ vutukuhlu.","We don’t have any fish traps there, so we catch fish with a fishing rod.","我們那邊沒有魚筌，我們都用釣竿抓魚。","https://web.klokah.tw/text/sound/37004/585516.mp3"
"uka’a ku hliuruamia iacapa, tuahlʉ u i tumututuru ihlaku mungahlʉ ari?","I have never used a fishing rod before, would you mind teaching me next time?","我沒有用過釣竿，你下次教我好嗎?","https://web.klokah.tw/text/sound/37004/585517.mp3"
"a’ʉ!","Sure!","好啊!","https://web.klokah.tw/text/sound/37004/585518.mp3"
"hla tumututuru aku ihlau tumamahlʉngʉ talahlʉ mungahlʉ ari.","I will teach you how to make a fish trap next time.","那我下次教你做魚筌。","https://web.klokah.tw/text/sound/37004/585519.mp3"
"titipa cu u iacapa, kui maru vutukuhlu pakakaihli cu, pasakulai u rʉkʉcʉ.","Your fishing rod is moving. Isn’t the fish on the hook? Pull it up!","你的釣竿動了，是不是有魚上鉤了!你快拉起來。","https://web.klokah.tw/text/sound/37004/585520.mp3"
"cucuvana, kuatitipa cu a ’avangʉna, ma ku naani rʉkʉcʉ iacapa, musa u kaiu tumalʉlʉviaku alʉ sapuarʉ.","Wait, the ship is rolling heavily. I am here to pull the fishing rod and you should go there to grab me the net.","等等，船太晃了。我在這邊拉釣竿，你去那邊幫我拿網子來。","https://web.klokah.tw/text/sound/37004/585521.mp3"
"rʉkʉci u vutukuhlu uamia ku naani, tumalʉlʉvʉ aku ihlau rʉkʉcʉ.","Pull the fish to my side and I will help you pull it up.","你把魚拉到我這邊。我幫妳拉起來。","https://web.klokah.tw/text/sound/37004/585522.mp3"
"tam mavacangʉ! parivacangʉ arinani.","Great! It is a bumper crop today with full fish baskets.","太好了!今天大豐收，魚簍都裝滿了。","https://web.klokah.tw/text/sound/37004/585523.mp3"
"pasakulai mu puaili pupusua pahlumiamia cucu mʉmʉa.","Let’s go back immediately and share it with everyone.","我們快回去和大家分享。","https://web.klokah.tw/text/sound/37004/585524.mp3"
"mʉcʉkʉhlicu a pakiaturua.","The teacher is here.","老師來了。","https://web.klokah.tw/text/sound/63670/894048.mp3"
"kucikia pasaulaula’ʉ, pasakulai tupuru.","Stop playing and quickly sit in your seat.","不要再玩了，快坐在座位上。","https://web.klokah.tw/text/sound/63670/894049.mp3"
"akuainita’ai, pasaʉrʉkʉcicuaku!","Sorry, I’m late!","抱歉，我遲到了!","https://web.klokah.tw/text/sound/63670/894050.mp3"
"pasakulai puaruma.","Come in quickly.","快進來。","https://web.klokah.tw/text/sound/63670/894051.mp3"
"takuapiaʉ arinani?","What day is it today?","今天星期幾?","https://web.klokah.tw/text/sound/63670/894052.mp3"
"takualimaʉ a arinani, taluavaʉlʉ a matata, kiʉlʉsʉaita murumita vahlita pasaulaula’ʉ!","It’s Friday today, we have a day off tomorrow. Let’s go out and play together!","今天星期五，明天放假，一起出去玩吧!","https://web.klokah.tw/text/sound/63670/894053.mp3"
"aa’ʉ! muasaita patʉkʉ sakʉrahlʉ.","Great! Let’s go to the riverside.","好啊!我們去河邊。","https://web.klokah.tw/text/sound/63670/894054.mp3"
"takuapiaʉ matata?","What day will it be tomorrow?","明天星期幾?","https://web.klokah.tw/text/sound/63670/894055.mp3"
"takuatuluaʉ matata, musalaitamau kʉlʉpʉngʉ kumamahlipapu matata pasaulaula’ʉ taʉhlʉkai!","Tomorrow will be Wednesday. Let’s go play ball tomorrow afternoon!","明天星期三，我們明天下午去玩球吧!","https://web.klokah.tw/text/sound/63670/894056.mp3"
"ngasa ta’iarau maivʉvʉrʉnga matata?","What will you be doing tomorrow morning?","你明天早上要做什麼?","https://web.klokah.tw/text/sound/63670/894057.mp3"
"taluavaʉlana ari matata, muasalaku mʉlʉvʉ ina’a mahlukua parana tapakiana.","Tomorrow will be Sunday, I will be going to church with my mom.","明天是星期日，我要和媽媽去教會。","https://web.klokah.tw/text/sound/63670/894058.mp3"
"hlita’iaracuu?","What’s wrong?","你怎麼了?","https://web.klokah.tw/text/sound/63670/894059.mp3"
"tumuaku tarʉta, muasaku tatiahla.","I feel like vomiting. I need to go to the restroom.","我想吐，我要去廁所。","https://web.klokah.tw/text/sound/63670/894060.mp3"
"kualingipasʉ a vunguku.","I feel dizzy.","我頭好暈。","https://web.klokah.tw/text/sound/63670/894061.mp3"
"mangucuhlamau ihlau taluvaʉlʉ.","Lie down and rest.","你趴著休息。","https://web.klokah.tw/text/sound/63670/894062.mp3"
"pakiaturua, macarʉmʉ a civukaku, muasaku tatiahla.","Teacher, I have a stomachache. I need to go to the restroom.","老師，我肚子痛，要去廁所。","https://web.klokah.tw/text/sound/63670/894063.mp3"
"aa’ʉ, pasakulai a musa.","Okay, go quickly.","好，快一點去。","https://web.klokah.tw/text/sound/63670/894064.mp3"
"tuahliku i musa mararamucu?","May I go wash my hands?","我可以去洗手嗎?","https://web.klokah.tw/text/sound/63670/894065.mp3"
"taiacu taluavaʉlʉ, muasakia cucuvanana.","It’s almost time for class to end. Wait a little longer.","快下課了，等一下再去。","https://web.klokah.tw/text/sound/63670/894066.mp3"
"pakiaturua, tam macarʉmʉ a vunguku, taluavaʉlʉaku kʉlʉpʉngʉ kumamahlipapu.","It’s almost time for class to end. Wait a little longer.","老師，我頭好痛，下午要請假。","https://web.klokah.tw/text/sound/63670/894067.mp3"
"aa’ʉ, maiiatuhluhlukia puaili salia.","Okay, take care and go home.","好，回家小心。","https://web.klokah.tw/text/sound/63670/894068.mp3"
"pakiaturua, taluavaʉlʉaku muangahlangahla takuacaniaʉ aari, muasaaku pakita maisasavusavuanʉ.","Teacher, I need to take a sick leave next Monday. I have to see a doctor.","老師，我下禮拜一要請假，我要去看醫生。","https://web.klokah.tw/text/sound/63670/894069.mp3"
"aa’ʉ, mavahlaʉvaʉkia.","Alright, take care of yourself.","好，保重身體。","https://web.klokah.tw/text/sound/63670/894070.mp3"
"paninau a Hla’u?","Where is Hla’u?","Hla’u在哪裡?","https://web.klokah.tw/text/sound/63670/894071.mp3"
"macarʉmʉ a civukaisa kana’ana, ma tatiahla kana’ana.","She has a stomachache. She’s in the restroom.","她肚子痛，她在廁所。","https://web.klokah.tw/text/sound/63670/894072.mp3"
"paninau a Taahlʉ?","Where is Taahlʉna?","Taahlʉ在哪裡?","https://web.klokah.tw/text/sound/63670/894073.mp3"
"pakiaturua, macarʉmʉ a alʉmʉsaisa Taahlʉna, taluvaʉlʉ arinani.","Teacher, Taahlʉna has a sore throat. She took a sick leave today.","老師，Taahlʉna喉嚨痛，今天請假。","https://web.klokah.tw/text/sound/63670/894074.mp3"
"tiaraisa ʉlʉkʉ kuacʉkʉhlʉ?","Why didn’t ʉlʉkʉ come?","ʉlʉkʉ為甚麼沒來?","https://web.klokah.tw/text/sound/63670/894075.mp3"
"aracicicu a kana’ana.","She has a fever.","她發燒了。","https://web.klokah.tw/text/sound/63670/894076.mp3"
"kiahlahlamukia ihlakia takacicihli.","Please introduce yourself.","請自我介紹。","https://web.klokah.tw/text/sound/63673/894114.mp3"
"ngahlaku ia Hlakuta’i savauana, maahlʉ a caihliku mamisa.","My name is Hlakuta’i savauana, and I’m 10 years old.","我叫Hlakuta’i savauana，我今年10歲。","https://web.klokah.tw/text/sound/63673/894115.mp3"
"ngasa ngahlau?","What’s your name?","你叫甚麼名字?","https://web.klokah.tw/text/sound/63673/894116.mp3"
