"slama pnbaq pneluq naha ro maray cikay sbil nniqan naha laga,","他們準備好弓箭等裝備及攜帶乾糧用品之後，","https://web.klokah.tw/text/sound/25898/428170.mp3"
"qutux qutux hi naha ga panga laqi naha nanak, ro msqun musa skura htgan na wagi kya.","各人並背負一嬰孩一同出發。","https://web.klokah.tw/text/sound/25898/428171.mp3"
"baha hmcwa musa neta hntgan na wagi kya ga theyaq iyal na, nanu yasa, puri na yutaq nniqan naha ga spuhi naha bih na siyux na cka ryaniq kya,","因為要到太陽出沒的路是很遙遠的，所以他們在路上把吃過的桔子種在地上，","https://web.klokah.tw/text/sound/25898/428172.mp3"
"nyan mnglung maha nway tmangu abax ro bhuyow kya yutaq qaca,","想讓它發芽，","https://web.klokah.tw/text/sound/25898/428173.mp3"
"innglung naha qutux yaw ga musa naha qbaqun innwahan naha qa ryaniq, huyay mzinah mwah muyax, qutux yaw uyi ga mbinah mwah muyax ga maki niqun naha.","一來知道回家的路，另外也可以作為裹腹的食物。","https://web.klokah.tw/text/sound/25898/428174.mp3"
"qutux qutux ryax wayal, ini qbaqi pisa kawas wayal uyi, sobih naha hntgan wagi ga theyaq calay na.","日復一日，年復一年，距離太陽之處尚遠，","https://web.klokah.tw/text/sound/25898/428176.mp3"
"ini bsyaq tyugal hi bkis pnangan naha laqi ga wayal mtyaba uyi la, ryax nasa wayal hnuqil qabaxa bnkis, ro tyugal hi laqi naha wayal mrkyas,","而三人都變成衰弱的老人，嬰孩們却都長成了。","https://web.klokah.tw/text/sound/25898/428177.mp3"
"inbuyan naha musa skura hntgan na wagi kya ro psyunow mu’ wagi.","老人們相繼死去，而長成的嬰兒繼續前進。","https://web.klokah.tw/text/sound/25898/428178.mp3"
"maki qutux ryax tehuk trheyaq cikey ro bih hntgan na wagi kya naha ga, kya maha saniq cyugan nya","有一天他們終於到達太陽之處，於是歇下來，","https://web.klokah.tw/text/sound/25898/428179.mp3"
"ini htuw wagi na ga aki naha bwun ro pqilun naha kya wagi.","準備第二天太陽出來時乘機射殺之。","https://web.klokah.tw/text/sound/25898/428180.mp3"
"saniq sasan laga, tyugan hi naha tehuk lkxux rgyax kya, ktayux naha mhtuw wagi laga,","第二天清晨，三人等在谷口，見太陽出來了，","https://web.klokah.tw/text/sound/25898/428181.mp3"
"tyugan hi naha s’agan bneluq ro bwun nahaq utux wagi, wagi haca ga memaw sramu ramu nya,","三人引弓急射，果中一顆太陽，並流出一大堆滾熱的血，","https://web.klokah.tw/text/sound/25898/428182.mp3"
"ro kilux ciyal calay ramu nya uyi, qutux hi wayal tlingan kilux na ramu wagi ro wayal si hnuqil kya,","其中一人被滾燙的熱血從頭淋下來，當場死了，","https://web.klokah.tw/text/sound/25898/428196.mp3"
"binah saying hi naha ga wayal slingun cikey kilux na wagi haca, ro tkkoh mgyay.","其他二人也都被灼傷，急忙逃回。","https://web.klokah.tw/text/sound/25898/428183.mp3"
"cka ryaniq inbinah muwah naga muyax ga ktalan naha pnuhi naha yutak cyunga ga, wa rema hopa,","在回家的路上，他們看見從前種的桔子，已經長了很高大，","https://web.klokah.tw/text/sound/25898/428184.mp3"
"qabax qara na qhuniq yutak ga giwan gaya na kakay tnaq kthwey nya, ro s’unan bway yutak qabax qhuniq’.","每棵樹幹都像大腿一樣粗，而且果樹上結滿了果實。","https://web.klokah.tw/text/sound/25898/428185.mp3"
"neta qalang naha kya laga, saying hi naha ga tkryan yunux naha ro mbukut turu naha uyi la, ana ga t’aring kya laga ,","回到村中時，他們二人已經變成白髮駝背的老人了；","https://web.klokah.tw/text/sound/25898/428186.mp3"
"ini htuw saying wagi la, ana gbyan ro qlyan uyi ga baqun cpung ktayux uyi la,","可是從那時起，便沒有兩個太陽，","https://web.klokah.tw/text/sound/25898/428187.mp3"
"ana ga knahul nasa ro neta mica laga nanak qutux wagi la, ’aring kya laga maki gbyan ro maki qlyan uyi la,","而有晝夜之分了，","https://web.klokah.tw/text/sound/25898/428188.mp3"
"gbyan ktalun ta byaling ga, si qbaqi maha byaling qaca ga pisang qutux sabaq na cquliq bnu’ na wagi ro hnuqil cyunga.","我們在夜裡看到的月亮，便是被射死的太陽的屍體","https://web.klokah.tw/text/sound/25898/428189.mp3"
"ke qani ga cnpuqing na gaga qqnxan, suna na cquliq Tayal,","語言是文化的根，是民族的靈魂，","https://web.klokah.tw/text/sound/25900/428198.mp3"
"baha hmcwa uka tnamas pntasan na ke qa qabax cquliq na Taywan genzyuminrok,","因為沒有文字，台灣的各原住民族群均以口傳身授的方式，","https://web.klokah.tw/text/sound/25900/428199.mp3"
"ro knahul hngiyang nanak ki pinktayux pintyawan mwah psbaq, ngyut kayal ini ga mqwas,","或說或唱的，來傳承族群的歷史與文化，","https://web.klokah.tw/text/sound/25900/428200.mp3"
"mwah mquyu sbaq gaga qnxan ki hkngyan na ita Tayal, pisang qwas na lmuhux Tayal qani ga skahul lhugan mqwas,","而泰雅族的古調吟誦就是用吟唱的方式，將祖先的歷史記憶代代的傳承下來。","https://web.klokah.tw/text/sound/25900/428201.mp3"
"qabax snyan ta lungan qa hkngyan na bnheci ga huyay mc’ubuy qabax.","部落耆老經常會藉著歲時祭儀，","https://web.klokah.tw/text/sound/25900/428202.mp3"
"mbkis qa qalang ta ga skahul naha klahang gaga sinqasan na ryax qutux kawas ini ga ryax na klahang gaga qnxan,","或生命禮俗的機會，","https://web.klokah.tw/text/sound/25900/428203.mp3"
"ptnaq kahul luhing mqwas qwas na lmuhux, pquyu cinrapal na bnheci ta cyunga, msgsux qabax mrkyas gmlux sinrhu ke na bnheci Tayal, ro klahang gaga Tayal,","透過古調的吟唱，述說著祖先的歷史過往，","https://web.klokah.tw/text/sound/25900/428204.mp3"
"nway si qngiyat m’cubuy insuna na cquliq Tayal.","勉勵年輕的族人要遵循古訓，恪守規範，為延續民族命脈而努力。","https://web.klokah.tw/text/sound/25900/428205.mp3"
"knahul pnatas nqa ke qani pquyu, pinktayux yaw, qwas, pqnyatan pzimu, cn’lwan sinrxan na pinhkngyan.","從語言的詞彙所記錄的傳說、故事、歌謠、祝禱詞得到歷史面貌，","https://web.klokah.tw/text/sound/25900/428206.mp3"
"pinktayux qwas qa ke qani ga psqyanux qabax qnqnxan na ita Tayal.","語言的音樂化會活化在泰雅人的一切生活的全貌。","https://web.klokah.tw/text/sound/25900/428207.mp3"
"Ke pnatas qa qwas na lmuhux qani, sngusan yaw nya qani ga pisang pktayux cmqes rong qa luhux mqwas,","語彙中的古調吟誦 ，是如同以穿針引線之動作呈現吟誦式的古調之意。","https://web.klokah.tw/text/sound/25900/428208.mp3"
"cquliq Tayal cpngan naha nyan ini ptnaq qa lnhuyan ro sinngusan pslyan qa gmwayax, ini ga lamu tmryax na ke qa sqwas, ro pquyu kkayal lungan naha,","泰雅族人會針對在不同場合、情境以如挑選、撿取適當的詞句來比喻，並傳達訊息，","https://web.klokah.tw/text/sound/25900/428209.mp3"
"nyan pnqesan pinqywan mc’ubuy pinktayux naha lungan, aniy san maha qwas na lmuhux,","並將象徵語彙予以串聯之表達敘事方式，","https://web.klokah.tw/text/sound/25900/428211.mp3"
"qabax ke hiyaga qzihung snyan naha ke, ke qani ga pinaras ke,","如此稱之古調吟誦；","https://web.klokah.tw/text/sound/25900/428212.mp3"
"qabax sqwas naha qzihung na kkayal mqwas pinktayux qwas na lmuhux qani qwas na mhux qa skura ita Tayal hiya ga qwas na Msgamil,","其用詞深奧、話中有話，是泰雅語中的文言文以歌的另一型態來呈現古調吟誦。","https://web.klokah.tw/text/sound/25900/428213.mp3"
"ini ga qwas na lmuhux san ta ngyut srhu ke ro mqwas, qani hiya ga piyang btiyux na gaga na Tayal.","古調吟誦我們可說是泰雅族的「口唱史詩」或「吟誦式古調」之說唱音樂，這是泰雅族的文化資產。","https://web.klokah.tw/text/sound/25900/428214.mp3"
"Yaw na gaga mqwas ki sinqwasan ta inu qa qwas na lmuhux:","古調吟誦使用之場合及相關禮規 ：","https://web.klokah.tw/text/sound/25900/428215.mp3"
"glasu ga knahun pquyu ini ga luhux mqwas mwah smyuk mqwas, mkkayal, ini ga smyuk mkayal.","首先要以口說或吟唱方式來對唱或對談及對話。","https://web.klokah.tw/text/sound/25900/428216.mp3"
"skura mlahuy ga mqwas, spung yaw ini ga msbalay yaw, phaw, smiyay, psyahaw ki gaga na msqun ga sqwas qwas lmuhux.","開會時聚會、協商和談判與仲裁、提親、成為親家、結婚是 吟唱的場所。","https://web.klokah.tw/text/sound/25900/428217.mp3"
"qutux loyi ga ima mwah mqwas?","另一個重要的問題是：吟唱者之條件與基本能力？","https://web.klokah.tw/text/sound/25900/428218.mp3"
"twang nanu kinbaqan ro sinrxan nya ppqwas qani, musa nya pinktayux pinnangan yaw nanu qa ppqwas qani?","吟唱者承載的功能是甚麼？","https://web.klokah.tw/text/sound/25900/428219.mp3"
"gaga na qwas Tayal qani, qwas na lmuhux ga mlikuy qa mrhuw sqwas, cintman yaw na mrhuw,","在泰雅的傳統規範中，古調吟誦是男性領袖、領導者的職責，","https://web.klokah.tw/text/sound/25900/428220.mp3"
"ini thuyay sqwas knerin ro ini nbah mwah mtama sqwas qwas na lmuhux knerin hiya.","女性是不能、也不得擔任其吟唱者職責。","https://web.klokah.tw/text/sound/25900/428221.mp3"
"qwas na Tayal qani, pira ryax cka na pinrqyas hkngyan qani, nyan maki calay mllamu na tnwang yaw nya,","泰雅人的音樂，在漫長的歷史發展中，","https://web.klokah.tw/text/sound/25900/428222.mp3"
"mnanak ga nyan s’una yaw na ccquliq Tayal, ini ga yaw na mc’ubuy yaw na qutux qutux llyung,","是具有多元豐富的音樂元素，而且充滿族群性及地域性，","https://web.klokah.tw/text/sound/25900/428223.mp3"
"qani ga btiyux san maha musa huyay pinktayux nyan mbhuyax gaga na itaTayal.","最能展現族群旺盛生命力的文化資產。","https://web.klokah.tw/text/sound/25900/428224.mp3"
"ana gat’yugan mxqayus ro wayal yaw na cyunga, tmwang mnanak na yaw mllamu na qwas qani,","然而，隨著新舊時代的更替，加上外來音樂的影響，","https://web.klokah.tw/text/sound/25900/428225.mp3"
"khmay wayal klhun utux qa mbkis, gaga qwas na bnkesan ta Tayal qani spglux t’mryax qani wayal p’yuw, ini ga pasi s’ungat mrpyut uyi, taqa ini ta qngyatiy hkni,","年邁長者的離世，我們的傳統音樂經過時空的變化，也因此而逐漸流失，","https://web.klokah.tw/text/sound/25900/428226.mp3"
"matas miru ro sku klahang ga yunga nya musa rpyut gaga na qwas lmuhux Tayal qani, s’ungat sinnnan na yaw inbuyan qa qwas na lnuhux qani la.","如果不努力作普查、做紀錄與保存，泰雅人的傳統音樂也將失去了傳承的希望。","https://web.klokah.tw/text/sound/25900/428228.mp3"
"Skura yaw na gaga myugi na Tayal, trang mlahang ryax snqasan, Mgaga, lkuxan tmsuqan pincriqan laga, ini ga mlahuy mkkayal, ro snqasan ryax na pnnqas ga musa maki ppiyan Tayal.","關於泰雅族的舞蹈，在歲時節慶、馘首或戰鬥時凱旋後、集會或其他飲宴時乘興舉行。","https://web.klokah.tw/text/sound/25903/428249.mp3"
"minnanak nqa snqasan na ryax nasa ga gaga na qcahuy qwas Tayal qani, qwas lmuhux qaTayal, gaga na myugi,","在這些特定的歡樂之日時，泰雅音樂文化中","https://web.klokah.tw/text/sound/25903/428251.mp3"
"ro qqaya na cinlbugan qani ga sisay maha pyangan maki yaw nya tmwang pinnqas lhuyan.","歌謠、舞蹈及樂器等成為很重要的助興項目。","https://web.klokah.tw/text/sound/25903/428252.mp3"
"memaw m’cubuy yaw nya ppiyan ki qwas na lmuhux qani, ini nbah bcyan, kruma ga mqwas qwasqani twangan gaga ppiyuy,","泰雅人的舞蹈與歌謠是密不可分的，有時候歌曲配合舞蹈，","https://web.klokah.tw/text/sound/25903/428402.mp3"
"kruma spiyuy myugi ga twangan qwas Tayal, tyaba calay cnbcyan yaw nya.","有時候舞蹈配合歌曲，自由性相當大。","https://web.klokah.tw/text/sound/25903/428403.mp3"
"puqing gaga qa ryaniq na ppiyuy qani ga, ini qzihung ro lhbax calay, qabax ppiyan qani ga knahun gaga qqnxan ro inbuyan na pptiyaw na Tayal qabax.","泰雅族舞蹈基本舞步，其實很簡單，大都由生活習慣及動作延伸而來的。","https://web.klokah.tw/text/sound/25903/428404.mp3"
"pisang gaga na myugi knayal Tayal san maha ppiyuy, ini ga myugi, binah kkayal hiya ga mskotung, ini ga mstopaw.","族人所謂的舞蹈稱之「必遇衣」或「麼尤歌衣」，另有跳舞、跳躍等稱呼。","https://web.klokah.tw/text/sound/25903/428405.mp3"
"Knrtung skayal hiya ga, gaga myugi Tayal hiya ga pisang ppiyiy na Tayal,","簡言之，泰雅人的舞蹈是泰雅人的律動或舞蹈動作（姿態）。","https://web.klokah.tw/text/sound/25903/428406.mp3"
"ini ga pqnesan ryaniq na mstopaw Tyugal ryaniq nya gaga na myugi qani:","舞蹈的形式有：麼熱歌一繞：","https://web.klokah.tw/text/sound/25903/428407.mp3"
"maki ppiyan na mrgiraw, mrgiraw qani ga ini msromum qa kintari ro hwinuk qani, si s’rux, thwayun skura te llaw ru skura te iyil qa kakay qani.","膝蓋和腰不彎曲，直立著將腳慢慢地向右或左移動。","https://web.klokah.tw/text/sound/25903/428408.mp3"
"maki ppiyan na hmkuy tari, ppiyan qani ga hmkuy tari ro msromum qa hi ta skura glasux, kruma ga psyunaw cinrapal na saying kakay.","另一形式是：喝麼顧更達利：腰和膝蓋彎曲，一面將身體稍稍彎向前方，一面慢慢地移動腳。","https://web.klokah.tw/text/sound/25903/428409.mp3"
"maki ppiyan na mstopaw, ppiyan qani ga hmkuy tari ro msromum hi, ngyut psyunaw mstopaw ro cinrapal qutux qutux kakay.","還有一個形式是：麼斯斗報：一面彎曲膝蓋和腰，一面向左或右跳躍。","https://web.klokah.tw/text/sound/25903/428410.mp3"
"pisang t’luw Gaga na pinsqunan, snqasan na ryax nqa qutux kawas, ini ga klahang Gaga na Mgaga ini ptnaq pinqwas naha qwas na Tayal qani,","舞蹈依結婚、祭典、獵取人頭等場合而有不同的歌詞，但其模式則在任何場合都相同。","https://web.klokah.tw/text/sound/25903/428411.mp3"
"ana ga ptnaq hayiy gaga na ppiyan qani hiya. nanu sqa t’aring ga mrgiraw ppiyan, mehung laga hmkuy tari,","亦即先跳麼熱歌一繞 ，其次跳喝麼顧更達利，最後跳麼斯斗報。","https://web.klokah.tw/text/sound/25903/428412.mp3"
"mucing nya mstopaw myugi la, kruma gaga na ryaniq ppiyan qani nanak mrgiraw ro hmkuy tari, ini mstopaw ppiyan, ini ga nanak mrgiraw qa ppiyan naha.","有時只跳麼熱歌一繞喝麼顧更達利，而不跳麼斯斗報，或只跳麼熱歌一繞而已。","https://web.klokah.tw/text/sound/25903/428413.mp3"
"ana nnanu gaga ryaniq ppiyan qani ga qba naha syan bih hwinuk kya, ginlgan ppglasux mqwas qani,","任何模式都是各自將左右手插在腰間，隨著領唱者，","https://web.klokah.tw/text/sound/25903/428414.mp3"
"twangan knyusun cinrapal roq qa tluling te llaw kakay, binah patuy na te iyil kakay hiya ga tliqan,","右腳趾尖用力，膝蓋稍微彎曲的時候，另外一隻左腳跟蹬起，","https://web.klokah.tw/text/sound/25903/428415.mp3"
"inbuyan qa twangan knyusun cinrapal roq qa luling te iyil kakay, binah patuy na te llaw kakay hiya ga tliqan uyi.","接著左腳趾尖用力，膝蓋稍微彎曲的時候，另外一隻右腳跟蹬起，","https://web.klokah.tw/text/sound/25903/428416.mp3"
"hmkuy tari ro tliqan qa patuy kakay qani, skura te llaw, ini ga skura te iyik tumaw mlahuy.","一面交替彎曲膝蓋和蹬起腳跟，一面向右方或左方繞去。","https://web.klokah.tw/text/sound/25903/428417.mp3"
"Gaga na ppiyan qani mlikuy ro kerin ga tbcyan ppiyuy, kruma ga msqun myugi qabax naha,","舞蹈為男女分開跳或一齊跳。","https://web.klokah.tw/text/sound/25903/428418.mp3"
"qabax ppiyan ga cbing qba ro mtomaw mlahuy, nanak qutux mwah ppglasux ga mak cka pglasux mqwas,","大都是圍成一個圓圈，以其中善於歌唱的人帶頭唱，","https://web.klokah.tw/text/sound/25903/428419.mp3"
"babaw nya laga gmlux smyuk mqwas, kruma mqwas ga twangan cinlbugan na lubuw Tayal.","然後大家一起跟著唱，有時會加上口簧琴的吹奏。","https://web.klokah.tw/text/sound/25903/428420.mp3"
"Skura cquliq Tayal kmayal, gaga na Pntasan ga kinkrahu calay sinrxan nya qani gaga na hkngyan qani ga pisang pqnesan na tninun qa mrkyas cquliq, nyan pktayux kinkahan ro cinrapal na knblaq nya uyi.","對泰雅族而言，紋面文化佔有舉足輕重的地位，它是生命歷程中成年的一個標記，也是一個美麗的印記及能力的展現。","https://web.klokah.tw/text/sound/25970/429103.mp3"
"Ita cquliq Tayal ga kahun slungan naha pnhkngyan yaba, yaya, ro pncbaqan naha,","泰雅人透過父母親身體力行與教誨，","https://web.klokah.tw/text/sound/25970/429104.mp3"
"trang nyan mbhoyax laqi ga, musa naha qbaqun tmwang tkbaqan na gaga ro yaw na sqyanux uyi.","在小孩成長過程中，達成技能與道德的兩種訓練。","https://web.klokah.tw/text/sound/25970/429105.mp3"
"iyik yaw na tkbaqan sqyanux hiya, skura laqi mlikuy ga lmon mqbaq yaw na gaga qmalup,","在技能訓練方面，對於男孩施以狩獵的訓練，","https://web.klokah.tw/text/sound/25970/429106.mp3"
"laqi knerin hiya ga pnbaq yaw na cinun ro pnbaq mlahang muyax, nya smungus mbhoyax ro tyaba laqi laga,","女孩則施以家事與織布的訓練，希望小孩長大之後，","https://web.klokah.tw/text/sound/25970/429107.mp3"
"musa maki kinkahan c’urux qutux muyax, ro thoyay tbuci mqyanux.","有能力建立家庭，並且獨立生活。","https://web.klokah.tw/text/sound/25970/429108.mp3"
"skura tkbaqan na mlahang gaga hiya ga, pyangan yaw nya ga snrhu na bnheci,","在道德訓練方面，強調祖靈的訓示，","https://web.klokah.tw/text/sound/25970/429109.mp3"
"mwah mcbaq laqi qabax yaw na gaga qnxan qalang ta, laqi ana maki muyax,","教導小孩有關部落生活中的倫理規範。","https://web.klokah.tw/text/sound/25970/429110.mp3"
"ini ga glux yaba, yaya musa tiyaw qmayah, qabax pnbaq naha ro sn’lungan naha ga knahun kntayux ro pnslungan naha tyawan na yaba ro yaya.","小孩無論是在家裡或跟著父母到田裡工作，都是耳濡目染從父母的身上學習工作的態度與精神","https://web.klokah.tw/text/sound/25970/429170.mp3"
"nta mpux kawas laga, yaba, yaya ga tyaba sgsuw naha cbaq yaw na qmalup ro yaw na cinun,","十歲以後，父母親才會開始對小孩施以嚴格的狩獵與織布的訓練，","https://web.klokah.tw/text/sound/25970/429112.mp3"
"pcbaq yaw na gaga qmalup ro pcbaq gaga snqaqsan na ryax, ro gaga na psaniq skura yow laqi mlikuy hiya, baha hmcwa,","也開始教導有關狩獵與農事的祭儀與禁忌。","https://web.klokah.tw/text/sound/25970/429113.mp3"
"musa qmalup iyat nanak maki knkahan ro gaga kiyap nya, mnanak ga siga blaq tunux nya uyi,","在男孩子方面，因為狩獵不但需要技巧與力氣，更需要有機警的頭腦，","https://web.klokah.tw/text/sound/25970/429114.mp3"
"musa nya qbaqun maha nanu sbalay innglisan ro tmumaw qitih na yaw, siga tmwang pnbaq yaw krryax.","以應付各種突然的或危險的場面，故須長期訓練。","https://web.klokah.tw/text/sound/25970/429115.mp3"
"skura laqi knerin hiya, piyang na pnbaq gaga sqyanux hiya ga yaw na cinun.","而女孩子方面，最重要的技能訓練是紡織。","https://web.klokah.tw/text/sound/25970/429116.mp3"
"baq calay cinun knerin ga trhwanun cquliq, piyux cquliq qsliq hiya, babaw nya ga piyux cinunan nya pala ga tmwang cin’uluw btiyux,","很會織布的女人受人羨慕，很多人追求，日後織的布多又增加財富，","https://web.klokah.tw/text/sound/25970/429117.mp3"
"ana ima ini kbaq cinun ga p’syaqan cquliq ro putut san naha kmayal.","凡是不會織布的，則被譏笑為魯鈍的女人。","https://web.klokah.tw/text/sound/25970/429118.mp3"
"Siga neta qbaqun naha qabax yaw na sqyanux laga, laqi mlikuy ro knerin ga ana baqun matas rqenas naha,","直到訓練有所成時，泰雅男孩與女孩才可以施以紋面，","https://web.klokah.tw/text/sound/25970/429119.mp3"
"qani ga nya pktayux maha nya baq mqyanux qabax naha ro nya mrkyas llaqi la.","表示他們已經是具有謀生技能的成年人了。","https://web.klokah.tw/text/sound/25970/429120.mp3"
"iyat huyay pktayux qa hiya ga cquliq ginlgan gaga na Tayal, musa thuyay klahang qutux gaga qa cinqlangan nya uyi.","不但能成為部落中循規蹈矩的人，也能夠保護「嘎嘎」的團體。","https://web.klokah.tw/text/sound/25970/429121.mp3"
"skura gaga na pntasan qa Tayal hiya ga maki gaga calay smsum,","泰雅族對於紋面有著嚴謹的規範，","https://web.klokah.tw/text/sound/25970/429122.mp3"
"knbtunux qa wayal pnatas lukus na knerin ro mlikuy ga ini ptnaq qabax, kya hayiy yal nqa tbcyan pquyu squ smehung.","而美麗的標記款示男女又不盡相同，大致可分述如下：","https://web.klokah.tw/text/sound/25970/429123.mp3"
"skura yaw Pntasan qa mlikuy, likuy hiya ga ptasan lihuy ro qabay naha, ptasan tyugal shoyu ryaniq qa cka na lihuy naha, kya hayiy saying syaku.","有關男子之款式是：男子在前額及下顎施刺，前額是在額頭中央平行紋三道，全長約二寸。","https://web.klokah.tw/text/sound/25970/429124.mp3"
"Ptasan qutux shoyu ryaniq qabay nya , kya hayiy qutux syaku. skura yaw Pntasan qa knerin,","下顎為一道，全長約一寸。","https://web.klokah.tw/text/sound/25970/429125.mp3"
"knerin hiya ga ptasan lihuy ro rqnas naha, knerin ga kya hayiy mpux saying kawas, ini ga mpux tyugal kawas ga musa ptasan lihuy nya,","有關女子之款式是：婦女在前額及臉頰施刺。","https://web.klokah.tw/text/sound/25970/429126.mp3"
"tnaq ryax ptasan lihuy mlikuy, neta mpux pitu kawas, ini ga mpux spat kawas knerin lga ptasan rqenas naha la,","婦女約十二、三歲時施刺於前額，如男子；至十七、八歲時刺於臉頰，","https://web.klokah.tw/text/sound/25970/429127.mp3"
"nanu sqa ’aring sobih te llaw ro iyil papak skura nqwaq ptasun naha, kya’ hayiy tyugal lahuy nqu slux matas,","即由左右兩耳邊向嘴側畫三組四條橫線，","https://web.klokah.tw/text/sound/25970/429128.mp3"
"cka ryaniq pnatas qani ga ptasan yal nqa ryaniq kobu, sglabang nya hiya ga kya’ qutux syaku eta qutux syaku ro tyugal mspung.","並於其間施以網狀之紋路，寬為一寸至一寸三分。","https://web.klokah.tw/text/sound/25970/429129.mp3"
"gaga na pntasan qa Tayal qani ga, musa sa maha qtux mnanak na ryaniq skblayan, qutux nanak na gaga knbetunux, cin’lwan ro kiniyik calay yaw nya","紋面之傳統在泰雅族，真可謂是一種藝術、一種美學，且富涵其深沉之文化意涵。","https://web.klokah.tw/text/sound/25970/429130.mp3"
"gaga nqu cnlalu qa Tayal cqani, lalu na laqi ga m’cubuy lalu bkis,sklayan nqu m’cubuy saying lalau, nanu sqa lalu laqi knerin,","泰雅族的名制為親子連名制，由兩個名合成，即子或女的名字在前，","https://web.klokah.tw/text/sound/25983/429255.mp3"
"ini ga lalu laqi mlikuy ga cyan glasux, mehung ga inbuyan lalu nay aba, ini gal au na yaya, pnlwanan ta lalu ta nanak ga nanak,","後面連以生父或母之名，一般都採用父名，平時呼名僅呼其本名，","https://web.klokah.tw/text/sound/25983/429256.mp3"
"ini sgiy lalu bkis nya hiya, ini ga sgyun ta slalu na lalu nya, pinbaqay ta nyan sbiru mehung.","略其親名，或僅呼本人綽號，詳見後述。也有若干採用父親綽號為第二名的。","https://web.klokah.tw/text/sound/25983/429257.mp3"
"ini ptnaq snyan ta lalu na mlikuy ro knerin qa cquliq Tayal, qabax lalu cqani ga knahul sinbilan na kinbkisan ta, inbuyan ta smi lalu qabax.","泰雅族人的名字男女各異，而所有的名字都是由古代流傳下來的，大家延襲採用。","https://web.klokah.tw/text/sound/25983/429258.mp3"
"gaga na cinlalu cqani hiya hintgan llaqi lga knahul yaya ro yaya, ini ga yutas ro yaki naha cpung smi lalu.","命名在出生之後由父母或祖父母決定。","https://web.klokah.tw/text/sound/25983/429259.mp3"
"ana ga cingan cmpung ga yaya ro yaya na laqi cqani, yal nqu yutas miq lalu, siga smwal yaya na laqi,","但尊輩有最後決定權，例如祖父給命的名，父親必須同意，","https://web.klokah.tw/text/sound/25983/429261.mp3"
"kyaqa pinqutan cquliq kmal mha“blaq calay lalu na laqi qani, ima snyan ? snyukan kmal mha, snyan lalu qa yutas nya”.","別人若問說：小孩的名字很好，是誰給取的？則回答說：「是祖父命名的。」","https://web.klokah.tw/text/sound/25983/429269.mp3"
"smi lalu laqi milkuy ga mc’ubuy bnkesan krahu, mrhuw, ini ga lalu na motux na Tayal, nanu yasa musa pisang naha krahu,","男嬰的命名，依古代偉人、頭目、英雄者之名，則將來可以像他們一樣偉大；","https://web.klokah.tw/text/sound/25983/429271.mp3"
"smi lalu laqi knerin ga snyan naha lalu musa pqasun qabax naha.","女嬰之名亦多取大家喜歡者之名。","https://web.klokah.tw/text/sound/25983/429272.mp3"
"’ringan puqing yaw na lalu qani ga, nyan naha ini qbaqiy qabax naha, kihuy cin’ringan yaw nya ga, cka qabax lalu ga knsyugan lalu na qqaya na cinbwanan.","名字本來的意義，他們自己大多不明白，探其來源，大半是借用自然物之名。","https://web.klokah.tw/text/sound/25983/429273.mp3"
"maki lalu phpah ro qqhuniq, lalu na qsinux, lalu na qqaya tyawun qba, kbabaw na yaw ro kntyux naha yaw na cinbwanan, ini ga lalu na innglung naha.","有植物名、動物名、器具名、自然現象及事物及抽象名詞等。","https://web.klokah.tw/text/sound/25983/429274.mp3"
"mbinah ga maki lalu knahul slalu naha, lalu na slalu sgyun naha, ini plawa calay lalu naha,","另大部份的人都有綽號，平時大家都喜歡呼綽號而不呼真名，","https://web.klokah.tw/text/sound/25983/429279.mp3"
"kyaqa pqutan maha hcwa maki slalu su, smyuk kmayal maha, nyan ini qbaqi.","若問他們為什麼有綽號，則答曰不知道，","https://web.klokah.tw/text/sound/25983/429280.mp3"
