"a Pinuyumayan mu, ulra mukecep dekalran. nu mulaud mu, meredek i Papulu.","","https://web.klokah.tw/text/sound/26880/439610.mp3"
"nu mudaya mu, mau na Danadanaw, na Mulivelivek, na ’Alripay, na Tamalrakaw di na Likavung. nu mukedet mu, ulra na Kacacipulr di iniyam na Kasavakan.","向西邊有龍過脈、初鹿、阿力擺、泰安和利嘉，往南邊就是知本和建和","https://web.klokah.tw/text/sound/26880/439611.mp3"
"nu mu’ami mu, palru i Pinaseki di i Puyuma. kaadu mi kani Valangaw kana henan i makalusu kana cekipan.","往北到達下賓朗和南王部落。我們都分居在台東平原周圍的山腳下","https://web.klokah.tw/text/sound/26880/439612.mp3"
"maredalredalrep mi dekadekalr, salaw mi kalre’ayan mudangidangi.","部落與部落之間因相距不遠交通便利，互相交往也很方便。","https://web.klokah.tw/text/sound/26880/439613.mp3"
"nu meredek kana duwaya ’ami mu, marevulavulas micepa da wuakasayan semasahar na dekalr diya.","每個部落每兩年都會輪流擔任聯合歡聚的辦理","https://web.klokah.tw/text/sound/26880/439614.mp3"
"na micepa demikes na dekalr mu, paadang da marekamelrimelri da semasaharan... kanidu na wari muparaduk na mukecep dekalran, i wadukan.","負責辦理活動的部落引導者則須費盡心思籌畫各式各樣的活動活動","https://web.klokah.tw/text/sound/26880/439615.mp3"
"piya lra pakadalram na temaramaw mu, na ma’ida’idangan di na rahan mu, mungsalr lra semasahar.","當日十個部落聚集在聚會所當祭拜祖靈後耆老及祭司們則開始歡慶活動。","https://web.klokah.tw/text/sound/26880/439616.mp3"
"tu palalisiyan na Pinuyumayan nu sa’amiyan mu, ulra marekamelrimelri.","卑南族一年中有各種不同的祭典活動","https://web.klokah.tw/text/sound/26880/439617.mp3"
"ulra na mangayangayaw, na mucarun, na katikelruwanan, na venasevas, na kemaderunan, na pa’audalr na kasasunglan kana Revuwa’an, nu kapalisiyan i revuva’an mu,","如少年猴祭、大獵祭、年祭（鞦韆祭）、除喪祭、小米收穫祭、祈雨祭、祭祖日等。","https://web.klokah.tw/text/sound/26880/439618.mp3"
"na miwari diya na dinkalranan mukuwa muwaduk i Revuwa’an penalisi sumungal kananta temuwamuwan.","我們祭祖當天，有空的族人會聚集在發祥地祭拜祖先。","https://web.klokah.tw/text/sound/26880/439619.mp3"
"nu ka’amiyanan na kapalisiyan adu kana wari mu, salaw musa’ur mapiyapiya na dinkalranan,","而年底的年祭活動，卑南族可說是個非常團結合作的民族","https://web.klokah.tw/text/sound/26880/439620.mp3"
"mukasakasa i palakuwan marepulralrang padang da kiyakarunan, kiyacevung kana ’amiyan.","所有族人歡喜聚集在巴拉冠一起忙碌，為迎接年祭的到來","https://web.klokah.tw/text/sound/26880/439621.mp3"
"mapiyapiya, semenasenay muwarak patali ’uninan.","歌舞歡唱到天明。","https://web.klokah.tw/text/sound/26880/439622.mp3"
"na Taiwan Yuancumin nantu ikakuwa mu, mau na kaadu i makakedet i Taihēyo na lratar diya na ta mawan,","臺灣原住民族是指在台灣原居的南島民族，也是南島民族的分支之一","https://web.klokah.tw/text/sound/26882/439643.mp3"
"mau nantu kinisepi’ kemay makakedet na lratar kema, pakangaway a lruwac leman ’amiyan a adiyu diya, adidiya musasavakan na paylang adu, mawmau inta na kaadu i Taiwan peniyapiya,","十七世紀漢人移入前族人廣泛居住於整個臺灣","https://web.klokah.tw/text/sound/26882/439644.mp3"
"harem na Mingkuk na sēhu mu Yuancumin tu kuwayaw ta venavina.","中華民國政府官方以原住民族稱之","https://web.klokah.tw/text/sound/26882/439645.mp3"
"harem mu mupatepi’ ta kadu i Taiwan i makahenahenan di mau i kilaudan di i Vuculr,","現在則主要分布於臺灣本島山區、東部地區以及蘭嶼","https://web.klokah.tw/text/sound/26882/439646.mp3"
"harem na sēhu nantu kinuretan mu, mau na kinaduwan na Yuancumin, nintaw kadekalran na Yuancumin kema.","現在的中華民國地方制度法上稱之為原住民族地區，簡稱原鄉","https://web.klokah.tw/text/sound/26882/439647.mp3"
"i Taiwan ninta pinicauwan nata mawan nu saleman na cau mu daduwa ta.","臺灣原住民族總人口數佔臺灣人口總數的2.33%。","https://web.klokah.tw/text/sound/26882/439648.mp3"
"na Yuancumin i Taiwan mu adi sasaya mawan mupatepi’ kani i Taiwan i iyaiyan diya.","臺灣原住民族並非單一的民族，而是由分布在臺灣各地之數個語言及生活方式不同的部族構成","https://web.klokah.tw/text/sound/26882/439649.mp3"
"tu piningaiyan, nantu iyavaaw, nantu pinidekalran, nantu inudaway adi maresasan, na sēhu tu ikakuwa kaninta na Yuancumin mu, harem mu ulra mukecep misama’ da nanema nanta mawan, ulra na Amis, na Paiwan, na Tayal, na Bunun,","目前有十六個民族獲官方認定。分別是阿美族、排灣族、泰雅族、布農族","https://web.klokah.tw/text/sound/26882/439650.mp3"
"na Pinuyumayan, na Rukai, na Cou, na Saisiyat, na Tau, na Thao, na Kabalan, na Truku, na Sakizaya, na Seedq, na Hla’alua, na Kanakanavu.","卑南族、魯凱族、鄒族、賽夏族、達悟族、邵族、噶瑪蘭族、太魯閣族、撒奇萊雅族、賽德克族、拉阿魯哇族及卡那卡那富族等。","https://web.klokah.tw/text/sound/26882/439651.mp3"
"ulra diya na mawan maranger kipungadan muravak nadu na lrungkiyaw na mawan.","其他還在推動政府認定的族群，還包含許多平埔族群。","https://web.klokah.tw/text/sound/26882/439652.mp3"
"na Yuancumin nantu ruma’ tu inudawayan parahan, di remavi sumulrec, di maapur da puran, di tiniktikan tu mudingan,","原住民族的屋架建築、火墾、吃檳榔、紋面","https://web.klokah.tw/text/sound/26882/439653.mp3"
"di tu dinawayan na kavang na kalrit, di mucalacalaw muarak tu kakuwayanan mu, kamawan kania i Tayhēyo i makakedet na lratar tu ikakuda.","皮衣製作、輪舞等文化習俗，都與傳統的南島文化相近。","https://web.klokah.tw/text/sound/26882/445683.mp3"
"na Yuanminhuē lra mu, nu pakadaalram kana cau na Yuancumin i Taiwan mu, marekaiman kana kidare’an kadiyua i Tayhēyo i makakedet na lratar tu mawan kema,","中華民國原住民族委員會在介紹臺灣原住民族與世界南島語系民族的關係時即表明","https://web.klokah.tw/text/sound/26882/439654.mp3"
"nanta ikacaacau mu, mau na maka Malay kema, inta na Taiwan na mawan mu, mau na i ’ami’ami lra.","「臺灣原住民族屬於南島民族，在人種上屬馬來人種，臺灣是南島民族分布的最北端。」","https://web.klokah.tw/text/sound/26882/439655.mp3"
"adiyu diya na Yuancumin nantu ikakuda mu, mau na remavi sumulrec di muwacalun, mau nanta kinivavaawan,","過去大多數的原住民族都是以傳統游耕及狩獵為主要的生產方式。","https://web.klokah.tw/text/sound/26882/439656.mp3"
"harem lra mu na adalrep i cekipan mu, kamawan lra kana paylang tu iyavaawan, aymu nantu ikakuda i dekalr mu, tu vilinaw diya.","近年來靠近平地的原住民族則與漢人的生活方式接近，但是部落組織的維繫仍然保留著。","https://web.klokah.tw/text/sound/26882/439657.mp3"
"na Yuancumin salaw seme’er kanantu tinavawan na temuwamuwan, masalu da ulra na temuwamuwan kadu kanantu pinidekalran miya’elaw kanantu dinekalranan di tu isasalem maruwaya mudikes kema,","原住民族重視祖靈信仰，相信祖靈會保護族人收穫豐盛。","https://web.klokah.tw/text/sound/26882/439658.mp3"
"di na melrimelri na mawan mu, ulra tu kirekamelri atu palalisiyan.","各族都有自己獨特的祭典。","https://web.klokah.tw/text/sound/26882/439659.mp3"
"2005 ’ami mu ulra lra ta Yuanmintay, nantu pauwayanan mu maruwaya intaya lra na pulrengaw marengay kema.","二〇〇五年七月一日，原住民電視台正式開播。","https://web.klokah.tw/text/sound/26882/439660.mp3"
"na mutuayawan mu, ulra na makahenan na lippoiing di ulra na i maka cekipan na lippoiing,","目的在於給予弱勢的原住民族自主發聲權。","https://web.klokah.tw/text/sound/26882/439661.mp3"
"na i makahenan mu tatelu, na i cekipan mu tatelu tu kinayanan.","在民意機關的部分，立法院有山地及平地原住民各三席的保障名額。","https://web.klokah.tw/text/sound/26882/439662.mp3"
"nanta piningaiyan kadu lra pakangawayan a pidakudulr lra ’ami kema mu, iniyan ta da kuwarelrangan pakadalram.","我們的語言存在了幾千年，已無從考證","https://web.klokah.tw/text/sound/26884/439675.mp3"
"ulra na micepa temakesi da piningaiyan na cau mu, tu pasaradanay nanta piningaiyan i punapunan da “piningaiyan da lratar kedet”,","一些語言學者將我們的語言列為全世界「南島語系」","https://web.klokah.tw/text/sound/26884/439676.mp3"
"kinuwa harem i punapunan, di mawmau nanta piningaiyan mau na misepi’ i makakanatanatal i kedet kana lratar diya.","是世界現今唯一主要分布在各國島嶼上的語系","https://web.klokah.tw/text/sound/26884/439677.mp3"
"nantu rinavakan di nantu i kalawasan da pinidare’an mu, muravat lra da parekaduwa kantu ipaliyus kana pinidare’an da cekiw,","其分布的範圍地理面積超過地球圓周的一半","https://web.klokah.tw/text/sound/26884/439678.mp3"
"di i Taiwan lra mu mau nintaw karamiyan da piningaiyan da lratar i makakedekedet kema.","而台灣是南島語系的源頭，卑南族群則是其中一個族群。","https://web.klokah.tw/text/sound/26884/439679.mp3"
"adiyu diya na piningaiyan na samawan mu, iniyan da vinavalrayan na valray,","早期原住民族語，沒有文字記載","https://web.klokah.tw/text/sound/26884/439680.mp3"
"initurus kana vinavatiyan da ma’a’idangan, kicungucungulr, mulrepus, munueman lra ’ami tu i inlrangan.","完全由耆老口述一代一代傳承著，經過多少歲月的磨難。","https://web.klokah.tw/text/sound/26884/439681.mp3"
"karpapuwan matengetenged i punapunan mu, na Dipung patakesi datu piningaiyan di kitulud lra na Mingkuk i Taiwan mu,","二次世界大戰日本佔領台灣時，要原住民一律接受日本皇民教育，要族人說日本語。","https://web.klokah.tw/text/sound/26884/439682.mp3"
"tu pakasasayayaw vuutay data ngai, puwapuwa lra dika mulremes ta piningaiyan.","國民政府接收台灣後的同化政策、更加速瓦解原住民族群的語言","https://web.klokah.tw/text/sound/26884/439683.mp3"
"nanta piningaiyan mau tu kiniramiyan data kakuwayanan na cungucngulran,","語言因而流逝掉了。","https://web.klokah.tw/text/sound/26884/439684.mp3"
"nu mulremes diya data piningaiyan mu, karuwa diya mikakuwayanan da penauwa a cungucngulran nay?","語言是文化的根本，一個沒有母語的族群，能算是有文化原住民族嗎？","https://web.klokah.tw/text/sound/26884/439685.mp3"
"na pinuyumayan mu, mau na sayhu anger ta kuwayaw ta anger.","卑南族是個優秀的族群","https://web.klokah.tw/text/sound/26884/439686.mp3"
"semalra kiyalrimayana ta na Pinuyumayan diya marekalramana ta data piningaiyan, parekedanga ta menadanadam marengay data ngai,","希望卑南族人更要加倍珍惜自己的語言，盡量學習、多說自己的族語","https://web.klokah.tw/text/sound/26884/439687.mp3"
"nu masiruc lra nu adi mucuur lra, maremu diya marengay di marayas marengay,","即使說得不流利、不到位，只要敢說、常說","https://web.klokah.tw/text/sound/26884/439688.mp3"
"kaulra a saya wari, maruwa acevung pareveliyas data piningaiyan da temuwamuwan! di karuwa ta mated data rineangeran kana temuwamuwan,","終有一天，我們能夠找回過去先祖們常用的語言，進而和祖先們心靈交會；","https://web.klokah.tw/text/sound/26884/439689.mp3"
"marayas ta kimadayar kana ma’idangan,","常用母語跟耆老長輩談天說地","https://web.klokah.tw/text/sound/26884/439690.mp3"
"na demaway kanta na palisiyan. Kalraaman kanta!","相信自然萬物之神，將再眷顧著我們！","https://web.klokah.tw/text/sound/26884/439691.mp3"
"parkedanga ta na Pinuyumayan! parkedang ta na samawan.","卑南族加油！原住民族加油！","https://web.klokah.tw/text/sound/26884/439692.mp3"
"nanta Revuwa’an kadu kadiyu i makakedek kana sanhe di adalrep kani Huwayen i dadalan di kadu kana pasasekiyan kana dare’,","我們的發祥地就在今日知本往南五公里處台東縣太麻里鄉的三和村近華源村處的斜坡地","https://web.klokah.tw/text/sound/26907/440033.mp3"
"i kadu ulra a pinarahanan da Mingkuk 49 ’ami diya, na Kacacipulr di na Kasavakan patikedir kanidu na varasa’i vasikasikaw,","有一塊知本、建和族人於民國四十九年時，在那片竹林立下石碑的地方","https://web.klokah.tw/text/sound/26907/440034.mp3"
"i icas kana varasa’ vinavalray da “rinevuwa’an da samawan i Taiwan” di kanidu na varasa’ i likakudan mu, parahan da saya makiteng na varalri’ na ruma’,","石碑上頭寫著「台灣山地人發祥地」並在石碑後方建造一間小石板屋","https://web.klokah.tw/text/sound/26907/440035.mp3"
"na varasa’ vinavalray kanidu na mulremes kana valenan di mukaicasan lra likudan kani na tatelu ta temuwamuwan. tu ngadangadan, i Tavatav (vavayan), i Palu’ (vavayan), di i Sukasukaw (ma’inayan),","上頭由又至左寫著洪水滅世後在此登陸的三位祖先的名字：Tavatav（女），Palu’（女）和Sukasukaw（男）","https://web.klokah.tw/text/sound/26907/440036.mp3"
"muramawan datu kalrayuwan kanantu ina’iyal na temuwamuwan maruwa mukaicasan i dare’, parahan diya da makiteng da karuma’an tu sasungalan.","為感念神明保護祖先上岸，又建造一間小屋來敬拜。","https://web.klokah.tw/text/sound/26907/440037.mp3"
"na maruwadiyadi tu temuwamuwan na Kasavakan di na Kacacipulr na dinkalranan mu, kana ’ami’ami nu pukateru vulan mu, mukuwa i Revuwa’an miinada datu palalisiyan, sumunan patavang kana temuwamuwan.","除了祖先是姊弟關係的建和與知本兩個部落的卑南族人每年三月都會各自攜帶祭品前往發祥地祭祀外","https://web.klokah.tw/text/sound/26907/440038.mp3"
"na kadu i dalrep na Paliwan i Rupa’at na dinkalranan di na Amis i Tulan mu, mukakuwa penalisiya, ara adiya maresan da wari.","鄰近的北里排灣人以及都蘭阿美人也會在不同時間到那裡行祭","https://web.klokah.tw/text/sound/26907/440039.mp3"
"nantu ipalisi patavang na dinkalranan mu, mau nantu kinasahar mekan nanta temuwamuwan a adiyu diya na aekanen na vurasi, vu’ir, tanuvan, dawa, kuca, tiwngan da vavuy.","族人的祭品都是早期祖先愛吃的食物，如：地瓜、芋頭、山芋、小米粿、酒、豬肉等。","https://web.klokah.tw/text/sound/26907/440040.mp3"
"nu likudakudan lra semunan da seney di muwarak mapiyapiya pakasemangal kana temuwamuwan.","祭祀最後則是獻歌獻舞讓祖先高興。","https://web.klokah.tw/text/sound/26907/440041.mp3"
"nu mukuwa ta i kadu penalisiya, ulra na duma cau pacepelr tu rinangeran, mukuwa ta ’emelresapa (puyvunga) kema,","我們族人到那裡祭祀，有人誤以為是去掃墓，","https://web.klokah.tw/text/sound/26907/440042.mp3"
"aymu i kadu iniyan datu cevelr ta temuwamuwan, lawas tu inuvaawan data temuwamuwan,","其實那裡並沒有祖先的墓，先祖們生活的範圍寬廣","https://web.klokah.tw/text/sound/26907/440043.mp3"
"i likudakudan mu cinevelr i iyan adi ta lramadalram,","最後的葬身地也不知道是在哪裡","https://web.klokah.tw/text/sound/26907/440044.mp3"
"nanta iauwa i kadu penalisiya mu, mukuwa ta da parangera tu inukaicasan i maruwarum nadu,","我們到那裡獻祭主要是為紀念他們登岸","https://web.klokah.tw/text/sound/26907/440045.mp3"
"muramawan da wasama’an vaaw, muramawan da mera’ra’ da cungulran temuwan sulenan,","為了生存，為了繁衍子孫","https://web.klokah.tw/text/sound/26907/440046.mp3"
"pakucekuc meravi kikarun semalem datu aekanan na musamasama’ musapura mi munayun kema tu nirangeran.","篳路藍縷、開墾種植所做的一切。","https://web.klokah.tw/text/sound/26907/440047.mp3"
"pakangaway da makalruwac ’ami, makiteng ku diya adu, mizidinsiya ku mukuwa i pasekiyan kana henan kicevunga kani malri di nani.","在五十年前，那時候我還很小，我要到山腳下接爸爸媽媽。","https://web.klokah.tw/text/sound/26908/440067.mp3"
"a varasarasa’ na dalan, nu adi areked ta pinakakawangan na dinsiya mu, payas ta kurvulru’ kana varasarasa’, salaw ta kakuwalengan mizidinsiya.","路面是小石子，騎不穩就會摔在石頭路上，真的很難騎腳踏車。","https://web.klokah.tw/text/sound/26908/440068.mp3"
"“uri vavariw na wari, nu ’emanan nu ’emanamanan mu, yawa ta merawaka kana kalikali kani dekalr.” kema pakadalram da mayku na sonciyo.","「颱風快來了！明天一早要清掃部落的水溝。」村長正在用部落的廣播器報告。","https://web.klokah.tw/text/sound/26908/440069.mp3"
"na sarumaruma’an mu karpupacaran da sasa a cau, mukuwa merawaka da kali. kemadu sadekalran puelak da rimekan kana kalikali kani dekalr.","於是每戶人家派出一位，共同清掃疏通部落的水溝。","https://web.klokah.tw/text/sound/26908/440070.mp3"
"nu kasede’an i takesiyan mu, salrangan ta data ’aliyaliyan, mukuwa i dinanuman purikana.","每逢學校放假，和朋友一起到溪流旁牧牛","https://web.klokah.tw/text/sound/26908/440071.mp3"
"ta tilu’anay na hung di marevurevu ta, maverelrarelrang ta, purevu ta di macum ta da vurasi.","將牛綁好繫緊，和伙伴們摔角、追逐、取火烤地瓜。","https://web.klokah.tw/text/sound/26908/440072.mp3"
"cilraw na danum i dinanuman, marepakuwakuwa ta pakulima.","溪水非常清澈，我們比賽游泳。","https://web.klokah.tw/text/sound/26908/440073.mp3"
"nu vuceker na hung mu, ta pa’away diya da danum di muruma’ ta lra.","牛吃飽了，先讓牠喝足夠的水再回家。","https://web.klokah.tw/text/sound/26908/440074.mp3"
"nu piya ta keravi mu, saruma’enan ta mulicung i pacaran,","吃過晚餐，一家人圍在庭院","https://web.klokah.tw/text/sound/26908/440075.mp3"
"venavati da vativatiyan i imulri na ma’inayan. semenay da velrecenganan da senay i mulri na vavayan.","祖父說故事，祖母吟古謠。","https://web.klokah.tw/text/sound/26908/440076.mp3"
"tu ’avesavesay ta da vali di salaw valiyan, payas ta matungatung lra.","微風吹拂涼快呀！睡蟲不知不覺地來了呢！","https://web.klokah.tw/text/sound/26908/440077.mp3"
"muvalivalis lra a kakuwayanan harem, mareka’inava ta inuwavaawan i punapunan di salaw ta kalre’ayan.","時代在變我們的生活越來越好，一切都非常方便。","https://web.klokah.tw/text/sound/26908/440078.mp3"
"mipaliding ta di miotobay ta mukuwa i iyaiyan diya.","到任何地方可以開車和騎機車。","https://web.klokah.tw/text/sound/26908/440079.mp3"
"aymu, marekasadu na masalralrecap na paliding lra, na otobay lra, kemay i dawilr kinger ta da ngiw, ngiw, ngiw kema na ciyuhuce.","但是，車禍越來越多，老遠就聽到救護車的呼叫聲。","https://web.klokah.tw/text/sound/26908/440080.mp3"
"nu venariw diya mu, mucapapera na henan, tu cakepalraw da vali na kawi, maputut na kali di semelavaw na ’enay, tu usavakay da velenan na ruma’, muda’ulr na vinaawan na haramhaman, tu viiyaw a sa’uv na kasiya…","只要颱風過境，山崩、大樹倒、潰堤、河道堵塞、河水氾濫、家戶淹水、飼養的動物被流走、鐵皮屋被掀翻……","https://web.klokah.tw/text/sound/26908/440081.mp3"
"salaw kawukawud. marekasaeman ta rinuma’enan na kaadu i dekalr,","實在恐怖啊！住在部落的族人越來越少","https://web.klokah.tw/text/sound/26908/440082.mp3"
"sadu na pinarahanan na vekalan na ruma’. aymu, amelri ta rinuma’enan na kaadu.","部落裡蓋了很多新房子，卻不是族人在住。","https://web.klokah.tw/text/sound/26908/440083.mp3"
"marekasa’uc lra ta kinkaduwan. adi ta lra semasalem da ’apuc.","部落的住屋越來越窄，不再種花了！","https://web.klokah.tw/text/sound/26908/440084.mp3"
"nu ulra a semasaharan i dekalr mu, mukuwa ta i tokay cemima’a da ’apuc ta ’a’upidan.","若逢親友的喜慶，只好到市區買花來編花環。","https://web.klokah.tw/text/sound/26908/440085.mp3"
"nu piya ta keravi mu, kadu ta i savak mena’u da tilibi, adi lra venavati da vativatiyan na ma’ida’idangan.","用過晚餐，就在屋內看電視","https://web.klokah.tw/text/sound/26908/440086.mp3"
"adi lra venavati da vativatiyan na ma’ida’idangan. adi lra semasenay da velrecenganan da senay na temu. mawili da nana’uwan kana tilibi.","父母不再說故事，祖父母不再吟唱古謠，大家只顧看電視。","https://web.klokah.tw/text/sound/26908/440087.mp3"
"adi ta lra mukakuwa i velelruwan purikana, uniyan ta da ’uma, adi ta lra venavaaw da hung.","現不再有人去溪邊牧牛，沒有了田也不再養牛。","https://web.klokah.tw/text/sound/26908/440088.mp3"
"na ’enay i velelruwan mu, cimuru’ di ’angecur, kakuda mukuwa pakulimaya na lralrak?","溪流的水混濁還夾雜著臭味，要孩子們如何游泳呢？","https://web.klokah.tw/text/sound/26908/440089.mp3"
"man muvalis lra ta inuwavaawan i punapunan? tu tinuru da temuwamuwan?","我們目前的環境為什麼是這樣呢？是祖先的叮嚀？","https://web.klokah.tw/text/sound/26908/440090.mp3"
"tu kinuwaceng da viruwa? tu vinuut da demaway?","是魔鬼的破壞？是創物者的怒吼嗎？","https://web.klokah.tw/text/sound/26908/440091.mp3"
"amelri, mau inta na adi lraman data kinaduwan awlrak! ta pakirungecay kemiyanger di seme’era ta kanini na waywayan a.","還是，我們自己不珍惜居住的地方呢？讓我們深思並重視這個問題吧！","https://web.klokah.tw/text/sound/26908/440092.mp3"
"adiyu diya na Pinuyumayan tu sinasarem na akanen mu, mau na dawa, kalumayan, vurasi, vu’ir di uma’i diya,","早期卑南族部落的傳統農產品有小米、陸稻、蕃薯、芋頭、樹豆等農作物；","https://web.klokah.tw/text/sound/26909/440112.mp3"
"kana kurelrang muvalivalis da kakuwayanan mu,","隨著時代的改變，糖廠紛紛設立以後","https://web.klokah.tw/text/sound/26909/440113.mp3"
"ulra lra na kaysiya kurelrang ta semarem da valikuway, likudan lra miturus ta diya kana Nokay semarem da re’a,","族人即開始種植甘蔗，接著農會技術指導下也種植了鳳梨。","https://web.klokah.tw/text/sound/26909/440114.mp3"
"palru harem kana ulra i Kayloziyo na micepa remkedang sumukun kana sasareman, tu ipatalratalram na micepa diya kema mu,","直到近幾年，農業改良場研發出一種水果→即釋迦，","https://web.klokah.tw/text/sound/26909/440115.mp3"
"inta kani i Valangaw ta pinidare’an lra na wari lra, mau nantu kinarepauwa semarem da kiday kema.","認為台東是種植釋迦最為合適的環境。","https://web.klokah.tw/text/sound/26909/440116.mp3"
"kemay kanidu lra pureha na Nokay micepa semasukun i dekadekalr da naniwanan di cacima’an da kiday,","於是農會開始推廣各部落成立釋迦的產銷班","https://web.klokah.tw/text/sound/26909/440117.mp3"
"kana kipanadanadam lra kantu kakilungecan da sasareman mu, pureha lra ra’emec di pakasa datu sinareman da kiday.","族人在接受農業技術訓練後，即開始積極種植釋迦","https://web.klokah.tw/text/sound/26909/440118.mp3"
"semarem ta da kiday mu, putayhi ta, lralrempit ta da calunan, pucemer ta diya, di nu ’aremeng mukuwa ta diya puvuwa’a kantu ’apuc, cemavu ta diya kemaysayasaya,","種植釋迦需要施肥、拔草、噴藥、夜間授粉、一個個包裝釋迦等等工作","https://web.klokah.tw/text/sound/26909/440119.mp3"
"salaw kauleulep nani na kiyakarunan, aymu, nu saya ’ami maruwa ta parepuwan kiyakiday meniwan, kemani kana micima’ nani na sinareman,","過程非常辛苦，但卻能於一年中收成兩次","https://web.klokah.tw/text/sound/26909/440120.mp3"
"di maremucima’ kana duma na sinareman diya di maruwa ta paka’inava data inuvaawan i ruma’,","論其經濟價值，利潤遠較其他水果高；","https://web.klokah.tw/text/sound/26909/440121.mp3"
"di marekakaduwan lra na mikikarunan kana kiday,","如此高經濟的農產品，不但改善家庭生計","https://web.klokah.tw/text/sound/26909/440122.mp3"
"harem na kiday mu, salaw pakamelri kanta i Valangaw, na muwa’uma diya ta mauwan mu, kaduwan lra na semasarem da kiday.","也造就許多族人的就業機會，現在釋迦已成為台東特有的農產品之一。","https://web.klokah.tw/text/sound/26909/440123.mp3"
"na patalram diya mekan kana kiday kani i Valangaw mu,","品嚐過的人，無不舉起大拇指喊「讚」！","https://web.klokah.tw/text/sound/26909/440124.mp3"
"tuy ulihuwan ini na vuwa’ mau nu duwa diya na mudadangi i Valangaw na cau mu, adi kaadi patalram mekan,","名氣因而遠播，成為到台東旅遊必嚐的水果","https://web.klokah.tw/text/sound/26909/440125.mp3"
"di mau nantu ipaka’inava na omiyagē.","且是旅遊者最佳的伴手禮。","https://web.klokah.tw/text/sound/26909/440126.mp3"
"ini na palakuwan mu salaw pinakapadangal kani i dekalr. kemay awacanan mu adi murareput.","巴拉冠對部落而言非常珍貴，自古以來從未間斷過。","https://web.klokah.tw/text/sound/26910/440127.mp3"
"nu rarengay ta kanini na palakuwan datu pauwayan mu, mau nantu nadanadaman na ma’a’inayan di tu waadukan da ma’a’inayan,","要說起巴拉冠的意義何在，就是要學習","https://web.klokah.tw/text/sound/26910/440128.mp3"
"nu pacepa kadu a rehelran di mau na cau na kadu i henan mutudaemaeman, nu kadu ta i dekalr ulra a kakudain mu,","如果遇到緊急事件、或是山野的緊急災難","https://web.klokah.tw/text/sound/26910/440129.mp3"
